timestamp	old_score	new_score	delta	status	description
2026-04-07T20:29:34Z	0.805718	0.802054	-0.003664	discard	mutate [7] skill:FUNC_QUADRATICâ†’FUNC_TRANSFORM; arch:constraint_optimization_chainâ†’spatial_coordinate_bridge; style:applied_real_worldâ†’modelling; mechs:[cross_topic_synthesis,multi_representation,proof_unfamiliar_context]
2026-04-07T21:25:20Z	0.805718	0.802547	-0.003171	discard	mutate [7] skill:FUNC_QUADRATICâ†’FUNC_TRANSFORM; arch:constraint_optimization_chainâ†’spatial_coordinate_bridge; style:applied_real_worldâ†’modelling; mechs:[multi_representation,cross_topic_synthesis,hidden_structure]
2026-04-07T22:04:17Z	0.805718	0.802571	-0.003147	discard	mutate [7] skill:FUNC_QUADRATICâ†’FUNC_GRAPH_SKETCH; arch:constraint_optimization_chainâ†’representation_bridge; style:applied_real_worldâ†’modelling; mechs:[multi_representation,proof_unfamiliar_context,hidden_structure]
2026-04-07T22:56:42Z	0.805718	0.802719	-0.002999	discard	mutate [7] skill:FUNC_QUADRATICâ†’FUNC_TRANSFORM; arch:constraint_optimization_chainâ†’spatial_coordinate_bridge; style:applied_real_worldâ†’modelling; mechs:[cross_topic_synthesis,hidden_structure,proof_unfamiliar_context]
2026-04-07T23:36:25Z	0.805718	0.803157	-0.002561	discard	mutate [7] skill:FUNC_QUADRATICâ†’FUNC_TRANSFORM; arch:constraint_optimization_chainâ†’spatial_coordinate_bridge; style:applied_real_worldâ†’modelling; mechs:[multi_representation,hidden_structure,hence_chains]
2026-04-08T00:07:00Z	0.805718	0.802214	-0.003504	discard	mutate [7] skill:FUNC_QUADRATICâ†’FUNC_TRANSFORM; arch:constraint_optimization_chainâ†’spatial_coordinate_bridge; style:applied_real_worldâ†’modelling; mechs:[cross_topic_synthesis,hidden_structure,multi_representation,proof_unfamiliar_context]
2026-04-08T03:30:53Z	0.805718	0.803154	-0.002564	discard	mutate [7] skill:FUNC_QUADRATICâ†’FUNC_TRANSFORM; arch:constraint_optimization_chainâ†’spatial_coordinate_bridge; style:applied_real_worldâ†’modelling; mechs:[cross_topic_synthesis,multi_representation,proof_unfamiliar_context]
2026-04-08T05:29:55Z	0.805718	0.803451	-0.002267	discard	mutate [7] skill:FUNC_QUADRATICâ†’FUNC_GRAPH_SKETCH; arch:constraint_optimization_chainâ†’representation_bridge; style:applied_real_worldâ†’modelling; mechs:[hidden_structure,multi_representation,proof_unfamiliar_context]
2026-04-08T06:56:52Z	0.805718	0.803135	-0.002583	discard	mutate [7] skill:FUNC_QUADRATICâ†’FUNC_TRANSFORM; arch:constraint_optimization_chainâ†’spatial_coordinate_bridge; style:applied_real_worldâ†’modelling; mechs:[cross_topic_synthesis,hidden_structure,proof_unfamiliar_context]
2026-04-08T08:12:46Z	0.805718	0.802024	-0.003694	discard	mutate [7] skill:FUNC_QUADRATICâ†’FUNC_TRANSFORM; arch:constraint_optimization_chainâ†’spatial_coordinate_bridge; style:applied_real_worldâ†’modelling; mechs:[cross_topic_synthesis,proof_unfamiliar_context,multi_representation]
2026-04-08T09:37:33Z	0.805718	0.802932	-0.002786	discard	mutate [7] skill:FUNC_QUADRATICâ†’FUNC_TRANSFORM; arch:constraint_optimization_chainâ†’spatial_coordinate_bridge; style:applied_real_worldâ†’modelling; mechs:[cross_topic_synthesis,multi_representation,proof_unfamiliar_context]
2026-04-08T10:42:14Z	0.805718	0.802592	-0.003126	discard	mutate [7] skill:FUNC_QUADRATICâ†’FUNC_GRAPH_SKETCH; arch:constraint_optimization_chainâ†’representation_bridge; style:applied_real_worldâ†’modelling; mechs:[multi_representation,hidden_structure,proof_unfamiliar_context]
2026-04-08T11:42:34Z	0.805718	0.803189	-0.002529	discard	mutate [7] skill:FUNC_QUADRATICâ†’FUNC_TRANSFORM; arch:constraint_optimization_chainâ†’spatial_coordinate_bridge; style:applied_real_worldâ†’modelling; mechs:[multi_representation,cross_topic_synthesis,hidden_structure]
2026-04-08T12:46:45Z	0.805718	0.803741	-0.001977	discard	mutate [7] skill:FUNC_QUADRATICâ†’FUNC_TRANSFORM; arch:constraint_optimization_chainâ†’spatial_coordinate_bridge; style:applied_real_worldâ†’modelling; mechs:[multi_representation,cross_topic_synthesis,hidden_structure]
2026-04-08T14:22:20Z	0.805718	0.803852	-0.001866	discard	mutate [7] skill:FUNC_QUADRATICâ†’FUNC_TRANSFORM; arch:constraint_optimization_chainâ†’spatial_coordinate_bridge; style:applied_real_worldâ†’modelling; mechs:[cross_topic_synthesis,multi_representation,hidden_structure]
2026-04-08T15:56:10Z	0.805718	0.803476	-0.002242	discard	mutate [7] skill:FUNC_QUADRATICâ†’FUNC_SUM_PRODUCT_ROOTS; arch:constraint_optimization_chainâ†’spatial_coordinate_bridge; style:applied_real_worldâ†’modelling; mechs:[cross_topic_synthesis,multi_representation,hence_chains]
2026-04-08T17:00:21Z	0.805718	0.803736	-0.001982	discard	mutate [7] skill:FUNC_QUADRATICâ†’FUNC_TRANSFORM; arch:constraint_optimization_chainâ†’spatial_coordinate_bridge; style:applied_real_worldâ†’modelling; mechs:[cross_topic_synthesis,multi_representation,proof_unfamiliar_context]
2026-04-08T18:13:44Z	0.805718	0.803325	-0.002393	discard	mutate [7] skill:FUNC_QUADRATICâ†’FUNC_TRANSFORM; arch:constraint_optimization_chainâ†’spatial_coordinate_bridge; style:applied_real_worldâ†’modelling; mechs:[cross_topic_synthesis,multi_representation,proof_unfamiliar_context,hence_chains]
2026-04-08T19:43:35Z	0.805718	0.803926	-0.001792	discard	mutate [7] skill:FUNC_QUADRATICâ†’FUNC_TRANSFORM; arch:constraint_optimization_chainâ†’spatial_coordinate_bridge; style:applied_real_worldâ†’modelling; mechs:[multi_representation,cross_topic_synthesis,proof_unfamiliar_context]
2026-04-08T20:27:03Z	0.805718	0.803051	-0.002667	discard	mutate [7] skill:FUNC_QUADRATICâ†’FUNC_TRANSFORM; arch:constraint_optimization_chainâ†’spatial_coordinate_bridge; style:applied_real_worldâ†’modelling; mechs:[multi_representation,proof_unfamiliar_context,cross_topic_synthesis]
2026-04-08T21:11:06Z	0.805718	0.801669	-0.004049	discard	mutate [7] skill:FUNC_QUADRATICâ†’FUNC_RATIONAL; arch:constraint_optimization_chainâ†’representation_bridge; style:applied_real_worldâ†’modelling; mechs:[multi_representation,hidden_structure,cross_topic_synthesis]
2026-04-08T22:01:43Z	0.000000	0.000000	+0.000000	crash	error: Missing required field: question
2026-04-08T22:55:06Z	0.805718	0.801933	-0.003785	discard	mutate [7] skill:FUNC_QUADRATICâ†’FUNC_TRANSFORM; arch:constraint_optimization_chainâ†’spatial_coordinate_bridge; style:applied_real_worldâ†’modelling; mechs:[multi_representation,cross_topic_synthesis,proof_unfamiliar_context]
2026-04-08T23:37:12Z	0.805718	0.802183	-0.003535	discard	mutate [7] skill:FUNC_QUADRATICâ†’FUNC_TRANSFORM; arch:constraint_optimization_chainâ†’spatial_coordinate_bridge; style:applied_real_worldâ†’modelling; mechs:[cross_topic_synthesis,multi_representation,hidden_structure]
2026-04-09T00:03:47Z	0.805718	0.803131	-0.002587	discard	mutate [7] skill:FUNC_QUADRATICâ†’FUNC_TRANSFORM; arch:constraint_optimization_chainâ†’spatial_coordinate_bridge; style:applied_real_worldâ†’modelling; mechs:[multi_representation,cross_topic_synthesis,hence_chains]
2026-04-09T03:26:18Z	0.805718	0.802202	-0.003516	discard	mutate [7] skill:FUNC_QUADRATICâ†’FUNC_TRANSFORM; arch:constraint_optimization_chainâ†’spatial_coordinate_bridge; style:applied_real_worldâ†’modelling; mechs:[multi_representation,cross_topic_synthesis,hidden_structure]
2026-04-09T05:27:51Z	0.805718	0.802009	-0.003709	discard	mutate [7] skill:FUNC_QUADRATICâ†’FUNC_TRANSFORM; arch:constraint_optimization_chainâ†’representation_bridge; style:applied_real_worldâ†’modelling; mechs:[cross_topic_synthesis,proof_unfamiliar_context,hence_chains]
2026-04-09T06:57:30Z	0.805718	0.803221	-0.002497	discard	mutate [7] skill:FUNC_QUADRATICâ†’FUNC_GRAPH_SKETCH; arch:constraint_optimization_chainâ†’representation_bridge; style:applied_real_worldâ†’modelling; mechs:[cross_topic_synthesis,hidden_structure,proof_unfamiliar_context]
2026-04-09T08:21:25Z	0.805718	0.802926	-0.002792	discard	mutate [7] skill:FUNC_QUADRATICâ†’FUNC_TRANSFORM; arch:constraint_optimization_chainâ†’spatial_coordinate_bridge; style:applied_real_worldâ†’modelling; mechs:[cross_topic_synthesis,proof_unfamiliar_context,constraint_reasoning]
2026-04-09T09:45:41Z	0.805718	0.802199	-0.003519	discard	mutate [7] skill:FUNC_QUADRATICâ†’FUNC_TRANSFORM; arch:constraint_optimization_chainâ†’spatial_coordinate_bridge; style:applied_real_worldâ†’modelling; mechs:[multi_representation,cross_topic_synthesis,proof_unfamiliar_context,hence_chains]
2026-04-09T10:49:21Z	0.805718	0.802111	-0.003607	discard	mutate [7] skill:FUNC_QUADRATICâ†’FUNC_TRANSFORM; arch:constraint_optimization_chainâ†’spatial_coordinate_bridge; style:applied_real_worldâ†’modelling; mechs:[cross_topic_synthesis,hidden_structure,proof_unfamiliar_context,constraint_reasoning]
2026-04-09T11:42:24Z	0.805718	0.803954	-0.001764	discard	mutate [7] skill:FUNC_QUADRATICâ†’FUNC_TRANSFORM; arch:constraint_optimization_chainâ†’spatial_coordinate_bridge; style:applied_real_worldâ†’modelling; mechs:[multi_representation,cross_topic_synthesis,proof_unfamiliar_context]
2026-04-09T12:50:09Z	0.805718	0.801866	-0.003852	discard	mutate [7] skill:FUNC_QUADRATICâ†’FUNC_TRANSFORM; arch:constraint_optimization_chainâ†’spatial_coordinate_bridge; style:applied_real_worldâ†’modelling; mechs:[multi_representation,hidden_structure,proof_unfamiliar_context]
2026-04-09T14:32:44Z	0.805718	0.801907	-0.003811	discard	mutate [7] skill:FUNC_QUADRATICâ†’FUNC_TRANSFORM; arch:constraint_optimization_chainâ†’spatial_coordinate_bridge; style:applied_real_worldâ†’modelling; mechs:[multi_representation,cross_topic_synthesis,hence_chains,proof_unfamiliar_context]
2026-04-09T16:07:39Z	0.805718	0.803880	-0.001838	discard	mutate [7] skill:FUNC_QUADRATICâ†’FUNC_TRANSFORM; arch:constraint_optimization_chainâ†’representation_bridge; style:applied_real_worldâ†’modelling; mechs:[proof_unfamiliar_context,hidden_structure,multi_representation]
2026-04-09T17:21:22Z	0.805718	0.802108	-0.003610	discard	mutate [7] skill:FUNC_QUADRATICâ†’FUNC_TRANSFORM; arch:constraint_optimization_chainâ†’representation_bridge; style:applied_real_worldâ†’modelling; mechs:[multi_representation,hidden_structure,proof_unfamiliar_context]
2026-04-09T18:14:16Z	0.000000	0.000000	+0.000000	crash	error: 503 UNAVAILABLE. {'error': {'code': 503, 'message': 'This model is currently experiencing high deman
2026-04-09T19:42:09Z	0.805718	0.801524	-0.004194	discard	mutate [7] skill:FUNC_QUADRATICâ†’FUNC_RATIONAL; arch:constraint_optimization_chainâ†’representation_bridge; style:applied_real_worldâ†’modelling; mechs:[multi_representation,proof_unfamiliar_context,cross_topic_synthesis]
2026-04-09T20:36:40Z	0.805718	0.802031	-0.003687	discard	mutate [7] skill:FUNC_QUADRATICâ†’FUNC_TRANSFORM; arch:constraint_optimization_chainâ†’spatial_coordinate_bridge; style:applied_real_worldâ†’modelling; mechs:[cross_topic_synthesis,proof_unfamiliar_context,multi_representation]
2026-04-09T21:29:09Z	0.805718	0.802893	-0.002825	discard	mutate [7] skill:FUNC_QUADRATICâ†’FUNC_TRANSFORM; arch:constraint_optimization_chainâ†’spatial_coordinate_bridge; style:applied_real_worldâ†’modelling; mechs:[cross_topic_synthesis,proof_unfamiliar_context,hence_chains]
2026-04-09T22:08:19Z	0.805718	0.803952	-0.001766	discard	mutate [7] skill:FUNC_QUADRATICâ†’FUNC_TRANSFORM; arch:constraint_optimization_chainâ†’spatial_coordinate_bridge; style:applied_real_worldâ†’modelling; mechs:[multi_representation,cross_topic_synthesis,proof_unfamiliar_context]
2026-04-09T22:59:12Z	0.000000	0.000000	+0.000000	crash	error: 503 UNAVAILABLE. {'error': {'code': 503, 'message': 'This model is currently experiencing high deman
2026-04-09T23:46:41Z	0.805718	0.802135	-0.003583	discard	mutate [7] skill:FUNC_QUADRATICâ†’FUNC_TRANSFORM; arch:constraint_optimization_chainâ†’spatial_coordinate_bridge; style:applied_real_worldâ†’modelling; mechs:[cross_topic_synthesis,multi_representation,proof_unfamiliar_context]
2026-04-10T01:05:40Z	0.805718	0.803271	-0.002447	discard	mutate [7] skill:FUNC_QUADRATICâ†’FUNC_TRANSFORM; arch:constraint_optimization_chainâ†’spatial_coordinate_bridge; style:applied_real_worldâ†’modelling; mechs:[multi_representation,cross_topic_synthesis,proof_unfamiliar_context]
2026-04-10T04:16:44Z	0.805718	0.802141	-0.003577	discard	mutate [7] skill:FUNC_QUADRATICâ†’FUNC_TRANSFORM; arch:constraint_optimization_chainâ†’spatial_coordinate_bridge; style:applied_real_worldâ†’modelling; mechs:[multi_representation,cross_topic_synthesis,proof_unfamiliar_context]
2026-04-10T06:11:20Z	0.805718	0.801945	-0.003773	discard	mutate [7] skill:FUNC_QUADRATICâ†’FUNC_TRANSFORM; arch:constraint_optimization_chainâ†’spatial_coordinate_bridge; style:applied_real_worldâ†’modelling; mechs:[cross_topic_synthesis,hidden_structure,multi_representation,proof_unfamiliar_context]
2026-04-10T08:00:09Z	0.805718	0.802062	-0.003656	discard	mutate [7] skill:FUNC_QUADRATICâ†’FUNC_TRANSFORM; arch:constraint_optimization_chainâ†’spatial_coordinate_bridge; style:applied_real_worldâ†’modelling; mechs:[cross_topic_synthesis,multi_representation,proof_unfamiliar_context]
2026-04-10T09:20:43Z	0.805718	0.802340	-0.003378	discard	mutate [7] skill:FUNC_QUADRATICâ†’FUNC_TRANSFORM; arch:constraint_optimization_chainâ†’generalization_from_special_case; style:applied_real_worldâ†’modelling; mechs:[cross_topic_synthesis,hidden_structure,proof_unfamiliar_context]
2026-04-10T10:32:20Z	0.805718	0.803031	-0.002687	discard	mutate [7] skill:FUNC_QUADRATICâ†’FUNC_TRANSFORM; arch:constraint_optimization_chainâ†’spatial_coordinate_bridge; style:applied_real_worldâ†’modelling; mechs:[cross_topic_synthesis,proof_unfamiliar_context,multi_representation]
2026-04-10T11:31:12Z	0.805718	0.802745	-0.002973	discard	mutate [7] skill:FUNC_QUADRATICâ†’FUNC_TRANSFORM; arch:constraint_optimization_chainâ†’spatial_coordinate_bridge; style:applied_real_worldâ†’modelling; mechs:[cross_topic_synthesis,multi_representation,proof_unfamiliar_context]
2026-04-10T12:09:11Z	0.805718	0.802766	-0.002952	discard	mutate [7] skill:FUNC_QUADRATICâ†’FUNC_TRANSFORM; arch:constraint_optimization_chainâ†’spatial_coordinate_bridge; style:applied_real_worldâ†’modelling; mechs:[cross_topic_synthesis,hidden_structure,proof_unfamiliar_context]
2026-04-10T13:48:56Z	0.805718	0.801662	-0.004056	discard	mutate [7] skill:FUNC_QUADRATICâ†’FUNC_RATIONAL; arch:constraint_optimization_chainâ†’representation_bridge; style:applied_real_worldâ†’modelling; mechs:[multi_representation,hidden_structure,cross_topic_synthesis]
2026-04-10T14:41:17Z	0.805718	0.801957	-0.003761	discard	mutate [7] skill:FUNC_QUADRATICâ†’FUNC_TRANSFORM; arch:constraint_optimization_chainâ†’spatial_coordinate_bridge; style:applied_real_worldâ†’modelling; mechs:[multi_representation,proof_unfamiliar_context,hidden_structure]
2026-04-10T15:32:51Z	0.000000	0.000000	+0.000000	crash	error: 503 UNAVAILABLE. {'error': {'code': 503, 'message': 'This model is currently experiencing high deman
2026-04-10T16:33:03Z	0.805718	0.803253	-0.002465	discard	mutate [7] skill:FUNC_QUADRATICâ†’FUNC_TRANSFORM; arch:constraint_optimization_chainâ†’spatial_coordinate_bridge; style:applied_real_worldâ†’modelling; mechs:[multi_representation,cross_topic_synthesis,proof_unfamiliar_context]
2026-04-10T17:31:46Z	0.805718	0.802023	-0.003695	discard	mutate [7] skill:FUNC_QUADRATICâ†’FUNC_TRANSFORM; arch:constraint_optimization_chainâ†’spatial_coordinate_bridge; style:applied_real_worldâ†’modelling; mechs:[cross_topic_synthesis,multi_representation,hidden_structure]
2026-04-10T18:11:52Z	0.805718	0.802967	-0.002751	discard	mutate [7] skill:FUNC_QUADRATICâ†’FUNC_TRANSFORM; arch:constraint_optimization_chainâ†’spatial_coordinate_bridge; style:applied_real_worldâ†’modelling; mechs:[cross_topic_synthesis,multi_representation,hence_chains]
2026-04-10T19:15:17Z	0.805718	0.801565	-0.004153	discard	mutate [7] skill:FUNC_QUADRATICâ†’FUNC_RATIONAL; arch:constraint_optimization_chainâ†’representation_bridge; style:applied_real_worldâ†’modelling; mechs:[multi_representation,proof_unfamiliar_context,cross_topic_synthesis,hence_chains]
2026-04-10T19:57:37Z	0.805718	0.802551	-0.003167	discard	mutate [7] skill:FUNC_QUADRATICâ†’FUNC_TRANSFORM; arch:constraint_optimization_chainâ†’spatial_coordinate_bridge; style:applied_real_worldâ†’modelling; mechs:[proof_unfamiliar_context,cross_topic_synthesis,multi_representation]
2026-04-10T20:40:15Z	0.805718	0.803288	-0.002430	discard	mutate [7] skill:FUNC_QUADRATICâ†’FUNC_TRANSFORM; arch:constraint_optimization_chainâ†’spatial_coordinate_bridge; style:applied_real_worldâ†’modelling; mechs:[multi_representation,cross_topic_synthesis,hidden_structure,proof_unfamiliar_context]
2026-04-10T21:20:57Z	0.805718	0.801953	-0.003765	discard	mutate [7] skill:FUNC_QUADRATICâ†’FUNC_TRANSFORM; arch:constraint_optimization_chainâ†’spatial_coordinate_bridge; style:applied_real_worldâ†’modelling; mechs:[multi_representation,cross_topic_synthesis,constraint_reasoning]
2026-04-10T21:58:22Z	0.805718	0.802977	-0.002741	discard	mutate [7] skill:FUNC_QUADRATICâ†’FUNC_TRANSFORM; arch:constraint_optimization_chainâ†’spatial_coordinate_bridge; style:applied_real_worldâ†’modelling; mechs:[multi_representation,cross_topic_synthesis,hidden_structure]
2026-04-10T22:40:44Z	0.805718	0.802643	-0.003075	discard	mutate [7] skill:FUNC_QUADRATICâ†’FUNC_TRANSFORM; arch:constraint_optimization_chainâ†’spatial_coordinate_bridge; style:applied_real_worldâ†’modelling; mechs:[cross_topic_synthesis,multi_representation,proof_unfamiliar_context]
2026-04-10T23:21:47Z	0.805718	0.802757	-0.002961	discard	mutate [7] skill:FUNC_QUADRATICâ†’FUNC_TRANSFORM; arch:constraint_optimization_chainâ†’spatial_coordinate_bridge; style:applied_real_worldâ†’modelling; mechs:[cross_topic_synthesis,proof_unfamiliar_context,hence_chains]
2026-04-10T23:56:21Z	0.805718	0.802796	-0.002922	discard	mutate [7] skill:FUNC_QUADRATICâ†’FUNC_GRAPH_SKETCH; arch:constraint_optimization_chainâ†’representation_bridge; style:applied_real_worldâ†’modelling; mechs:[multi_representation,hidden_structure,proof_unfamiliar_context]
2026-04-11T02:02:25Z	0.000000	0.000000	+0.000000	crash	error: 503 UNAVAILABLE. {'error': {'code': 503, 'message': 'This model is currently experiencing high deman
2026-04-11T04:29:24Z	0.805718	0.802017	-0.003701	discard	mutate [7] skill:FUNC_QUADRATICâ†’FUNC_TRANSFORM; arch:constraint_optimization_chainâ†’spatial_coordinate_bridge; style:applied_real_worldâ†’modelling; mechs:[cross_topic_synthesis,hidden_structure,proof_unfamiliar_context]
2026-04-11T05:46:00Z	0.805718	0.802591	-0.003127	discard	mutate [7] skill:FUNC_QUADRATICâ†’FUNC_GRAPH_SKETCH; arch:constraint_optimization_chainâ†’representation_bridge; style:applied_real_worldâ†’modelling; mechs:[multi_representation,hidden_structure]
2026-04-11T06:44:52Z	0.805718	0.801891	-0.003827	discard	mutate [7] skill:FUNC_QUADRATICâ†’FUNC_RATIONAL; arch:constraint_optimization_chainâ†’representation_bridge; style:applied_real_worldâ†’modelling; mechs:[hidden_structure,multi_representation,proof_unfamiliar_context]
2026-04-11T07:40:28Z	0.805718	0.802564	-0.003154	discard	mutate [7] skill:FUNC_QUADRATICâ†’FUNC_GRAPH_SKETCH; arch:constraint_optimization_chainâ†’representation_bridge; style:applied_real_worldâ†’modelling; mechs:[multi_representation,hidden_structure,proof_unfamiliar_context]
2026-04-11T08:26:21Z	0.805718	0.801811	-0.003907	discard	mutate [7] skill:FUNC_QUADRATICâ†’FUNC_TRANSFORM; arch:constraint_optimization_chainâ†’spatial_coordinate_bridge; style:applied_real_worldâ†’pure_abstract; mechs:[cross_topic_synthesis,multi_representation,hidden_structure]
2026-04-11T09:08:08Z	0.805718	0.802627	-0.003091	discard	mutate [7] skill:FUNC_QUADRATICâ†’FUNC_TRANSFORM; arch:constraint_optimization_chainâ†’spatial_coordinate_bridge; style:applied_real_worldâ†’modelling; mechs:[multi_representation,cross_topic_synthesis,proof_unfamiliar_context]
2026-04-11T09:56:04Z	0.805718	0.802014	-0.003704	discard	mutate [7] skill:FUNC_QUADRATICâ†’FUNC_TRANSFORM; arch:constraint_optimization_chainâ†’spatial_coordinate_bridge; style:applied_real_worldâ†’modelling; mechs:[cross_topic_synthesis,hidden_structure,hence_chains,proof_unfamiliar_context]
2026-04-11T10:33:09Z	0.805718	0.803292	-0.002426	discard	mutate [7] skill:FUNC_QUADRATICâ†’FUNC_GRAPH_SKETCH; arch:constraint_optimization_chainâ†’representation_bridge; style:applied_real_worldâ†’modelling; mechs:[multi_representation,hidden_structure,proof_unfamiliar_context]
2026-04-11T11:06:29Z	0.805718	0.804041	-0.001677	discard	mutate [7] skill:FUNC_QUADRATICâ†’FUNC_TRANSFORM; arch:constraint_optimization_chainâ†’spatial_coordinate_bridge; style:applied_real_worldâ†’modelling; mechs:[multi_representation,proof_unfamiliar_context,hidden_structure]
2026-04-11T11:42:40Z	0.805718	0.802124	-0.003594	discard	mutate [7] skill:FUNC_QUADRATICâ†’FUNC_TRANSFORM; arch:constraint_optimization_chainâ†’spatial_coordinate_bridge; style:applied_real_worldâ†’modelling; mechs:[cross_topic_synthesis,multi_representation,proof_unfamiliar_context]
2026-04-11T12:04:25Z	0.805718	0.802003	-0.003715	discard	mutate [7] skill:FUNC_QUADRATICâ†’FUNC_TRANSFORM; arch:constraint_optimization_chainâ†’spatial_coordinate_bridge; style:applied_real_worldâ†’modelling; mechs:[multi_representation,cross_topic_synthesis,proof_unfamiliar_context]
2026-04-11T13:21:44Z	0.805718	0.803463	-0.002255	discard	mutate [7] skill:FUNC_QUADRATICâ†’FUNC_TRANSFORM; arch:constraint_optimization_chainâ†’spatial_coordinate_bridge; style:applied_real_worldâ†’modelling; mechs:[cross_topic_synthesis,hidden_structure,proof_unfamiliar_context]
2026-04-11T14:06:30Z	0.805718	0.803496	-0.002222	discard	mutate [7] skill:FUNC_QUADRATICâ†’FUNC_TRANSFORM; arch:constraint_optimization_chainâ†’spatial_coordinate_bridge; style:applied_real_worldâ†’modelling; mechs:[multi_representation,cross_topic_synthesis,hidden_structure,proof_unfamiliar_context]
