timestamp	old_score	new_score	delta	status	description
2026-03-22T12:01:41Z	0.804977	0.800518	-0.004459	discard	mutate [7] skill:FUNC_TRANSFORMâ†’FUNC_RATIONAL; arch:generalization_from_special_caseâ†’representation_bridge; style:modellingâ†’applied_real_world; mechs:[cross_topic_synthesis,hidden_structure,constraint_reasoning,hence_chains]
2026-03-22T13:12:37Z	0.804977	0.800671	-0.004306	discard	mutate [7] skill:FUNC_TRANSFORMâ†’FUNC_QUADRATIC; arch:generalization_from_special_caseâ†’constraint_optimization_chain; style:modellingâ†’applied_real_world; mechs:[constraint_reasoning,cross_topic_synthesis,hence_chains]
2026-03-22T13:55:29Z	0.804977	0.801362	-0.003615	discard	mutate [7] skill:FUNC_TRANSFORMâ†’FUNC_QUADRATIC; arch:generalization_from_special_caseâ†’constraint_optimization_chain; style:modellingâ†’applied_real_world; mechs:[constraint_reasoning,cross_topic_synthesis,hence_chains]
2026-03-22T14:26:59Z	0.804977	0.800166	-0.004811	discard	mutate [7] skill:FUNC_TRANSFORMâ†’FUNC_RATIONAL; arch:generalization_from_special_caseâ†’constraint_optimization_chain; style:modellingâ†’applied_real_world; mechs:[constraint_reasoning,cross_topic_synthesis,hence_chains]
2026-03-22T14:55:07Z	0.804977	0.800818	-0.004159	discard	mutate [7] skill:FUNC_TRANSFORMâ†’FUNC_QUADRATIC; arch:generalization_from_special_caseâ†’constraint_optimization_chain; style:modellingâ†’applied_real_world; mechs:[constraint_reasoning,cross_topic_synthesis,hence_chains]
2026-03-22T15:25:17Z	0.804977	0.800115	-0.004862	discard	mutate [7] skill:FUNC_TRANSFORMâ†’FUNC_QUADRATIC; arch:generalization_from_special_caseâ†’constraint_optimization_chain; style:modellingâ†’applied_real_world; mechs:[constraint_reasoning,hence_chains,cross_topic_synthesis]
2026-03-22T15:50:12Z	0.804977	0.800749	-0.004228	discard	mutate [7] skill:FUNC_TRANSFORMâ†’FUNC_QUADRATIC; arch:generalization_from_special_caseâ†’constraint_optimization_chain; style:modellingâ†’applied_real_world; mechs:[constraint_reasoning,cross_topic_synthesis,hence_chains]
2026-03-22T16:03:07Z	0.804977	0.801174	-0.003803	discard	mutate [7] skill:FUNC_TRANSFORMâ†’FUNC_QUADRATIC; arch:generalization_from_special_caseâ†’constraint_optimization_chain; style:modellingâ†’applied_real_world; mechs:[constraint_reasoning,cross_topic_synthesis,hence_chains]
2026-03-22T16:47:12Z	0.804977	0.800595	-0.004382	discard	mutate [7] skill:FUNC_TRANSFORMâ†’FUNC_QUADRATIC; arch:generalization_from_special_caseâ†’constraint_optimization_chain; style:modellingâ†’applied_real_world; mechs:[constraint_reasoning,hence_chains,cross_topic_synthesis,hidden_structure]
2026-03-22T17:05:00Z	0.804977	0.801447	-0.003530	discard	mutate [7] skill:FUNC_TRANSFORMâ†’FUNC_QUADRATIC; arch:generalization_from_special_caseâ†’constraint_optimization_chain; style:modellingâ†’applied_real_world; mechs:[constraint_reasoning,hence_chains]
2026-03-22T17:38:55Z	0.804977	0.800665	-0.004312	discard	mutate [7] skill:FUNC_TRANSFORMâ†’FUNC_QUADRATIC; arch:generalization_from_special_caseâ†’constraint_optimization_chain; style:modellingâ†’applied_real_world; mechs:[constraint_reasoning,hence_chains,cross_topic_synthesis]
2026-03-22T17:57:43Z	0.804977	0.800649	-0.004328	discard	mutate [7] skill:FUNC_TRANSFORMâ†’FUNC_QUADRATIC; arch:generalization_from_special_caseâ†’constraint_optimization_chain; style:modellingâ†’applied_real_world; mechs:[constraint_reasoning,cross_topic_synthesis,hence_chains]
2026-03-22T18:40:53Z	0.804977	0.801179	-0.003798	discard	mutate [7] skill:FUNC_TRANSFORMâ†’FUNC_QUADRATIC; arch:generalization_from_special_caseâ†’constraint_optimization_chain; style:modellingâ†’applied_real_world; mechs:[constraint_reasoning,cross_topic_synthesis,hence_chains]
2026-03-22T19:06:42Z	0.804977	0.800709	-0.004268	discard	mutate [7] skill:FUNC_TRANSFORMâ†’FUNC_QUADRATIC; arch:generalization_from_special_caseâ†’constraint_optimization_chain; style:modellingâ†’applied_real_world; mechs:[constraint_reasoning,hence_chains,cross_topic_synthesis]
2026-03-22T19:37:56Z	0.804977	0.800703	-0.004274	discard	mutate [7] skill:FUNC_TRANSFORMâ†’FUNC_QUADRATIC; arch:generalization_from_special_caseâ†’constraint_optimization_chain; style:modellingâ†’applied_real_world; mechs:[constraint_reasoning,hence_chains,cross_topic_synthesis]
2026-03-22T19:53:40Z	0.804977	0.800655	-0.004322	discard	mutate [7] skill:FUNC_TRANSFORMâ†’FUNC_QUADRATIC; arch:generalization_from_special_caseâ†’constraint_optimization_chain; style:modellingâ†’applied_real_world; mechs:[constraint_reasoning,cross_topic_synthesis,hence_chains]
2026-03-22T20:26:35Z	0.804977	0.801220	-0.003757	discard	mutate [7] skill:FUNC_TRANSFORMâ†’FUNC_QUADRATIC; arch:generalization_from_special_caseâ†’constraint_optimization_chain; style:modellingâ†’applied_real_world; mechs:[constraint_reasoning,hence_chains,cross_topic_synthesis]
2026-03-22T20:52:51Z	0.804977	0.800917	-0.004060	discard	mutate [7] skill:FUNC_TRANSFORMâ†’FUNC_QUADRATIC; arch:generalization_from_special_caseâ†’constraint_optimization_chain; style:modellingâ†’applied_real_world; mechs:[constraint_reasoning,hence_chains,hidden_structure]
2026-03-22T21:25:21Z	0.804977	0.801363	-0.003614	discard	mutate [7] skill:FUNC_TRANSFORMâ†’FUNC_QUADRATIC; arch:generalization_from_special_caseâ†’constraint_optimization_chain; style:modellingâ†’applied_real_world; mechs:[constraint_reasoning,hence_chains,cross_topic_synthesis]
2026-03-22T21:50:24Z	0.804977	0.801417	-0.003560	discard	mutate [7] skill:FUNC_TRANSFORMâ†’FUNC_QUADRATIC; arch:generalization_from_special_caseâ†’constraint_optimization_chain; style:modellingâ†’applied_real_world; mechs:[constraint_reasoning,cross_topic_synthesis]
2026-03-22T22:02:32Z	0.804977	0.800082	-0.004895	discard	mutate [7] skill:FUNC_TRANSFORMâ†’FUNC_QUADRATIC; arch:generalization_from_special_caseâ†’constraint_optimization_chain; style:modellingâ†’applied_real_world; mechs:[constraint_reasoning,cross_topic_synthesis,hence_chains]
2026-03-22T22:42:10Z	0.804977	0.801284	-0.003693	discard	mutate [7] skill:FUNC_TRANSFORMâ†’FUNC_QUADRATIC; arch:generalization_from_special_caseâ†’constraint_optimization_chain; style:modellingâ†’applied_real_world; mechs:[constraint_reasoning,cross_topic_synthesis,hence_chains]
2026-03-22T23:03:53Z	0.804977	0.800775	-0.004202	discard	mutate [7] skill:FUNC_TRANSFORMâ†’FUNC_QUADRATIC; arch:generalization_from_special_caseâ†’constraint_optimization_chain; style:modellingâ†’applied_real_world; mechs:[constraint_reasoning,cross_topic_synthesis,hence_chains]
2026-03-22T23:41:53Z	0.804977	0.800098	-0.004879	discard	mutate [7] skill:FUNC_TRANSFORMâ†’FUNC_RATIONAL; arch:generalization_from_special_caseâ†’constraint_optimization_chain; style:modellingâ†’applied_real_world; mechs:[cross_topic_synthesis,constraint_reasoning,hence_chains]
2026-03-23T00:04:00Z	0.804977	0.800618	-0.004359	discard	mutate [7] skill:FUNC_TRANSFORMâ†’FUNC_QUADRATIC; arch:generalization_from_special_caseâ†’constraint_optimization_chain; style:modellingâ†’applied_real_world; mechs:[constraint_reasoning,cross_topic_synthesis,hence_chains]
2026-03-23T03:22:50Z	0.804977	0.800326	-0.004651	discard	mutate [7] skill:FUNC_TRANSFORMâ†’FUNC_QUADRATIC; arch:generalization_from_special_caseâ†’reverse_engineering; style:modellingâ†’applied_real_world; mechs:[cross_topic_synthesis,constraint_reasoning,hence_chains]
2026-03-23T05:21:14Z	0.804977	0.800162	-0.004815	discard	mutate [7] skill:FUNC_TRANSFORMâ†’FUNC_QUADRATIC; arch:generalization_from_special_caseâ†’constraint_optimization_chain; style:modellingâ†’applied_real_world; mechs:[constraint_reasoning,cross_topic_synthesis,hence_chains]
2026-03-23T06:44:57Z	0.804977	0.800677	-0.004300	discard	mutate [7] skill:FUNC_TRANSFORMâ†’FUNC_QUADRATIC; arch:generalization_from_special_caseâ†’constraint_optimization_chain; style:modellingâ†’applied_real_world; mechs:[constraint_reasoning,cross_topic_synthesis,hence_chains]
2026-03-23T07:50:33Z	0.000000	0.000000	+0.000000	crash	error: Invalid skill: FUNC_QUAD_STATIC
2026-03-23T08:39:40Z	0.804977	0.800330	-0.004647	discard	mutate [7] skill:FUNC_TRANSFORMâ†’FUNC_RATIONAL; arch:generalization_from_special_caseâ†’constraint_optimization_chain; style:modellingâ†’applied_real_world; mechs:[constraint_reasoning,hence_chains,cross_topic_synthesis]
2026-03-23T09:45:49Z	0.804977	0.801338	-0.003639	discard	mutate [7] skill:FUNC_TRANSFORMâ†’FUNC_QUADRATIC; arch:generalization_from_special_caseâ†’constraint_optimization_chain; style:modellingâ†’applied_real_world; mechs:[constraint_reasoning,hence_chains,cross_topic_synthesis]
2026-03-23T10:39:43Z	0.804977	0.801374	-0.003603	discard	mutate [7] skill:FUNC_TRANSFORMâ†’FUNC_QUADRATIC; arch:generalization_from_special_caseâ†’constraint_optimization_chain; style:modellingâ†’applied_real_world; mechs:[constraint_reasoning,cross_topic_synthesis,hence_chains]
2026-03-23T11:30:46Z	0.804977	0.800115	-0.004862	discard	mutate [7] skill:FUNC_TRANSFORMâ†’FUNC_QUADRATIC; arch:generalization_from_special_caseâ†’constraint_optimization_chain; style:modellingâ†’applied_real_world; mechs:[constraint_reasoning,hence_chains,cross_topic_synthesis]
2026-03-23T12:07:00Z	0.804977	0.801547	-0.003430	discard	mutate [7] skill:FUNC_TRANSFORMâ†’FUNC_QUADRATIC; arch:generalization_from_special_caseâ†’constraint_optimization_chain; style:modellingâ†’applied_real_world; mechs:[constraint_reasoning,hence_chains,cross_topic_synthesis]
2026-03-23T13:46:32Z	0.804977	0.801453	-0.003524	discard	mutate [7] skill:FUNC_TRANSFORMâ†’FUNC_QUADRATIC; arch:generalization_from_special_caseâ†’constraint_optimization_chain; style:modellingâ†’applied_real_world; mechs:[constraint_reasoning,cross_topic_synthesis,hence_chains]
2026-03-23T14:44:29Z	0.000000	0.000000	+0.000000	crash	error: 503 UNAVAILABLE. {'error': {'code': 503, 'message': 'This model is currently experiencing high deman
2026-03-23T15:45:39Z	0.804977	0.800055	-0.004922	discard	mutate [7] skill:FUNC_TRANSFORMâ†’FUNC_RATIONAL; arch:generalization_from_special_caseâ†’constraint_optimization_chain; style:modellingâ†’applied_real_world; mechs:[cross_topic_synthesis,constraint_reasoning,hence_chains]
2026-03-23T16:40:17Z	0.804977	0.801429	-0.003548	discard	mutate [7] skill:FUNC_TRANSFORMâ†’FUNC_QUADRATIC; arch:generalization_from_special_caseâ†’constraint_optimization_chain; style:modellingâ†’applied_real_world; mechs:[cross_topic_synthesis,hidden_structure,constraint_reasoning]
2026-03-23T17:34:39Z	0.804977	0.801378	-0.003599	discard	mutate [7] skill:FUNC_TRANSFORMâ†’FUNC_QUADRATIC; arch:generalization_from_special_caseâ†’constraint_optimization_chain; style:modellingâ†’applied_real_world; mechs:[constraint_reasoning,hence_chains,cross_topic_synthesis]
2026-03-23T18:30:10Z	0.804977	0.802405	-0.002572	discard	mutate [7] skill:FUNC_TRANSFORMâ†’FUNC_SUM_PRODUCT_ROOTS; arch:generalization_from_special_caseâ†’reverse_engineering; style:modellingâ†’applied_real_world; mechs:[cross_topic_synthesis,constraint_reasoning,hidden_structure]
2026-03-23T19:31:15Z	0.804977	0.801425	-0.003552	discard	mutate [7] skill:FUNC_TRANSFORMâ†’FUNC_QUADRATIC; arch:generalization_from_special_caseâ†’constraint_optimization_chain; style:modellingâ†’applied_real_world; mechs:[constraint_reasoning,cross_topic_synthesis,hence_chains]
2026-03-23T20:05:57Z	0.804977	0.801126	-0.003851	discard	mutate [7] skill:FUNC_TRANSFORMâ†’FUNC_QUADRATIC; arch:generalization_from_special_caseâ†’reverse_engineering; style:modellingâ†’applied_real_world; mechs:[hidden_structure,cross_topic_synthesis,constraint_reasoning]
2026-03-23T20:53:11Z	0.804977	0.800153	-0.004824	discard	mutate [7] skill:FUNC_TRANSFORMâ†’FUNC_QUADRATIC; arch:generalization_from_special_caseâ†’constraint_optimization_chain; style:modellingâ†’applied_real_world; mechs:[constraint_reasoning,hence_chains]
2026-03-23T21:35:24Z	0.804977	0.800570	-0.004407	discard	mutate [7] skill:FUNC_TRANSFORMâ†’FUNC_QUADRATIC; arch:generalization_from_special_caseâ†’constraint_optimization_chain; style:modellingâ†’applied_real_world; mechs:[constraint_reasoning,hence_chains,cross_topic_synthesis]
2026-03-23T22:01:51Z	0.804977	0.801226	-0.003751	discard	mutate [7] skill:FUNC_TRANSFORMâ†’FUNC_QUADRATIC; arch:generalization_from_special_caseâ†’constraint_optimization_chain; style:modellingâ†’applied_real_world; mechs:[constraint_reasoning,cross_topic_synthesis,hence_chains]
2026-03-23T22:51:21Z	0.804977	0.800543	-0.004434	discard	mutate [7] skill:FUNC_TRANSFORMâ†’FUNC_RATIONAL; arch:generalization_from_special_caseâ†’constraint_optimization_chain; style:modellingâ†’applied_real_world; mechs:[constraint_reasoning,cross_topic_synthesis,hence_chains,hidden_structure]
2026-03-23T23:20:46Z	0.804977	0.800470	-0.004507	discard	mutate [7] skill:FUNC_TRANSFORMâ†’FUNC_QUADRATIC; arch:generalization_from_special_caseâ†’constraint_optimization_chain; style:modellingâ†’applied_real_world; mechs:[hidden_structure,constraint_reasoning,cross_topic_synthesis,hence_chains]
2026-03-23T23:52:30Z	0.804977	0.800524	-0.004453	discard	mutate [7] skill:FUNC_TRANSFORMâ†’FUNC_QUADRATIC; arch:generalization_from_special_caseâ†’constraint_optimization_chain; style:modellingâ†’applied_real_world; mechs:[cross_topic_synthesis,constraint_reasoning,hence_chains]
2026-03-24T01:55:50Z	0.804977	0.801075	-0.003902	discard	mutate [7] skill:FUNC_TRANSFORMâ†’FUNC_QUADRATIC; arch:generalization_from_special_caseâ†’constraint_optimization_chain; style:modellingâ†’applied_real_world; mechs:[constraint_reasoning,cross_topic_synthesis,hence_chains]
2026-03-24T04:18:51Z	0.804977	0.800574	-0.004403	discard	mutate [7] skill:FUNC_TRANSFORMâ†’FUNC_QUADRATIC; arch:generalization_from_special_caseâ†’constraint_optimization_chain; style:modellingâ†’applied_real_world; mechs:[constraint_reasoning,cross_topic_synthesis,hence_chains]
2026-03-24T05:40:52Z	0.804977	0.801259	-0.003718	discard	mutate [7] skill:FUNC_TRANSFORMâ†’FUNC_QUADRATIC; arch:generalization_from_special_caseâ†’constraint_optimization_chain; style:modellingâ†’applied_real_world; mechs:[constraint_reasoning,hence_chains,cross_topic_synthesis]
2026-03-24T06:44:11Z	0.804977	0.800663	-0.004314	discard	mutate [7] skill:FUNC_TRANSFORMâ†’FUNC_QUADRATIC; arch:generalization_from_special_caseâ†’constraint_optimization_chain; style:modellingâ†’applied_real_world; mechs:[cross_topic_synthesis,constraint_reasoning,hence_chains]
2026-03-24T07:44:24Z	0.804977	0.800696	-0.004281	discard	mutate [7] skill:FUNC_TRANSFORMâ†’FUNC_QUADRATIC; arch:generalization_from_special_caseâ†’constraint_optimization_chain; style:modellingâ†’applied_real_world; mechs:[cross_topic_synthesis,hidden_structure,hence_chains,constraint_reasoning]
2026-03-24T08:36:29Z	0.804977	0.801101	-0.003876	discard	mutate [7] skill:FUNC_TRANSFORMâ†’FUNC_QUADRATIC; arch:generalization_from_special_caseâ†’constraint_optimization_chain; style:modellingâ†’applied_real_world; mechs:[constraint_reasoning,cross_topic_synthesis,hence_chains]
2026-03-24T09:36:55Z	0.804977	0.800820	-0.004157	discard	mutate [7] skill:FUNC_TRANSFORMâ†’FUNC_RATIONAL; arch:generalization_from_special_caseâ†’constraint_optimization_chain; style:modellingâ†’applied_real_world; mechs:[constraint_reasoning,cross_topic_synthesis,hence_chains]
2026-03-24T10:32:05Z	0.804977	0.800228	-0.004749	discard	mutate [7] skill:FUNC_TRANSFORMâ†’FUNC_RATIONAL; arch:generalization_from_special_caseâ†’constraint_optimization_chain; style:modellingâ†’applied_real_world; mechs:[constraint_reasoning,cross_topic_synthesis,hence_chains]
2026-03-24T11:30:10Z	0.804977	0.800477	-0.004500	discard	mutate [7] skill:FUNC_TRANSFORMâ†’FUNC_QUADRATIC; arch:generalization_from_special_caseâ†’constraint_optimization_chain; style:modellingâ†’applied_real_world; mechs:[constraint_reasoning,cross_topic_synthesis,hence_chains]
2026-03-24T12:07:13Z	0.804977	0.801271	-0.003706	discard	mutate [7] skill:FUNC_TRANSFORMâ†’FUNC_QUADRATIC; arch:generalization_from_special_caseâ†’constraint_optimization_chain; style:modellingâ†’applied_real_world; mechs:[constraint_reasoning,cross_topic_synthesis,hence_chains]
2026-03-24T13:49:21Z	0.804977	0.800814	-0.004163	discard	mutate [7] skill:FUNC_TRANSFORMâ†’FUNC_QUADRATIC; arch:generalization_from_special_caseâ†’constraint_optimization_chain; style:modellingâ†’applied_real_world; mechs:[constraint_reasoning,cross_topic_synthesis,hence_chains]
2026-03-24T14:48:17Z	0.804977	0.800211	-0.004766	discard	mutate [7] skill:FUNC_TRANSFORMâ†’FUNC_QUADRATIC; arch:generalization_from_special_caseâ†’constraint_optimization_chain; style:modellingâ†’applied_real_world; mechs:[constraint_reasoning,hence_chains,cross_topic_synthesis]
2026-03-24T15:51:29Z	0.804977	0.801279	-0.003698	discard	mutate [7] skill:FUNC_TRANSFORMâ†’FUNC_QUADRATIC; arch:generalization_from_special_caseâ†’constraint_optimization_chain; style:modellingâ†’applied_real_world; mechs:[constraint_reasoning,cross_topic_synthesis,hence_chains]
2026-03-24T16:46:43Z	0.804977	0.800682	-0.004295	discard	mutate [7] skill:FUNC_TRANSFORMâ†’FUNC_QUADRATIC; arch:generalization_from_special_caseâ†’constraint_optimization_chain; style:modellingâ†’applied_real_world; mechs:[constraint_reasoning,hence_chains,cross_topic_synthesis]
2026-03-24T17:44:56Z	0.000000	0.000000	+0.000000	crash	error: Missing required field: question
2026-03-24T18:44:16Z	0.804977	0.803753	-0.001224	discard	mutate [7] skill:FUNC_TRANSFORMâ†’FUNC_MODULUS; arch:generalization_from_special_caseâ†’spatial_coordinate_bridge; style:modellingâ†’applied_real_world; mechs:[multi_representation,constraint_reasoning,hence_chains]
2026-03-24T19:44:52Z	0.804977	0.800173	-0.004804	discard	mutate [7] skill:FUNC_TRANSFORMâ†’FUNC_QUADRATIC; arch:generalization_from_special_caseâ†’constraint_optimization_chain; style:modellingâ†’applied_real_world; mechs:[constraint_reasoning,cross_topic_synthesis,hence_chains]
2026-03-24T20:27:42Z	0.804977	0.800593	-0.004384	discard	mutate [7] skill:FUNC_TRANSFORMâ†’FUNC_QUADRATIC; arch:generalization_from_special_caseâ†’constraint_optimization_chain; style:modellingâ†’applied_real_world; mechs:[constraint_reasoning,cross_topic_synthesis,hence_chains]
2026-03-24T21:05:26Z	0.804977	0.800623	-0.004354	discard	mutate [7] skill:FUNC_TRANSFORMâ†’FUNC_QUADRATIC; arch:generalization_from_special_caseâ†’constraint_optimization_chain; style:modellingâ†’applied_real_world; mechs:[constraint_reasoning,cross_topic_synthesis,hence_chains]
2026-03-24T21:52:12Z	0.804977	0.800979	-0.003998	discard	mutate [7] skill:FUNC_TRANSFORMâ†’FUNC_QUADRATIC; arch:generalization_from_special_caseâ†’constraint_optimization_chain; style:modellingâ†’applied_real_world; mechs:[constraint_reasoning,cross_topic_synthesis,hence_chains]
2026-03-24T22:30:08Z	0.804977	0.801305	-0.003672	discard	mutate [7] skill:FUNC_TRANSFORMâ†’FUNC_QUADRATIC; arch:generalization_from_special_caseâ†’constraint_optimization_chain; style:modellingâ†’applied_real_world; mechs:[constraint_reasoning,cross_topic_synthesis,hence_chains]
2026-03-24T23:01:45Z	0.804977	0.801430	-0.003547	discard	mutate [7] skill:FUNC_TRANSFORMâ†’FUNC_QUADRATIC; arch:generalization_from_special_caseâ†’constraint_optimization_chain; style:modellingâ†’applied_real_world; mechs:[constraint_reasoning,cross_topic_synthesis]
2026-03-24T23:45:22Z	0.804977	0.800176	-0.004801	discard	mutate [7] skill:FUNC_TRANSFORMâ†’FUNC_RATIONAL; arch:generalization_from_special_caseâ†’constraint_optimization_chain; style:modellingâ†’applied_real_world; mechs:[constraint_reasoning,cross_topic_synthesis]
2026-03-25T00:04:59Z	0.804977	0.801290	-0.003687	discard	mutate [7] skill:FUNC_TRANSFORMâ†’FUNC_QUADRATIC; arch:generalization_from_special_caseâ†’constraint_optimization_chain; style:modellingâ†’applied_real_world; mechs:[constraint_reasoning,cross_topic_synthesis,hence_chains]
2026-03-25T03:17:25Z	0.804977	0.800124	-0.004853	discard	mutate [7] skill:FUNC_TRANSFORMâ†’FUNC_RATIONAL; arch:generalization_from_special_caseâ†’constraint_optimization_chain; style:modellingâ†’applied_real_world; mechs:[constraint_reasoning,hence_chains,cross_topic_synthesis]
2026-03-25T05:09:02Z	0.804977	0.800819	-0.004158	discard	mutate [7] skill:FUNC_TRANSFORMâ†’FUNC_QUADRATIC; arch:generalization_from_special_caseâ†’constraint_optimization_chain; style:modellingâ†’applied_real_world; mechs:[constraint_reasoning,cross_topic_synthesis,hence_chains]
2026-03-25T06:13:42Z	0.804977	0.800162	-0.004815	discard	mutate [7] skill:FUNC_TRANSFORMâ†’FUNC_QUADRATIC; arch:generalization_from_special_caseâ†’constraint_optimization_chain; style:modellingâ†’applied_real_world; mechs:[constraint_reasoning,cross_topic_synthesis]
2026-03-25T07:32:39Z	0.804977	0.801358	-0.003619	discard	mutate [7] skill:FUNC_TRANSFORMâ†’FUNC_QUADRATIC; arch:generalization_from_special_caseâ†’constraint_optimization_chain; style:modellingâ†’applied_real_world; mechs:[constraint_reasoning,cross_topic_synthesis,hence_chains]
2026-03-25T08:28:15Z	0.804977	0.801311	-0.003666	discard	mutate [7] skill:FUNC_TRANSFORMâ†’FUNC_QUADRATIC; arch:generalization_from_special_caseâ†’constraint_optimization_chain; style:modellingâ†’applied_real_world; mechs:[constraint_reasoning,hence_chains,cross_topic_synthesis]
2026-03-25T09:29:13Z	0.804977	0.800987	-0.003990	discard	mutate [7] skill:FUNC_TRANSFORMâ†’FUNC_QUADRATIC; arch:generalization_from_special_caseâ†’constraint_optimization_chain; style:modellingâ†’applied_real_world; mechs:[constraint_reasoning,cross_topic_synthesis,hence_chains]
2026-03-25T10:29:04Z	0.804977	0.800647	-0.004330	discard	mutate [7] skill:FUNC_TRANSFORMâ†’FUNC_QUADRATIC; arch:generalization_from_special_caseâ†’constraint_optimization_chain; style:modellingâ†’applied_real_world; mechs:[constraint_reasoning,cross_topic_synthesis,hence_chains]
2026-03-25T11:14:22Z	0.804977	0.801254	-0.003723	discard	mutate [7] skill:FUNC_TRANSFORMâ†’FUNC_QUADRATIC; arch:generalization_from_special_caseâ†’constraint_optimization_chain; style:modellingâ†’applied_real_world; mechs:[constraint_reasoning,hence_chains,cross_topic_synthesis]
