timestamp	old_score	new_score	delta	status	description
2026-03-14T03:38:04Z	0.626534	0.669160	+0.042626	keep	mutate [38] FUNC_RATIONALâ†’FUNC_EXP, proveâ†’model/apply
2026-03-14T04:12:41Z	0.669160	0.675018	+0.005858	keep	mutate [39] FUNC_RATIONALâ†’FUNC_MODULUS, proveâ†’multi-step synthesis
2026-03-14T05:27:55Z	0.675018	0.680971	+0.005953	keep	mutate [13] FUNC_RATIONALâ†’FUNC_EXP, proveâ†’model/apply
2026-03-14T06:09:16Z	0.680971	0.685739	+0.004768	keep	mutate [22] FUNC_RATIONALâ†’FUNC_MODULUS, proveâ†’multi-step synthesis
2026-03-14T07:07:17Z	0.685739	0.691435	+0.005696	keep	mutate [9] FUNC_POLYNOMIALâ†’FUNC_SUM_PRODUCT_ROOTS, proveâ†’show that
2026-03-14T07:09:17Z	0.286348	0.410208	+0.123860	keep	mutate [6] skill:FUNC_GRAPH_SKETCHâ†’FUNC_LOG; arch:proveâ†’reverse_engineering; style:Noneâ†’pure_abstract; mechs:[cross_topic_synthesis,hidden_structure,hence_chains]
2026-03-14T07:56:28Z	0.410208	0.504243	+0.094035	keep	mutate [34] skill:FUNC_DOMAINâ†’FUNC_QUADRATIC; arch:proveâ†’constraint_optimization_chain; style:Noneâ†’modelling; mechs:[constraint_reasoning,proof_unfamiliar_context]
2026-03-14T08:33:25Z	0.504243	0.560757	+0.056514	keep	mutate [8] skill:FUNC_GRAPH_SKETCHâ†’FUNC_COMPOSITE; arch:proveâ†’generalization_from_special_case; style:Noneâ†’applied_real_world; mechs:[cross_topic_synthesis,hidden_structure]
2026-03-14T09:04:28Z	0.560757	0.608042	+0.047285	keep	mutate [17] skill:FUNC_RATIONALâ†’FUNC_SUM_PRODUCT_ROOTS; arch:proveâ†’representation_bridge; style:Noneâ†’modelling; mechs:[cross_topic_synthesis,hence_chains]
2026-03-14T09:48:14Z	0.608042	0.652403	+0.044361	keep	mutate [29] skill:FUNC_DOMAINâ†’FUNC_MODULUS; arch:proveâ†’proof_by_contradiction_via_construction; style:Noneâ†’modelling; mechs:[constraint_reasoning,proof_unfamiliar_context]
2026-03-14T10:03:30Z	0.652403	0.690038	+0.037635	keep	mutate [1] skill:FUNC_POLYNOMIALâ†’FUNC_LOG; arch:find/solveâ†’spatial_coordinate_bridge; style:Noneâ†’applied_real_world; mechs:[hidden_structure,constraint_reasoning,hence_chains]
2026-03-14T10:46:25Z	0.690038	0.705511	+0.015473	keep	mutate [19] skill:FUNC_RATIONALâ†’FUNC_EXP; arch:proveâ†’proof_by_contradiction_via_construction; style:Noneâ†’applied_real_world; mechs:[proof_unfamiliar_context,constraint_reasoning]
2026-03-14T11:03:52Z	0.705511	0.709648	+0.004137	keep	mutate [14] skill:FUNC_GRAPH_SKETCHâ†’FUNC_SUM_PRODUCT_ROOTS; arch:find/solveâ†’representation_bridge; style:Noneâ†’modelling; mechs:[cross_topic_synthesis,hidden_structure,hence_chains]
2026-03-14T11:36:30Z	0.709648	0.713604	+0.003956	keep	mutate [26] skill:FUNC_DOMAINâ†’FUNC_QUADRATIC; arch:proveâ†’constraint_optimization_chain; style:Noneâ†’applied_real_world; mechs:[constraint_reasoning,proof_unfamiliar_context,hence_chains]
2026-03-14T11:54:43Z	0.713604	0.718711	+0.005107	keep	mutate [30] skill:FUNC_POLYNOMIALâ†’FUNC_COMPOSITE; arch:find/solveâ†’reverse_engineering; style:Noneâ†’modelling; mechs:[cross_topic_synthesis,hidden_structure,hence_chains]
2026-03-14T12:45:31Z	0.718711	0.726070	+0.007359	keep	mutate [3] skill:FUNC_TRANSFORMâ†’FUNC_EXP; arch:proveâ†’generalization_from_special_case; style:Noneâ†’applied_real_world; mechs:[hidden_structure,hence_chains,proof_unfamiliar_context]
2026-03-14T13:36:22Z	0.726070	0.735111	+0.009041	keep	mutate [7] skill:FUNC_GRAPH_SKETCHâ†’FUNC_MODULUS; arch:find/solveâ†’spatial_coordinate_bridge; style:Noneâ†’applied_real_world; mechs:[cross_topic_synthesis,constraint_reasoning]
2026-03-14T14:04:49Z	0.735111	0.741376	+0.006265	keep	mutate [0] skill:FUNC_RATIONALâ†’FUNC_LOG; arch:proveâ†’reverse_engineering; style:Noneâ†’modelling; mechs:[hidden_structure,proof_unfamiliar_context,constraint_reasoning]
2026-03-14T14:46:31Z	0.741376	0.746487	+0.005111	keep	mutate [32] skill:FUNC_DOMAINâ†’FUNC_INVERSE; arch:find/solveâ†’representation_bridge; style:Noneâ†’modelling; mechs:[cross_topic_synthesis,hidden_structure,multi_representation]
2026-03-14T15:04:07Z	0.746487	0.745909	-0.000578	discard	mutate [40] skill:FUNC_INVERSEâ†’FUNC_QUADRATIC; arch:proveâ†’constraint_optimization_chain; style:Noneâ†’applied_real_world; mechs:[constraint_reasoning,cross_topic_synthesis,proof_unfamiliar_context]
2026-03-14T15:39:58Z	0.000000	0.000000	+0.000000	crash	error: Missing required field: question
2026-03-14T15:58:05Z	0.746487	0.744393	-0.002094	discard	mutate [40] skill:FUNC_INVERSEâ†’FUNC_LOG; arch:proveâ†’proof_by_contradiction_via_construction; style:Noneâ†’applied_real_world; mechs:[proof_unfamiliar_context,constraint_reasoning]
2026-03-14T16:36:23Z	0.746487	0.747769	+0.001282	keep	mutate [40] skill:FUNC_INVERSEâ†’FUNC_MODULUS; arch:proveâ†’spatial_coordinate_bridge; style:Noneâ†’applied_real_world; mechs:[cross_topic_synthesis,proof_unfamiliar_context,constraint_reasoning]
2026-03-14T17:01:55Z	0.747769	0.746782	-0.000987	discard	mutate [33] skill:FUNC_POLYNOMIALâ†’FUNC_COMPOSITE; arch:proveâ†’generalization_from_special_case; style:Noneâ†’modelling; mechs:[proof_unfamiliar_context,hence_chains]
2026-03-14T17:38:17Z	0.747769	0.748039	+0.000270	keep	mutate [33] skill:FUNC_POLYNOMIALâ†’FUNC_COMPOSITE; arch:proveâ†’generalization_from_special_case; style:Noneâ†’modelling; mechs:[hidden_structure,hence_chains,proof_unfamiliar_context]
2026-03-14T17:58:16Z	0.748039	0.750770	+0.002731	keep	mutate [35] skill:FUNC_COMPOSITEâ†’FUNC_QUADRATIC; arch:proveâ†’constraint_optimization_chain; style:Noneâ†’applied_real_world; mechs:[constraint_reasoning,hence_chains,cross_topic_synthesis]
2026-03-14T18:43:18Z	0.750770	0.756936	+0.006166	keep	mutate [36] skill:FUNC_QUADRATICâ†’FUNC_COMPOSITE; arch:find/solveâ†’proof_by_contradiction_via_construction; style:Noneâ†’modelling; mechs:[proof_unfamiliar_context,constraint_reasoning,hence_chains]
2026-03-14T19:18:02Z	0.756936	0.756059	-0.000877	discard	mutate [12] skill:FUNC_GRAPH_SKETCHâ†’FUNC_TRANSFORM; arch:find/solveâ†’spatial_coordinate_bridge; style:Noneâ†’applied_real_world; mechs:[cross_topic_synthesis,hidden_structure]
2026-03-14T19:45:09Z	0.756936	0.757439	+0.000503	keep	mutate [12] skill:FUNC_GRAPH_SKETCHâ†’FUNC_TRANSFORM; arch:find/solveâ†’spatial_coordinate_bridge; style:Noneâ†’applied_real_world; mechs:[cross_topic_synthesis,hidden_structure,hence_chains]
2026-03-14T20:01:25Z	0.757439	0.759955	+0.002516	keep	mutate [15] skill:FUNC_TRANSFORMâ†’FUNC_GRAPH_SKETCH; arch:find/solveâ†’representation_bridge; style:Noneâ†’modelling; mechs:[multi_representation,hidden_structure,proof_unfamiliar_context]
2026-03-14T20:40:41Z	0.759955	0.762268	+0.002313	keep	mutate [31] skill:FUNC_COMPOSITEâ†’FUNC_QUADRATIC; arch:find/solveâ†’constraint_optimization_chain; style:Noneâ†’applied_real_world; mechs:[cross_topic_synthesis,constraint_reasoning,hence_chains]
2026-03-14T21:01:34Z	0.762268	0.765225	+0.002957	keep	mutate [18] arch:proveâ†’reverse_engineering; style:Noneâ†’modelling; mechs:[cross_topic_synthesis,hidden_structure,constraint_reasoning]
2026-03-14T21:36:32Z	0.765225	0.767223	+0.001998	keep	mutate [21] skill:FUNC_QUADRATICâ†’FUNC_COMPOSITE; arch:find/solveâ†’proof_by_contradiction_via_construction; style:Noneâ†’applied_real_world; mechs:[proof_unfamiliar_context,constraint_reasoning]
2026-03-14T21:55:28Z	0.767223	0.775733	+0.008510	keep	mutate [23] skill:FUNC_GRAPH_SKETCHâ†’FUNC_COMPOSITE; arch:proveâ†’generalization_from_special_case; style:Noneâ†’modelling; mechs:[hidden_structure,hence_chains,proof_unfamiliar_context]
2026-03-14T22:24:23Z	0.775733	0.778940	+0.003207	keep	mutate [27] skill:FUNC_LOGâ†’FUNC_GRAPH_SKETCH; arch:proveâ†’representation_bridge; style:Noneâ†’applied_real_world; mechs:[cross_topic_synthesis,multi_representation,hidden_structure]
2026-03-14T22:53:40Z	0.778940	0.780309	+0.001369	keep	mutate [5] skill:FUNC_RATIONALâ†’FUNC_LOG; arch:proveâ†’reverse_engineering; style:Noneâ†’modelling; mechs:[hidden_structure,constraint_reasoning,hence_chains]
2026-03-14T23:28:46Z	0.780309	0.779041	-0.001268	discard	mutate [44] skill:FUNC_DOMAINâ†’FUNC_RATIONAL; arch:find/solveâ†’constraint_optimization_chain; style:Noneâ†’applied_real_world; mechs:[constraint_reasoning,hence_chains,cross_topic_synthesis]
2026-03-14T23:52:37Z	0.780309	0.779223	-0.001086	discard	mutate [44] skill:FUNC_DOMAINâ†’FUNC_RATIONAL; arch:find/solveâ†’proof_by_contradiction_via_construction; style:Noneâ†’applied_real_world; mechs:[proof_unfamiliar_context,constraint_reasoning]
2026-03-15T02:08:40Z	0.780309	0.779351	-0.000958	discard	mutate [44] skill:FUNC_DOMAINâ†’FUNC_RATIONAL; arch:find/solveâ†’proof_by_contradiction_via_construction; style:Noneâ†’applied_real_world; mechs:[hidden_structure,proof_unfamiliar_context,constraint_reasoning]
2026-03-15T04:41:11Z	0.780309	0.779972	-0.000337	discard	mutate [44] skill:FUNC_DOMAINâ†’FUNC_RATIONAL; arch:find/solveâ†’proof_by_contradiction_via_construction; style:Noneâ†’applied_real_world; mechs:[proof_unfamiliar_context,constraint_reasoning]
2026-03-15T05:55:51Z	0.780309	0.779432	-0.000877	discard	mutate [44] skill:FUNC_DOMAINâ†’FUNC_RATIONAL; arch:find/solveâ†’proof_by_contradiction_via_construction; style:Noneâ†’applied_real_world; mechs:[constraint_reasoning,hence_chains,proof_unfamiliar_context]
2026-03-15T06:54:56Z	0.780309	0.779069	-0.001240	discard	mutate [44] skill:FUNC_DOMAINâ†’FUNC_RATIONAL; arch:find/solveâ†’proof_by_contradiction_via_construction; style:Noneâ†’applied_real_world; mechs:[constraint_reasoning,proof_unfamiliar_context,hence_chains]
2026-03-15T07:44:41Z	0.780309	0.785767	+0.005458	keep	mutate [44] skill:FUNC_DOMAINâ†’FUNC_RATIONAL; arch:find/solveâ†’constraint_optimization_chain; style:Noneâ†’applied_real_world; mechs:[constraint_reasoning,cross_topic_synthesis,proof_unfamiliar_context]
2026-03-15T08:22:33Z	0.785767	0.786817	+0.001050	keep	mutate [16] skill:FUNC_GRAPH_SKETCHâ†’FUNC_DOMAIN; arch:find/solveâ†’proof_by_contradiction_via_construction; style:Noneâ†’modelling; mechs:[proof_unfamiliar_context,constraint_reasoning,hence_chains,cross_topic_synthesis]
2026-03-15T09:02:08Z	0.786817	0.789111	+0.002294	keep	mutate [28] skill:FUNC_TRANSFORMâ†’FUNC_GRAPH_SKETCH; arch:proveâ†’spatial_coordinate_bridge; style:Noneâ†’applied_real_world; mechs:[multi_representation,cross_topic_synthesis,hence_chains]
2026-03-15T09:49:40Z	0.789111	0.792098	+0.002987	keep	mutate [24] skill:FUNC_RATIONALâ†’FUNC_TRANSFORM; arch:find/solveâ†’generalization_from_special_case; style:Noneâ†’modelling; mechs:[hidden_structure,proof_unfamiliar_context]
2026-03-15T10:16:39Z	0.792098	0.791035	-0.001063	discard	mutate [37] skill:FUNC_DOMAINâ†’FUNC_RATIONAL; arch:proveâ†’proof_by_contradiction_via_construction; style:Noneâ†’modelling; mechs:[hidden_structure,constraint_reasoning,proof_unfamiliar_context]
2026-03-15T10:53:36Z	0.792098	0.791473	-0.000625	discard	mutate [37] skill:FUNC_DOMAINâ†’FUNC_RATIONAL; arch:proveâ†’constraint_optimization_chain; style:Noneâ†’applied_real_world; mechs:[constraint_reasoning,cross_topic_synthesis,hidden_structure]
2026-03-15T11:26:10Z	0.792098	0.791334	-0.000764	discard	mutate [37] skill:FUNC_DOMAINâ†’FUNC_RATIONAL; arch:proveâ†’constraint_optimization_chain; style:Noneâ†’applied_real_world; mechs:[constraint_reasoning,proof_unfamiliar_context,cross_topic_synthesis]
2026-03-15T11:49:35Z	0.792098	0.791830	-0.000268	discard	mutate [37] skill:FUNC_DOMAINâ†’FUNC_RATIONAL; arch:proveâ†’reverse_engineering; style:Noneâ†’applied_real_world; mechs:[proof_unfamiliar_context,hidden_structure,constraint_reasoning]
2026-03-15T12:02:54Z	0.792098	0.791329	-0.000769	discard	mutate [37] skill:FUNC_DOMAINâ†’FUNC_RATIONAL; arch:proveâ†’proof_by_contradiction_via_construction; style:Noneâ†’applied_real_world; mechs:[constraint_reasoning,proof_unfamiliar_context]
2026-03-15T13:17:02Z	0.792098	0.791302	-0.000796	discard	mutate [37] skill:FUNC_DOMAINâ†’FUNC_RATIONAL; arch:proveâ†’representation_bridge; style:Noneâ†’applied_real_world; mechs:[hidden_structure,proof_unfamiliar_context,multi_representation,constraint_reasoning]
2026-03-15T13:59:03Z	0.792098	0.790546	-0.001552	discard	mutate [37] skill:FUNC_DOMAINâ†’FUNC_RATIONAL; arch:proveâ†’reverse_engineering; style:Noneâ†’applied_real_world; mechs:[hidden_structure,proof_unfamiliar_context,constraint_reasoning]
2026-03-15T14:37:14Z	0.000000	0.000000	+0.000000	crash	error: Missing required field: question
2026-03-15T15:01:15Z	0.792098	0.791931	-0.000167	discard	mutate [37] skill:FUNC_DOMAINâ†’FUNC_RATIONAL; arch:proveâ†’reverse_engineering; style:Noneâ†’applied_real_world; mechs:[hidden_structure,proof_unfamiliar_context,constraint_reasoning,cross_topic_synthesis]
2026-03-15T15:39:10Z	0.792098	0.792104	+0.000006	keep	mutate [37] skill:FUNC_DOMAINâ†’FUNC_RATIONAL; arch:proveâ†’proof_by_contradiction_via_construction; style:Noneâ†’applied_real_world; mechs:[hidden_structure,constraint_reasoning,proof_unfamiliar_context]
2026-03-15T15:59:57Z	0.792104	0.794918	+0.002814	keep	mutate [21] skill:FUNC_COMPOSITEâ†’FUNC_DOMAIN; arch:proof_by_contradiction_via_constructionâ†’spatial_coordinate_bridge; mechs:[cross_topic_synthesis,hence_chains,multi_representation]
2026-03-15T16:40:24Z	0.794918	0.794296	-0.000622	discard	mutate [10] skill:FUNC_SUM_PRODUCT_ROOTSâ†’FUNC_TRANSFORM; arch:find/solveâ†’reverse_engineering; style:Noneâ†’modelling; mechs:[cross_topic_synthesis,hidden_structure]
2026-03-15T17:03:45Z	0.794918	0.794208	-0.000710	discard	mutate [10] skill:FUNC_SUM_PRODUCT_ROOTSâ†’FUNC_INVERSE; arch:find/solveâ†’proof_by_contradiction_via_construction; style:Noneâ†’modelling; mechs:[proof_unfamiliar_context,constraint_reasoning,hidden_structure]
2026-03-15T17:44:01Z	0.794918	0.793525	-0.001393	discard	mutate [10] skill:FUNC_SUM_PRODUCT_ROOTSâ†’FUNC_TRANSFORM; arch:find/solveâ†’representation_bridge; style:Noneâ†’applied_real_world; mechs:[hidden_structure,multi_representation,proof_unfamiliar_context]
2026-03-15T18:04:03Z	0.794918	0.793502	-0.001416	discard	mutate [10] skill:FUNC_SUM_PRODUCT_ROOTSâ†’FUNC_TRANSFORM; arch:find/solveâ†’proof_by_contradiction_via_construction; style:Noneâ†’modelling; mechs:[proof_unfamiliar_context,cross_topic_synthesis,hence_chains]
2026-03-15T18:59:05Z	0.794918	0.792926	-0.001992	discard	mutate [10] skill:FUNC_SUM_PRODUCT_ROOTSâ†’FUNC_RATIONAL; arch:find/solveâ†’proof_by_contradiction_via_construction; style:Noneâ†’modelling; mechs:[constraint_reasoning,proof_unfamiliar_context]
2026-03-15T19:32:35Z	0.794918	0.793570	-0.001348	discard	mutate [10] skill:FUNC_SUM_PRODUCT_ROOTSâ†’FUNC_TRANSFORM; arch:find/solveâ†’representation_bridge; style:Noneâ†’modelling; mechs:[proof_unfamiliar_context,multi_representation,hidden_structure,hence_chains]
2026-03-15T19:55:05Z	0.794918	0.792220	-0.002698	discard	mutate [10] skill:FUNC_SUM_PRODUCT_ROOTSâ†’FUNC_RATIONAL; arch:find/solveâ†’proof_by_contradiction_via_construction; style:Noneâ†’modelling; mechs:[constraint_reasoning,proof_unfamiliar_context]
2026-03-15T20:27:44Z	0.794918	0.793193	-0.001725	discard	mutate [10] skill:FUNC_SUM_PRODUCT_ROOTSâ†’FUNC_RATIONAL; arch:find/solveâ†’representation_bridge; style:Noneâ†’modelling; mechs:[multi_representation,hidden_structure]
2026-03-15T20:56:04Z	0.794918	0.793376	-0.001542	discard	mutate [10] skill:FUNC_SUM_PRODUCT_ROOTSâ†’FUNC_QUADRATIC; arch:find/solveâ†’constraint_optimization_chain; style:Noneâ†’modelling; mechs:[constraint_reasoning,hence_chains,cross_topic_synthesis]
2026-03-15T21:27:41Z	0.794918	0.792591	-0.002327	discard	mutate [10] skill:FUNC_SUM_PRODUCT_ROOTSâ†’FUNC_COMPOSITE; arch:find/solveâ†’proof_by_contradiction_via_construction; style:Noneâ†’modelling; mechs:[hidden_structure,hence_chains,proof_unfamiliar_context]
2026-03-15T21:52:34Z	0.794918	0.794094	-0.000824	discard	mutate [10] skill:FUNC_SUM_PRODUCT_ROOTSâ†’FUNC_DOMAIN; arch:find/solveâ†’proof_by_contradiction_via_construction; style:Noneâ†’modelling; mechs:[proof_unfamiliar_context,constraint_reasoning,hidden_structure]
2026-03-15T22:27:20Z	0.794918	0.792755	-0.002163	discard	mutate [10] skill:FUNC_SUM_PRODUCT_ROOTSâ†’FUNC_QUADRATIC; arch:find/solveâ†’constraint_optimization_chain; style:Noneâ†’modelling; mechs:[constraint_reasoning,hence_chains,cross_topic_synthesis]
2026-03-15T22:56:33Z	0.794918	0.794214	-0.000704	discard	mutate [10] skill:FUNC_SUM_PRODUCT_ROOTSâ†’FUNC_INVERSE; arch:find/solveâ†’proof_by_contradiction_via_construction; style:Noneâ†’modelling; mechs:[proof_unfamiliar_context,hidden_structure,hence_chains]
2026-03-15T23:29:10Z	0.794918	0.792910	-0.002008	discard	mutate [10] skill:FUNC_SUM_PRODUCT_ROOTSâ†’FUNC_RATIONAL; arch:find/solveâ†’proof_by_contradiction_via_construction; style:Noneâ†’modelling; mechs:[cross_topic_synthesis,proof_unfamiliar_context,constraint_reasoning]
2026-03-15T23:54:57Z	0.794918	0.794722	-0.000196	discard	mutate [10] arch:find/solveâ†’representation_bridge; style:Noneâ†’modelling; mechs:[hidden_structure,proof_unfamiliar_context,constraint_reasoning]
2026-03-16T02:10:32Z	0.794918	0.792971	-0.001947	discard	mutate [10] skill:FUNC_SUM_PRODUCT_ROOTSâ†’FUNC_RATIONAL; arch:find/solveâ†’proof_by_contradiction_via_construction; style:Noneâ†’modelling; mechs:[hidden_structure,proof_unfamiliar_context]
2026-03-16T04:49:26Z	0.794918	0.799685	+0.004767	keep	mutate [10] skill:FUNC_SUM_PRODUCT_ROOTSâ†’FUNC_RATIONAL; arch:find/solveâ†’representation_bridge; style:Noneâ†’modelling; mechs:[multi_representation,hidden_structure,cross_topic_synthesis]
2026-03-16T06:12:19Z	0.799685	0.796409	-0.003276	discard	mutate [10] skill:FUNC_RATIONALâ†’FUNC_SUM_PRODUCT_ROOTS; arch:representation_bridgeâ†’proof_by_contradiction_via_construction; style:modellingâ†’applied_real_world; mechs:[proof_unfamiliar_context,constraint_reasoning,hidden_structure]
2026-03-16T07:52:37Z	0.799685	0.796575	-0.003110	discard	mutate [10] skill:FUNC_RATIONALâ†’FUNC_SUM_PRODUCT_ROOTS; arch:representation_bridgeâ†’reverse_engineering; style:modellingâ†’applied_real_world; mechs:[cross_topic_synthesis,hidden_structure,constraint_reasoning]
2026-03-16T08:43:26Z	0.799685	0.796362	-0.003323	discard	mutate [10] skill:FUNC_RATIONALâ†’FUNC_SUM_PRODUCT_ROOTS; arch:representation_bridgeâ†’reverse_engineering; style:modellingâ†’applied_real_world; mechs:[hidden_structure,proof_unfamiliar_context,constraint_reasoning]
2026-03-16T09:49:33Z	0.799685	0.795429	-0.004256	discard	mutate [10] skill:FUNC_RATIONALâ†’FUNC_SUM_PRODUCT_ROOTS; arch:representation_bridgeâ†’constraint_optimization_chain; style:modellingâ†’applied_real_world; mechs:[constraint_reasoning,cross_topic_synthesis,proof_unfamiliar_context]
2026-03-16T10:42:06Z	0.799685	0.795273	-0.004412	discard	mutate [10] skill:FUNC_RATIONALâ†’FUNC_SUM_PRODUCT_ROOTS; arch:representation_bridgeâ†’proof_by_contradiction_via_construction; style:modellingâ†’applied_real_world; mechs:[proof_unfamiliar_context,constraint_reasoning,cross_topic_synthesis]
2026-03-16T11:36:54Z	0.799685	0.795331	-0.004354	discard	mutate [10] skill:FUNC_RATIONALâ†’FUNC_SUM_PRODUCT_ROOTS; arch:representation_bridgeâ†’reverse_engineering; style:modellingâ†’applied_real_world; mechs:[constraint_reasoning,proof_unfamiliar_context,cross_topic_synthesis]
2026-03-16T12:09:57Z	0.799685	0.796477	-0.003208	discard	mutate [10] skill:FUNC_RATIONALâ†’FUNC_SUM_PRODUCT_ROOTS; arch:representation_bridgeâ†’reverse_engineering; style:modellingâ†’applied_real_world; mechs:[hidden_structure,cross_topic_synthesis,proof_unfamiliar_context,hence_chains]
2026-03-16T13:54:04Z	0.799685	0.796345	-0.003340	discard	mutate [10] skill:FUNC_RATIONALâ†’FUNC_SUM_PRODUCT_ROOTS; arch:representation_bridgeâ†’reverse_engineering; style:modellingâ†’applied_real_world; mechs:[cross_topic_synthesis,proof_unfamiliar_context,constraint_reasoning]
2026-03-16T14:59:15Z	0.799685	0.803027	+0.003342	keep	mutate [10] skill:FUNC_RATIONALâ†’FUNC_SUM_PRODUCT_ROOTS; arch:representation_bridgeâ†’proof_by_contradiction_via_construction; style:modellingâ†’applied_real_world; mechs:[constraint_reasoning,proof_unfamiliar_context,cross_topic_synthesis]
2026-03-16T16:10:08Z	0.803027	0.800675	-0.002352	discard	mutate [7] skill:FUNC_MODULUSâ†’FUNC_RATIONAL; arch:spatial_coordinate_bridgeâ†’representation_bridge; style:applied_real_worldâ†’modelling; mechs:[cross_topic_synthesis,hidden_structure,proof_unfamiliar_context]
2026-03-16T17:18:45Z	0.803027	0.800103	-0.002924	discard	mutate [7] skill:FUNC_MODULUSâ†’FUNC_RATIONAL; arch:spatial_coordinate_bridgeâ†’constraint_optimization_chain; style:applied_real_worldâ†’modelling; mechs:[cross_topic_synthesis,constraint_reasoning,proof_unfamiliar_context]
2026-03-16T18:14:05Z	0.803027	0.800135	-0.002892	discard	mutate [7] skill:FUNC_MODULUSâ†’FUNC_RATIONAL; arch:spatial_coordinate_bridgeâ†’constraint_optimization_chain; style:applied_real_worldâ†’modelling; mechs:[cross_topic_synthesis,constraint_reasoning,hence_chains,proof_unfamiliar_context]
2026-03-16T19:33:35Z	0.803027	0.800214	-0.002813	discard	mutate [7] skill:FUNC_MODULUSâ†’FUNC_RATIONAL; arch:spatial_coordinate_bridgeâ†’constraint_optimization_chain; style:applied_real_worldâ†’modelling; mechs:[constraint_reasoning,proof_unfamiliar_context]
2026-03-16T20:04:46Z	0.803027	0.801879	-0.001148	discard	mutate [7] skill:FUNC_MODULUSâ†’FUNC_TRANSFORM; arch:spatial_coordinate_bridgeâ†’reverse_engineering; style:applied_real_worldâ†’modelling; mechs:[proof_unfamiliar_context,hidden_structure,cross_topic_synthesis]
2026-03-16T20:56:25Z	0.803027	0.800312	-0.002715	discard	mutate [7] skill:FUNC_MODULUSâ†’FUNC_RATIONAL; arch:spatial_coordinate_bridgeâ†’constraint_optimization_chain; style:applied_real_worldâ†’modelling; mechs:[constraint_reasoning,hence_chains,proof_unfamiliar_context]
2026-03-16T21:38:19Z	0.803027	0.801365	-0.001662	discard	mutate [7] skill:FUNC_MODULUSâ†’FUNC_TRANSFORM; arch:spatial_coordinate_bridgeâ†’representation_bridge; style:applied_real_worldâ†’modelling; mechs:[cross_topic_synthesis,proof_unfamiliar_context,hence_chains]
