timestamp	old_score	new_score	delta	status	description
2026-04-24T00:10:05Z	0.805622	0.802823	-0.002799	discard	mutate [26] skill:FUNC_TRANSFORMâ†’FUNC_QUADRATIC; arch:spatial_coordinate_bridgeâ†’constraint_optimization_chain; style:applied_real_worldâ†’modelling; mechs:[constraint_reasoning,cross_topic_synthesis,hence_chains,hidden_structure]
2026-04-24T03:49:39Z	0.805622	0.803499	-0.002123	discard	mutate [26] skill:FUNC_TRANSFORMâ†’FUNC_QUADRATIC; arch:spatial_coordinate_bridgeâ†’constraint_optimization_chain; style:applied_real_worldâ†’modelling; mechs:[constraint_reasoning,hence_chains,cross_topic_synthesis]
2026-04-24T06:00:30Z	0.805622	0.803084	-0.002538	discard	mutate [26] skill:FUNC_TRANSFORMâ†’FUNC_QUADRATIC; arch:spatial_coordinate_bridgeâ†’constraint_optimization_chain; style:applied_real_worldâ†’modelling; mechs:[constraint_reasoning,cross_topic_synthesis]
2026-04-24T08:18:17Z	0.805622	0.802605	-0.003017	discard	mutate [26] skill:FUNC_TRANSFORMâ†’FUNC_QUADRATIC; arch:spatial_coordinate_bridgeâ†’constraint_optimization_chain; style:applied_real_worldâ†’modelling; mechs:[constraint_reasoning,cross_topic_synthesis,hence_chains]
2026-04-24T09:57:36Z	0.805622	0.802659	-0.002963	discard	mutate [26] skill:FUNC_TRANSFORMâ†’FUNC_QUADRATIC; arch:spatial_coordinate_bridgeâ†’constraint_optimization_chain; style:applied_real_worldâ†’modelling; mechs:[cross_topic_synthesis,constraint_reasoning,hence_chains]
2026-04-24T11:07:59Z	0.805622	0.803700	-0.001922	discard	mutate [26] skill:FUNC_TRANSFORMâ†’FUNC_QUADRATIC; arch:spatial_coordinate_bridgeâ†’constraint_optimization_chain; style:applied_real_worldâ†’modelling; mechs:[constraint_reasoning,cross_topic_synthesis,hidden_structure]
2026-04-24T12:04:32Z	0.805622	0.803023	-0.002599	discard	mutate [26] skill:FUNC_TRANSFORMâ†’FUNC_RATIONAL; arch:spatial_coordinate_bridgeâ†’constraint_optimization_chain; style:applied_real_worldâ†’modelling; mechs:[constraint_reasoning,cross_topic_synthesis,hence_chains]
2026-04-24T14:04:14Z	0.805622	0.802923	-0.002699	discard	mutate [26] skill:FUNC_TRANSFORMâ†’FUNC_RATIONAL; arch:spatial_coordinate_bridgeâ†’constraint_optimization_chain; style:applied_real_worldâ†’modelling; mechs:[cross_topic_synthesis,constraint_reasoning,hence_chains]
2026-04-24T15:22:54Z	0.805622	0.802752	-0.002870	discard	mutate [26] skill:FUNC_TRANSFORMâ†’FUNC_QUADRATIC; arch:spatial_coordinate_bridgeâ†’constraint_optimization_chain; style:applied_real_worldâ†’modelling; mechs:[constraint_reasoning,cross_topic_synthesis,hence_chains]
2026-04-24T16:33:21Z	0.805622	0.803772	-0.001850	discard	mutate [26] skill:FUNC_TRANSFORMâ†’FUNC_QUADRATIC; arch:spatial_coordinate_bridgeâ†’constraint_optimization_chain; style:applied_real_worldâ†’modelling; mechs:[constraint_reasoning,hence_chains,cross_topic_synthesis]
2026-04-24T17:34:12Z	0.805622	0.803904	-0.001718	discard	mutate [26] skill:FUNC_TRANSFORMâ†’FUNC_SUM_PRODUCT_ROOTS; arch:spatial_coordinate_bridgeâ†’reverse_engineering; style:applied_real_worldâ†’modelling; mechs:[constraint_reasoning,cross_topic_synthesis,hidden_structure]
2026-04-24T18:27:31Z	0.805622	0.802345	-0.003277	discard	mutate [26] skill:FUNC_TRANSFORMâ†’FUNC_QUADRATIC; arch:spatial_coordinate_bridgeâ†’constraint_optimization_chain; style:applied_real_worldâ†’modelling; mechs:[constraint_reasoning,hence_chains,cross_topic_synthesis]
2026-04-24T19:30:12Z	0.805622	0.803345	-0.002277	discard	mutate [26] skill:FUNC_TRANSFORMâ†’FUNC_QUADRATIC; arch:spatial_coordinate_bridgeâ†’constraint_optimization_chain; style:applied_real_worldâ†’modelling; mechs:[constraint_reasoning,cross_topic_synthesis,hence_chains]
2026-04-24T20:10:33Z	0.805622	0.802208	-0.003414	discard	mutate [26] skill:FUNC_TRANSFORMâ†’FUNC_QUADRATIC; arch:spatial_coordinate_bridgeâ†’constraint_optimization_chain; style:applied_real_worldâ†’modelling; mechs:[cross_topic_synthesis,constraint_reasoning,hence_chains]
2026-04-24T21:06:45Z	0.805622	0.802946	-0.002676	discard	mutate [26] skill:FUNC_TRANSFORMâ†’FUNC_QUADRATIC; arch:spatial_coordinate_bridgeâ†’constraint_optimization_chain; style:applied_real_worldâ†’modelling; mechs:[constraint_reasoning,cross_topic_synthesis,hence_chains]
2026-04-24T22:00:09Z	0.805622	0.803036	-0.002586	discard	mutate [26] skill:FUNC_TRANSFORMâ†’FUNC_QUADRATIC; arch:spatial_coordinate_bridgeâ†’constraint_optimization_chain; style:applied_real_worldâ†’modelling; mechs:[cross_topic_synthesis,constraint_reasoning]
2026-04-24T22:51:04Z	0.805622	0.802853	-0.002769	discard	mutate [26] skill:FUNC_TRANSFORMâ†’FUNC_QUADRATIC; arch:spatial_coordinate_bridgeâ†’constraint_optimization_chain; style:applied_real_worldâ†’modelling; mechs:[constraint_reasoning,cross_topic_synthesis,hence_chains]
2026-04-24T23:29:16Z	0.805622	0.802938	-0.002684	discard	mutate [26] skill:FUNC_TRANSFORMâ†’FUNC_RATIONAL; arch:spatial_coordinate_bridgeâ†’constraint_optimization_chain; style:applied_real_worldâ†’modelling; mechs:[constraint_reasoning,cross_topic_synthesis,hidden_structure,hence_chains]
2026-04-25T00:07:36Z	0.805622	0.802546	-0.003076	discard	mutate [26] skill:FUNC_TRANSFORMâ†’FUNC_QUADRATIC; arch:spatial_coordinate_bridgeâ†’constraint_optimization_chain; style:applied_real_worldâ†’modelling; mechs:[constraint_reasoning,cross_topic_synthesis,hence_chains]
2026-04-25T03:30:54Z	0.805622	0.802658	-0.002964	discard	mutate [26] skill:FUNC_TRANSFORMâ†’FUNC_QUADRATIC; arch:spatial_coordinate_bridgeâ†’constraint_optimization_chain; style:applied_real_worldâ†’modelling; mechs:[constraint_reasoning,cross_topic_synthesis,hence_chains]
2026-04-25T05:30:29Z	0.805622	0.802562	-0.003060	discard	mutate [26] skill:FUNC_TRANSFORMâ†’FUNC_QUADRATIC; arch:spatial_coordinate_bridgeâ†’constraint_optimization_chain; style:applied_real_worldâ†’modelling; mechs:[constraint_reasoning,cross_topic_synthesis,hence_chains]
2026-04-25T06:53:35Z	0.805622	0.802862	-0.002760	discard	mutate [26] skill:FUNC_TRANSFORMâ†’FUNC_QUADRATIC; arch:spatial_coordinate_bridgeâ†’constraint_optimization_chain; style:applied_real_worldâ†’modelling; mechs:[constraint_reasoning,cross_topic_synthesis,hence_chains]
2026-04-25T08:05:33Z	0.805622	0.802287	-0.003335	discard	mutate [26] skill:FUNC_TRANSFORMâ†’FUNC_QUADRATIC; arch:spatial_coordinate_bridgeâ†’constraint_optimization_chain; style:applied_real_worldâ†’modelling; mechs:[constraint_reasoning,cross_topic_synthesis,hence_chains]
2026-04-25T09:08:07Z	0.805622	0.802752	-0.002870	discard	mutate [26] skill:FUNC_TRANSFORMâ†’FUNC_QUADRATIC; arch:spatial_coordinate_bridgeâ†’constraint_optimization_chain; style:applied_real_worldâ†’modelling; mechs:[constraint_reasoning,cross_topic_synthesis,hence_chains]
2026-04-25T10:03:43Z	0.805622	0.802873	-0.002749	discard	mutate [26] skill:FUNC_TRANSFORMâ†’FUNC_QUADRATIC; arch:spatial_coordinate_bridgeâ†’constraint_optimization_chain; style:applied_real_worldâ†’modelling; mechs:[constraint_reasoning,cross_topic_synthesis]
2026-04-25T11:01:28Z	0.805622	0.803293	-0.002329	discard	mutate [26] skill:FUNC_TRANSFORMâ†’FUNC_QUADRATIC; arch:spatial_coordinate_bridgeâ†’constraint_optimization_chain; mechs:[constraint_reasoning,cross_topic_synthesis,hence_chains]
2026-04-25T11:49:41Z	0.805622	0.802399	-0.003223	discard	mutate [26] skill:FUNC_TRANSFORMâ†’FUNC_QUADRATIC; arch:spatial_coordinate_bridgeâ†’constraint_optimization_chain; style:applied_real_worldâ†’modelling; mechs:[constraint_reasoning,cross_topic_synthesis,hence_chains]
2026-04-25T12:32:10Z	0.805622	0.803023	-0.002599	discard	mutate [26] skill:FUNC_TRANSFORMâ†’FUNC_QUADRATIC; arch:spatial_coordinate_bridgeâ†’constraint_optimization_chain; style:applied_real_worldâ†’modelling; mechs:[constraint_reasoning,cross_topic_synthesis,hence_chains]
2026-04-25T13:49:06Z	0.805622	0.802715	-0.002907	discard	mutate [26] skill:FUNC_TRANSFORMâ†’FUNC_QUADRATIC; arch:spatial_coordinate_bridgeâ†’constraint_optimization_chain; style:applied_real_worldâ†’modelling; mechs:[constraint_reasoning,cross_topic_synthesis,hence_chains]
2026-04-25T14:33:52Z	0.805622	0.802254	-0.003368	discard	mutate [26] skill:FUNC_TRANSFORMâ†’FUNC_QUADRATIC; arch:spatial_coordinate_bridgeâ†’constraint_optimization_chain; style:applied_real_worldâ†’modelling; mechs:[constraint_reasoning,cross_topic_synthesis,hidden_structure]
2026-04-25T15:25:12Z	0.920142	0.803038	-0.117104	discard	mutate [12] skill:FUNC_TRANSFORMâ†’FUNC_QUADRATIC; arch:spatial_coordinate_bridgeâ†’constraint_optimization_chain; style:applied_real_worldâ†’modelling; mechs:[constraint_reasoning,cross_topic_synthesis,hence_chains]
2026-04-25T16:05:24Z	0.805622	0.803067	-0.002555	discard	mutate [26] skill:FUNC_TRANSFORMâ†’FUNC_QUADRATIC; arch:spatial_coordinate_bridgeâ†’constraint_optimization_chain; style:applied_real_worldâ†’modelling; mechs:[constraint_reasoning,cross_topic_synthesis]
2026-04-25T17:00:18Z	0.805622	0.803512	-0.002110	discard	mutate [26] skill:FUNC_TRANSFORMâ†’FUNC_QUADRATIC; arch:spatial_coordinate_bridgeâ†’constraint_optimization_chain; mechs:[constraint_reasoning,hence_chains,cross_topic_synthesis]
2026-04-25T17:50:43Z	0.805622	0.802862	-0.002760	discard	mutate [26] skill:FUNC_TRANSFORMâ†’FUNC_QUADRATIC; arch:spatial_coordinate_bridgeâ†’constraint_optimization_chain; style:applied_real_worldâ†’modelling; mechs:[constraint_reasoning,cross_topic_synthesis,hidden_structure,hence_chains]
2026-04-25T18:31:39Z	0.805622	0.802997	-0.002625	discard	mutate [26] skill:FUNC_TRANSFORMâ†’FUNC_QUADRATIC; arch:spatial_coordinate_bridgeâ†’constraint_optimization_chain; style:applied_real_worldâ†’modelling; mechs:[constraint_reasoning,hidden_structure,hence_chains]
2026-04-25T19:31:50Z	0.805622	0.802871	-0.002751	discard	mutate [26] skill:FUNC_TRANSFORMâ†’FUNC_QUADRATIC; arch:spatial_coordinate_bridgeâ†’constraint_optimization_chain; style:applied_real_worldâ†’modelling; mechs:[constraint_reasoning,cross_topic_synthesis,hence_chains]
2026-04-25T20:08:06Z	0.805622	0.802288	-0.003334	discard	mutate [26] skill:FUNC_TRANSFORMâ†’FUNC_QUADRATIC; arch:spatial_coordinate_bridgeâ†’constraint_optimization_chain; style:applied_real_worldâ†’modelling; mechs:[constraint_reasoning,cross_topic_synthesis,hence_chains]
2026-04-25T20:56:06Z	0.805622	0.803724	-0.001898	discard	mutate [26] skill:FUNC_TRANSFORMâ†’FUNC_SUM_PRODUCT_ROOTS; arch:spatial_coordinate_bridgeâ†’constraint_optimization_chain; style:applied_real_worldâ†’modelling; mechs:[constraint_reasoning,cross_topic_synthesis,hidden_structure,hence_chains]
2026-04-25T21:35:54Z	0.805622	0.804252	-0.001370	discard	mutate [26] skill:FUNC_TRANSFORMâ†’FUNC_QUADRATIC; arch:spatial_coordinate_bridgeâ†’constraint_optimization_chain; mechs:[hidden_structure,constraint_reasoning,cross_topic_synthesis]
2026-04-25T22:06:13Z	0.805622	0.803645	-0.001977	discard	mutate [26] skill:FUNC_TRANSFORMâ†’FUNC_QUADRATIC; arch:spatial_coordinate_bridgeâ†’constraint_optimization_chain; style:applied_real_worldâ†’modelling; mechs:[constraint_reasoning,cross_topic_synthesis,hence_chains]
2026-04-25T22:54:30Z	0.805622	0.803636	-0.001986	discard	mutate [26] skill:FUNC_TRANSFORMâ†’FUNC_QUADRATIC; arch:spatial_coordinate_bridgeâ†’constraint_optimization_chain; style:applied_real_worldâ†’modelling; mechs:[constraint_reasoning,cross_topic_synthesis,hence_chains]
2026-04-25T23:36:41Z	0.805622	0.802882	-0.002740	discard	mutate [26] skill:FUNC_TRANSFORMâ†’FUNC_RATIONAL; arch:spatial_coordinate_bridgeâ†’constraint_optimization_chain; style:applied_real_worldâ†’modelling; mechs:[constraint_reasoning,cross_topic_synthesis,hidden_structure]
2026-04-26T00:08:45Z	0.805622	0.803038	-0.002584	discard	mutate [26] skill:FUNC_TRANSFORMâ†’FUNC_QUADRATIC; arch:spatial_coordinate_bridgeâ†’constraint_optimization_chain; style:applied_real_worldâ†’modelling; mechs:[constraint_reasoning,cross_topic_synthesis]
2026-04-26T03:54:58Z	0.805622	0.803569	-0.002053	discard	mutate [26] skill:FUNC_TRANSFORMâ†’FUNC_QUADRATIC; arch:spatial_coordinate_bridgeâ†’constraint_optimization_chain; style:applied_real_worldâ†’modelling; mechs:[constraint_reasoning,cross_topic_synthesis,hence_chains]
2026-04-26T06:06:06Z	0.805622	0.803681	-0.001941	discard	mutate [26] skill:FUNC_TRANSFORMâ†’FUNC_QUADRATIC; arch:spatial_coordinate_bridgeâ†’constraint_optimization_chain; style:applied_real_worldâ†’modelling; mechs:[constraint_reasoning,hence_chains,cross_topic_synthesis]
2026-04-26T07:54:01Z	0.805622	0.804338	-0.001284	discard	mutate [26] skill:FUNC_TRANSFORMâ†’FUNC_QUADRATIC; arch:spatial_coordinate_bridgeâ†’constraint_optimization_chain; mechs:[constraint_reasoning,cross_topic_synthesis,hence_chains]
2026-04-26T08:58:37Z	0.805622	0.802929	-0.002693	discard	mutate [26] skill:FUNC_TRANSFORMâ†’FUNC_QUADRATIC; arch:spatial_coordinate_bridgeâ†’constraint_optimization_chain; style:applied_real_worldâ†’modelling; mechs:[constraint_reasoning,cross_topic_synthesis]
2026-04-26T09:57:55Z	0.805622	0.803692	-0.001930	discard	mutate [26] skill:FUNC_TRANSFORMâ†’FUNC_QUADRATIC; arch:spatial_coordinate_bridgeâ†’constraint_optimization_chain; style:applied_real_worldâ†’modelling; mechs:[constraint_reasoning,cross_topic_synthesis]
2026-04-26T10:45:25Z	0.805622	0.803090	-0.002532	discard	mutate [26] skill:FUNC_TRANSFORMâ†’FUNC_RATIONAL; arch:spatial_coordinate_bridgeâ†’constraint_optimization_chain; style:applied_real_worldâ†’modelling; mechs:[constraint_reasoning,cross_topic_synthesis,hence_chains]
2026-04-26T11:29:11Z	0.805622	0.802925	-0.002697	discard	mutate [26] skill:FUNC_TRANSFORMâ†’FUNC_QUADRATIC; arch:spatial_coordinate_bridgeâ†’constraint_optimization_chain; style:applied_real_worldâ†’modelling; mechs:[constraint_reasoning,cross_topic_synthesis,hidden_structure]
2026-04-26T12:06:30Z	0.000000	0.000000	+0.000000	crash	JSON parse error: Extra data: line 29 column 1 (char 4299)
2026-04-26T13:39:55Z	0.805622	0.803764	-0.001858	discard	mutate [26] skill:FUNC_TRANSFORMâ†’FUNC_QUADRATIC; arch:spatial_coordinate_bridgeâ†’constraint_optimization_chain; style:applied_real_worldâ†’modelling; mechs:[constraint_reasoning,cross_topic_synthesis,hence_chains]
2026-04-26T14:28:21Z	0.805622	0.802773	-0.002849	discard	mutate [26] skill:FUNC_TRANSFORMâ†’FUNC_QUADRATIC; arch:spatial_coordinate_bridgeâ†’constraint_optimization_chain; style:applied_real_worldâ†’modelling; mechs:[constraint_reasoning,cross_topic_synthesis]
2026-04-26T15:10:45Z	0.805622	0.803575	-0.002047	discard	mutate [26] skill:FUNC_TRANSFORMâ†’FUNC_QUADRATIC; arch:spatial_coordinate_bridgeâ†’constraint_optimization_chain; style:applied_real_worldâ†’modelling; mechs:[constraint_reasoning,hidden_structure,cross_topic_synthesis]
2026-04-26T15:58:21Z	0.805622	0.802812	-0.002810	discard	mutate [26] skill:FUNC_TRANSFORMâ†’FUNC_QUADRATIC; arch:spatial_coordinate_bridgeâ†’constraint_optimization_chain; style:applied_real_worldâ†’modelling; mechs:[constraint_reasoning,cross_topic_synthesis]
2026-04-26T16:47:23Z	0.805622	0.803580	-0.002042	discard	mutate [26] skill:FUNC_TRANSFORMâ†’FUNC_QUADRATIC; arch:spatial_coordinate_bridgeâ†’constraint_optimization_chain; mechs:[constraint_reasoning,cross_topic_synthesis]
2026-04-26T17:27:31Z	0.805622	0.802475	-0.003147	discard	mutate [26] skill:FUNC_TRANSFORMâ†’FUNC_QUADRATIC; arch:spatial_coordinate_bridgeâ†’constraint_optimization_chain; style:applied_real_worldâ†’modelling; mechs:[constraint_reasoning,cross_topic_synthesis,hence_chains]
2026-04-26T18:06:58Z	0.805622	0.802662	-0.002960	discard	mutate [26] skill:FUNC_TRANSFORMâ†’FUNC_QUADRATIC; arch:spatial_coordinate_bridgeâ†’constraint_optimization_chain; style:applied_real_worldâ†’modelling; mechs:[constraint_reasoning,cross_topic_synthesis,hence_chains]
2026-04-26T19:12:15Z	0.805622	0.802931	-0.002691	discard	mutate [26] skill:FUNC_TRANSFORMâ†’FUNC_QUADRATIC; arch:spatial_coordinate_bridgeâ†’constraint_optimization_chain; style:applied_real_worldâ†’modelling; mechs:[constraint_reasoning,cross_topic_synthesis,hence_chains]
2026-04-26T19:59:24Z	0.805622	0.803821	-0.001801	discard	mutate [26] skill:FUNC_TRANSFORMâ†’FUNC_QUADRATIC; arch:spatial_coordinate_bridgeâ†’constraint_optimization_chain; style:applied_real_worldâ†’modelling; mechs:[constraint_reasoning,cross_topic_synthesis,hidden_structure]
2026-04-26T20:50:00Z	0.805622	0.802836	-0.002786	discard	mutate [26] skill:FUNC_TRANSFORMâ†’FUNC_QUADRATIC; arch:spatial_coordinate_bridgeâ†’constraint_optimization_chain; style:applied_real_worldâ†’modelling; mechs:[constraint_reasoning,cross_topic_synthesis,hence_chains]
2026-04-26T21:25:37Z	0.805622	0.803138	-0.002484	discard	mutate [26] skill:FUNC_TRANSFORMâ†’FUNC_SUM_PRODUCT_ROOTS; arch:spatial_coordinate_bridgeâ†’constraint_optimization_chain; style:applied_real_worldâ†’modelling; mechs:[hidden_structure,constraint_reasoning,cross_topic_synthesis,hence_chains]
2026-04-26T22:03:45Z	0.805622	0.803679	-0.001943	discard	mutate [26] skill:FUNC_TRANSFORMâ†’FUNC_QUADRATIC; arch:spatial_coordinate_bridgeâ†’constraint_optimization_chain; style:applied_real_worldâ†’modelling; mechs:[constraint_reasoning,cross_topic_synthesis,hence_chains]
2026-04-26T22:56:57Z	0.805622	0.802963	-0.002659	discard	mutate [26] skill:FUNC_TRANSFORMâ†’FUNC_QUADRATIC; arch:spatial_coordinate_bridgeâ†’constraint_optimization_chain; style:applied_real_worldâ†’modelling; mechs:[constraint_reasoning,cross_topic_synthesis,hence_chains]
2026-04-26T23:38:40Z	0.805622	0.803752	-0.001870	discard	mutate [26] skill:FUNC_TRANSFORMâ†’FUNC_QUADRATIC; arch:spatial_coordinate_bridgeâ†’constraint_optimization_chain; style:applied_real_worldâ†’modelling; mechs:[constraint_reasoning,cross_topic_synthesis,hence_chains]
2026-04-27T01:14:59Z	0.805622	0.803051	-0.002571	discard	mutate [26] skill:FUNC_TRANSFORMâ†’FUNC_QUADRATIC; arch:spatial_coordinate_bridgeâ†’constraint_optimization_chain; style:applied_real_worldâ†’modelling; mechs:[constraint_reasoning,cross_topic_synthesis]
2026-04-27T04:43:22Z	0.805622	0.803666	-0.001956	discard	mutate [26] skill:FUNC_TRANSFORMâ†’FUNC_QUADRATIC; arch:spatial_coordinate_bridgeâ†’constraint_optimization_chain; style:applied_real_worldâ†’modelling; mechs:[constraint_reasoning,cross_topic_synthesis,hidden_structure,hence_chains]
2026-04-27T07:28:28Z	0.805622	0.802894	-0.002728	discard	mutate [26] skill:FUNC_TRANSFORMâ†’FUNC_QUADRATIC; arch:spatial_coordinate_bridgeâ†’constraint_optimization_chain; style:applied_real_worldâ†’modelling; mechs:[constraint_reasoning,cross_topic_synthesis,hence_chains]
2026-04-27T09:39:00Z	0.805622	0.803748	-0.001874	discard	mutate [26] skill:FUNC_TRANSFORMâ†’FUNC_QUADRATIC; arch:spatial_coordinate_bridgeâ†’constraint_optimization_chain; style:applied_real_worldâ†’modelling; mechs:[constraint_reasoning,hence_chains,cross_topic_synthesis]
2026-04-27T11:27:49Z	0.805622	0.802943	-0.002679	discard	mutate [26] skill:FUNC_TRANSFORMâ†’FUNC_QUADRATIC; arch:spatial_coordinate_bridgeâ†’constraint_optimization_chain; style:applied_real_worldâ†’modelling; mechs:[cross_topic_synthesis,constraint_reasoning,hence_chains]
2026-04-27T13:05:45Z	0.805622	0.803206	-0.002416	discard	mutate [26] skill:FUNC_TRANSFORMâ†’FUNC_QUADRATIC; arch:spatial_coordinate_bridgeâ†’constraint_optimization_chain; mechs:[constraint_reasoning,cross_topic_synthesis,hence_chains]
2026-04-27T15:17:49Z	0.805622	0.802989	-0.002633	discard	mutate [26] skill:FUNC_TRANSFORMâ†’FUNC_QUADRATIC; arch:spatial_coordinate_bridgeâ†’constraint_optimization_chain; mechs:[constraint_reasoning,cross_topic_synthesis,hence_chains]
2026-04-27T16:59:19Z	0.805622	0.803032	-0.002590	discard	mutate [26] skill:FUNC_TRANSFORMâ†’FUNC_RATIONAL; arch:spatial_coordinate_bridgeâ†’constraint_optimization_chain; style:applied_real_worldâ†’modelling; mechs:[constraint_reasoning,cross_topic_synthesis,hidden_structure]
2026-04-27T18:07:46Z	0.805622	0.802424	-0.003198	discard	mutate [26] skill:FUNC_TRANSFORMâ†’FUNC_QUADRATIC; arch:spatial_coordinate_bridgeâ†’constraint_optimization_chain; style:applied_real_worldâ†’modelling; mechs:[constraint_reasoning,cross_topic_synthesis,hence_chains]
2026-04-27T19:47:58Z	0.805622	0.802652	-0.002970	discard	mutate [26] skill:FUNC_TRANSFORMâ†’FUNC_QUADRATIC; arch:spatial_coordinate_bridgeâ†’constraint_optimization_chain; style:applied_real_worldâ†’modelling; mechs:[constraint_reasoning,cross_topic_synthesis,hence_chains]
2026-04-27T20:45:36Z	0.805622	0.803589	-0.002033	discard	mutate [26] skill:FUNC_TRANSFORMâ†’FUNC_QUADRATIC; arch:spatial_coordinate_bridgeâ†’constraint_optimization_chain; style:applied_real_worldâ†’modelling; mechs:[constraint_reasoning,cross_topic_synthesis,hence_chains]
2026-04-27T21:42:27Z	0.805622	0.803063	-0.002559	discard	mutate [26] skill:FUNC_TRANSFORMâ†’FUNC_QUADRATIC; arch:spatial_coordinate_bridgeâ†’constraint_optimization_chain; style:applied_real_worldâ†’modelling; mechs:[constraint_reasoning,cross_topic_synthesis,hence_chains]
2026-04-27T22:37:58Z	0.805622	0.803664	-0.001958	discard	mutate [26] skill:FUNC_TRANSFORMâ†’FUNC_QUADRATIC; arch:spatial_coordinate_bridgeâ†’constraint_optimization_chain; style:applied_real_worldâ†’modelling; mechs:[constraint_reasoning,cross_topic_synthesis,hence_chains]
2026-04-27T23:35:18Z	0.805622	0.802895	-0.002727	discard	mutate [26] skill:FUNC_TRANSFORMâ†’FUNC_QUADRATIC; arch:spatial_coordinate_bridgeâ†’constraint_optimization_chain; style:applied_real_worldâ†’modelling; mechs:[constraint_reasoning,cross_topic_synthesis,hence_chains]
2026-04-28T01:20:54Z	0.805622	0.802964	-0.002658	discard	mutate [26] skill:FUNC_TRANSFORMâ†’FUNC_QUADRATIC; arch:spatial_coordinate_bridgeâ†’constraint_optimization_chain; style:applied_real_worldâ†’modelling; mechs:[constraint_reasoning,cross_topic_synthesis,hence_chains]
2026-04-28T04:48:26Z	0.805622	0.802919	-0.002703	discard	mutate [26] skill:FUNC_TRANSFORMâ†’FUNC_QUADRATIC; arch:spatial_coordinate_bridgeâ†’constraint_optimization_chain; style:applied_real_worldâ†’modelling; mechs:[constraint_reasoning,cross_topic_synthesis,hidden_structure]
