timestamp	old_score	new_score	delta	status	description
2026-04-01T06:11:49Z	0.804977	0.800123	-0.004854	discard	mutate [7] skill:FUNC_TRANSFORMâ†’FUNC_RATIONAL; arch:generalization_from_special_caseâ†’constraint_optimization_chain; style:modellingâ†’applied_real_world; mechs:[cross_topic_synthesis,constraint_reasoning,hence_chains]
2026-04-01T07:57:58Z	0.804977	0.802085	-0.002892	discard	mutate [7] skill:FUNC_TRANSFORMâ†’FUNC_QUADRATIC; arch:generalization_from_special_caseâ†’constraint_optimization_chain; style:modellingâ†’applied_real_world; mechs:[constraint_reasoning,hence_chains,cross_topic_synthesis]
2026-04-01T09:06:51Z	0.804977	0.800854	-0.004123	discard	mutate [7] skill:FUNC_TRANSFORMâ†’FUNC_QUADRATIC; arch:generalization_from_special_caseâ†’constraint_optimization_chain; style:modellingâ†’applied_real_world; mechs:[constraint_reasoning,hence_chains,cross_topic_synthesis]
2026-04-01T10:15:25Z	0.804977	0.801263	-0.003714	discard	mutate [7] skill:FUNC_TRANSFORMâ†’FUNC_QUADRATIC; arch:generalization_from_special_caseâ†’constraint_optimization_chain; style:modellingâ†’applied_real_world; mechs:[constraint_reasoning,hence_chains,cross_topic_synthesis]
2026-04-01T11:17:04Z	0.804977	0.801397	-0.003580	discard	mutate [7] skill:FUNC_TRANSFORMâ†’FUNC_QUADRATIC; arch:generalization_from_special_caseâ†’constraint_optimization_chain; style:modellingâ†’applied_real_world; mechs:[constraint_reasoning,hence_chains]
2026-04-01T12:04:42Z	0.804977	0.801123	-0.003854	discard	mutate [7] skill:FUNC_TRANSFORMâ†’FUNC_QUADRATIC; arch:generalization_from_special_caseâ†’constraint_optimization_chain; style:modellingâ†’applied_real_world; mechs:[constraint_reasoning,cross_topic_synthesis,hence_chains]
2026-04-01T14:02:34Z	0.804977	0.801336	-0.003641	discard	mutate [7] skill:FUNC_TRANSFORMâ†’FUNC_QUADRATIC; arch:generalization_from_special_caseâ†’constraint_optimization_chain; style:modellingâ†’applied_real_world; mechs:[constraint_reasoning,cross_topic_synthesis,hence_chains]
2026-04-01T15:25:13Z	0.804977	0.800586	-0.004391	discard	mutate [7] skill:FUNC_TRANSFORMâ†’FUNC_QUADRATIC; arch:generalization_from_special_caseâ†’constraint_optimization_chain; style:modellingâ†’applied_real_world; mechs:[constraint_reasoning,hence_chains,cross_topic_synthesis]
2026-04-01T16:32:41Z	0.804977	0.800581	-0.004396	discard	mutate [7] skill:FUNC_TRANSFORMâ†’FUNC_QUADRATIC; arch:generalization_from_special_caseâ†’constraint_optimization_chain; style:modellingâ†’applied_real_world; mechs:[constraint_reasoning,hence_chains,cross_topic_synthesis]
2026-04-01T17:35:10Z	0.000000	0.000000	+0.000000	crash	error: 503 UNAVAILABLE. {'error': {'code': 503, 'message': 'This model is currently experiencing high deman
2026-04-01T18:35:19Z	0.804977	0.800177	-0.004800	discard	mutate [7] skill:FUNC_TRANSFORMâ†’FUNC_QUADRATIC; arch:generalization_from_special_caseâ†’constraint_optimization_chain; style:modellingâ†’applied_real_world; mechs:[constraint_reasoning,hence_chains,cross_topic_synthesis]
2026-04-01T19:43:02Z	0.804977	0.801064	-0.003913	discard	mutate [7] skill:FUNC_TRANSFORMâ†’FUNC_QUADRATIC; arch:generalization_from_special_caseâ†’spatial_coordinate_bridge; style:modellingâ†’applied_real_world; mechs:[multi_representation,constraint_reasoning,cross_topic_synthesis]
2026-04-01T20:28:47Z	0.000000	0.000000	+0.000000	crash	error: 503 UNAVAILABLE. {'error': {'code': 503, 'message': 'This model is currently experiencing high deman
2026-04-01T21:11:29Z	0.000000	0.000000	+0.000000	crash	error: 503 UNAVAILABLE. {'error': {'code': 503, 'message': 'This model is currently experiencing high deman
2026-04-01T22:00:16Z	0.000000	0.000000	+0.000000	crash	error: 503 UNAVAILABLE. {'error': {'code': 503, 'message': 'This model is currently experiencing high deman
2026-04-01T22:51:14Z	0.000000	0.000000	+0.000000	crash	error: 503 UNAVAILABLE. {'error': {'code': 503, 'message': 'This model is currently experiencing high deman
2026-04-01T23:35:01Z	0.000000	0.000000	+0.000000	crash	error: 503 UNAVAILABLE. {'error': {'code': 503, 'message': 'This model is currently experiencing high deman
2026-04-02T00:02:13Z	0.000000	0.000000	+0.000000	crash	error: Missing required field: question
2026-04-02T03:24:12Z	0.804977	0.801269	-0.003708	discard	mutate [7] skill:FUNC_TRANSFORMâ†’FUNC_QUADRATIC; arch:generalization_from_special_caseâ†’constraint_optimization_chain; style:modellingâ†’applied_real_world; mechs:[constraint_reasoning,cross_topic_synthesis,hence_chains]
2026-04-02T05:19:50Z	0.804977	0.800799	-0.004178	discard	mutate [7] skill:FUNC_TRANSFORMâ†’FUNC_QUADRATIC; arch:generalization_from_special_caseâ†’constraint_optimization_chain; style:modellingâ†’applied_real_world; mechs:[constraint_reasoning,cross_topic_synthesis,hence_chains]
2026-04-02T06:43:48Z	0.804977	0.800664	-0.004313	discard	mutate [7] skill:FUNC_TRANSFORMâ†’FUNC_QUADRATIC; arch:generalization_from_special_caseâ†’constraint_optimization_chain; style:modellingâ†’applied_real_world; mechs:[constraint_reasoning,cross_topic_synthesis,hence_chains]
2026-04-02T07:54:10Z	0.804977	0.800436	-0.004541	discard	mutate [7] skill:FUNC_TRANSFORMâ†’FUNC_QUADRATIC; arch:generalization_from_special_caseâ†’constraint_optimization_chain; style:modellingâ†’applied_real_world; mechs:[constraint_reasoning,cross_topic_synthesis,hence_chains]
2026-04-02T08:55:01Z	0.804977	0.800523	-0.004454	discard	mutate [7] skill:FUNC_TRANSFORMâ†’FUNC_RATIONAL; arch:generalization_from_special_caseâ†’constraint_optimization_chain; style:modellingâ†’applied_real_world; mechs:[constraint_reasoning,cross_topic_synthesis,hence_chains]
2026-04-02T10:00:50Z	0.804977	0.801314	-0.003663	discard	mutate [7] skill:FUNC_TRANSFORMâ†’FUNC_QUADRATIC; arch:generalization_from_special_caseâ†’constraint_optimization_chain; style:modellingâ†’applied_real_world; mechs:[constraint_reasoning,cross_topic_synthesis,hence_chains]
2026-04-02T11:04:00Z	0.804977	0.801447	-0.003530	discard	mutate [7] skill:FUNC_TRANSFORMâ†’FUNC_QUADRATIC; arch:generalization_from_special_caseâ†’constraint_optimization_chain; style:modellingâ†’applied_real_world; mechs:[constraint_reasoning,hence_chains,hidden_structure]
2026-04-02T11:55:53Z	0.804977	0.800766	-0.004211	discard	mutate [7] skill:FUNC_TRANSFORMâ†’FUNC_QUADRATIC; arch:generalization_from_special_caseâ†’constraint_optimization_chain; style:modellingâ†’applied_real_world; mechs:[constraint_reasoning,hence_chains,cross_topic_synthesis]
2026-04-02T13:08:50Z	0.804977	0.801468	-0.003509	discard	mutate [7] skill:FUNC_TRANSFORMâ†’FUNC_QUADRATIC; arch:generalization_from_special_caseâ†’constraint_optimization_chain; style:modellingâ†’applied_real_world; mechs:[constraint_reasoning,hence_chains,cross_topic_synthesis]
2026-04-02T14:36:14Z	0.804977	0.801017	-0.003960	discard	mutate [7] skill:FUNC_TRANSFORMâ†’FUNC_QUADRATIC; arch:generalization_from_special_caseâ†’constraint_optimization_chain; style:modellingâ†’applied_real_world; mechs:[constraint_reasoning,cross_topic_synthesis,hidden_structure,hence_chains]
2026-04-02T15:38:59Z	0.804977	0.800755	-0.004222	discard	mutate [7] skill:FUNC_TRANSFORMâ†’FUNC_QUADRATIC; arch:generalization_from_special_caseâ†’constraint_optimization_chain; style:modellingâ†’applied_real_world; mechs:[constraint_reasoning,hence_chains,cross_topic_synthesis]
2026-04-02T16:35:45Z	0.000000	0.000000	+0.000000	crash	error: Server disconnected without sending a response.
2026-04-02T17:30:30Z	0.000000	0.000000	+0.000000	crash	JSON parse error: Extra data: line 25 column 1 (char 3191)
2026-04-02T18:11:57Z	0.804977	0.801055	-0.003922	discard	mutate [7] skill:FUNC_TRANSFORMâ†’FUNC_QUADRATIC; arch:generalization_from_special_caseâ†’constraint_optimization_chain; style:modellingâ†’applied_real_world; mechs:[constraint_reasoning,cross_topic_synthesis,hence_chains]
2026-04-02T19:18:21Z	0.804977	0.800573	-0.004404	discard	mutate [7] skill:FUNC_TRANSFORMâ†’FUNC_QUADRATIC; arch:generalization_from_special_caseâ†’constraint_optimization_chain; style:modellingâ†’applied_real_world; mechs:[constraint_reasoning,hence_chains,cross_topic_synthesis]
2026-04-02T20:01:35Z	0.804977	0.800690	-0.004287	discard	mutate [7] skill:FUNC_TRANSFORMâ†’FUNC_QUADRATIC; arch:generalization_from_special_caseâ†’constraint_optimization_chain; style:modellingâ†’applied_real_world; mechs:[constraint_reasoning,cross_topic_synthesis,hence_chains]
2026-04-02T20:51:56Z	0.804977	0.801094	-0.003883	discard	mutate [7] skill:FUNC_TRANSFORMâ†’FUNC_RATIONAL; arch:generalization_from_special_caseâ†’representation_bridge; style:modellingâ†’applied_real_world; mechs:[multi_representation,constraint_reasoning,hidden_structure]
2026-04-02T21:36:42Z	0.804977	0.800565	-0.004412	discard	mutate [7] skill:FUNC_TRANSFORMâ†’FUNC_QUADRATIC; arch:generalization_from_special_caseâ†’constraint_optimization_chain; style:modellingâ†’applied_real_world; mechs:[constraint_reasoning,hence_chains,cross_topic_synthesis]
2026-04-02T22:06:34Z	0.804977	0.800090	-0.004887	discard	mutate [7] skill:FUNC_TRANSFORMâ†’FUNC_QUADRATIC; arch:generalization_from_special_caseâ†’constraint_optimization_chain; style:modellingâ†’applied_real_world; mechs:[constraint_reasoning,hence_chains,cross_topic_synthesis]
2026-04-02T22:50:10Z	0.804977	0.801238	-0.003739	discard	mutate [7] skill:FUNC_TRANSFORMâ†’FUNC_QUADRATIC; arch:generalization_from_special_caseâ†’constraint_optimization_chain; style:modellingâ†’applied_real_world; mechs:[constraint_reasoning,cross_topic_synthesis,hence_chains]
2026-04-02T23:21:24Z	0.804977	0.801334	-0.003643	discard	mutate [7] skill:FUNC_TRANSFORMâ†’FUNC_INVERSE; arch:generalization_from_special_caseâ†’constraint_optimization_chain; style:modellingâ†’applied_real_world; mechs:[constraint_reasoning,cross_topic_synthesis,hence_chains]
2026-04-02T23:54:48Z	0.804977	0.801414	-0.003563	discard	mutate [7] skill:FUNC_TRANSFORMâ†’FUNC_QUADRATIC; arch:generalization_from_special_caseâ†’constraint_optimization_chain; style:modellingâ†’applied_real_world; mechs:[constraint_reasoning,cross_topic_synthesis]
2026-04-03T02:06:45Z	0.804977	0.800277	-0.004700	discard	mutate [7] skill:FUNC_TRANSFORMâ†’FUNC_RATIONAL; arch:generalization_from_special_caseâ†’constraint_optimization_chain; style:modellingâ†’applied_real_world; mechs:[constraint_reasoning,hidden_structure,hence_chains]
2026-04-03T04:38:56Z	0.804977	0.802821	-0.002156	discard	mutate [7] skill:FUNC_TRANSFORMâ†’FUNC_MODULUS; arch:generalization_from_special_caseâ†’spatial_coordinate_bridge; style:modellingâ†’applied_real_world; mechs:[cross_topic_synthesis,constraint_reasoning,multi_representation]
2026-04-03T06:03:15Z	0.804977	0.801348	-0.003629	discard	mutate [7] skill:FUNC_TRANSFORMâ†’FUNC_QUADRATIC; arch:generalization_from_special_caseâ†’constraint_optimization_chain; style:modellingâ†’applied_real_world; mechs:[constraint_reasoning,cross_topic_synthesis,hence_chains]
2026-04-03T07:37:16Z	0.804977	0.800226	-0.004751	discard	mutate [7] skill:FUNC_TRANSFORMâ†’FUNC_RATIONAL; arch:generalization_from_special_caseâ†’constraint_optimization_chain; style:modellingâ†’applied_real_world; mechs:[hidden_structure,constraint_reasoning,hence_chains]
2026-04-03T08:30:20Z	0.804977	0.800626	-0.004351	discard	mutate [7] skill:FUNC_TRANSFORMâ†’FUNC_QUADRATIC; arch:generalization_from_special_caseâ†’constraint_optimization_chain; style:modellingâ†’applied_real_world; mechs:[constraint_reasoning,cross_topic_synthesis,hence_chains]
2026-04-03T09:32:31Z	0.804977	0.805115	+0.000138	keep	mutate [7] skill:FUNC_TRANSFORMâ†’FUNC_QUADRATIC; arch:generalization_from_special_caseâ†’constraint_optimization_chain; style:modellingâ†’applied_real_world; mechs:[constraint_reasoning,cross_topic_synthesis,strategic_path]
2026-04-03T10:25:16Z	0.805115	0.805618	+0.000503	keep	mutate [31] skill:FUNC_QUADRATICâ†’FUNC_TRANSFORM; arch:constraint_optimization_chainâ†’spatial_coordinate_bridge; style:applied_real_worldâ†’modelling; mechs:[cross_topic_synthesis,proof_unfamiliar_context,multi_representation]
2026-04-03T11:10:40Z	0.805618	0.804508	-0.001110	discard	mutate [31] skill:FUNC_TRANSFORMâ†’FUNC_RATIONAL; arch:spatial_coordinate_bridgeâ†’constraint_optimization_chain; style:modellingâ†’applied_real_world; mechs:[cross_topic_synthesis,hidden_structure,hence_chains,constraint_reasoning]
2026-04-03T11:53:36Z	0.805618	0.804481	-0.001137	discard	mutate [31] skill:FUNC_TRANSFORMâ†’FUNC_RATIONAL; arch:spatial_coordinate_bridgeâ†’constraint_optimization_chain; style:modellingâ†’applied_real_world; mechs:[constraint_reasoning,hence_chains,cross_topic_synthesis]
2026-04-03T12:59:40Z	0.805618	0.804486	-0.001132	discard	mutate [31] skill:FUNC_TRANSFORMâ†’FUNC_RATIONAL; arch:spatial_coordinate_bridgeâ†’constraint_optimization_chain; style:modellingâ†’applied_real_world; mechs:[constraint_reasoning,hence_chains,cross_topic_synthesis]
2026-04-03T14:05:16Z	0.805618	0.804517	-0.001101	discard	mutate [31] skill:FUNC_TRANSFORMâ†’FUNC_RATIONAL; arch:spatial_coordinate_bridgeâ†’constraint_optimization_chain; style:modellingâ†’applied_real_world; mechs:[constraint_reasoning,hence_chains,cross_topic_synthesis]
2026-04-03T14:59:14Z	0.805618	0.805718	+0.000100	keep	mutate [31] skill:FUNC_TRANSFORMâ†’FUNC_QUADRATIC; arch:spatial_coordinate_bridgeâ†’constraint_optimization_chain; style:modellingâ†’applied_real_world; mechs:[constraint_reasoning,hence_chains,cross_topic_synthesis]
2026-04-03T15:44:14Z	0.805718	0.803240	-0.002478	discard	mutate [7] skill:FUNC_QUADRATICâ†’FUNC_TRANSFORM; arch:constraint_optimization_chainâ†’spatial_coordinate_bridge; style:applied_real_worldâ†’modelling; mechs:[cross_topic_synthesis,hidden_structure,proof_unfamiliar_context]
2026-04-03T16:23:02Z	0.805718	0.803233	-0.002485	discard	mutate [7] skill:FUNC_QUADRATICâ†’FUNC_TRANSFORM; arch:constraint_optimization_chainâ†’spatial_coordinate_bridge; style:applied_real_worldâ†’modelling; mechs:[cross_topic_synthesis,proof_unfamiliar_context,multi_representation]
2026-04-03T17:04:48Z	0.805718	0.803940	-0.001778	discard	mutate [7] skill:FUNC_QUADRATICâ†’FUNC_TRANSFORM; arch:constraint_optimization_chainâ†’spatial_coordinate_bridge; style:applied_real_worldâ†’modelling; mechs:[multi_representation,hidden_structure,hence_chains]
2026-04-03T17:50:57Z	0.805718	0.802554	-0.003164	discard	mutate [7] skill:FUNC_QUADRATICâ†’FUNC_GRAPH_SKETCH; arch:constraint_optimization_chainâ†’representation_bridge; style:applied_real_worldâ†’modelling; mechs:[multi_representation,hidden_structure,proof_unfamiliar_context]
2026-04-03T18:28:12Z	0.805718	0.801927	-0.003791	discard	mutate [7] skill:FUNC_QUADRATICâ†’FUNC_TRANSFORM; arch:constraint_optimization_chainâ†’spatial_coordinate_bridge; style:applied_real_worldâ†’modelling; mechs:[cross_topic_synthesis,multi_representation,proof_unfamiliar_context]
2026-04-03T19:13:26Z	0.805718	0.803536	-0.002182	discard	mutate [7] skill:FUNC_QUADRATICâ†’FUNC_TRANSFORM; arch:constraint_optimization_chainâ†’spatial_coordinate_bridge; style:applied_real_worldâ†’modelling; mechs:[multi_representation,hidden_structure,proof_unfamiliar_context]
2026-04-03T19:56:01Z	0.805718	0.802036	-0.003682	discard	mutate [7] skill:FUNC_QUADRATICâ†’FUNC_TRANSFORM; arch:constraint_optimization_chainâ†’spatial_coordinate_bridge; style:applied_real_worldâ†’modelling; mechs:[cross_topic_synthesis,hidden_structure,proof_unfamiliar_context]
2026-04-03T20:34:38Z	0.805718	0.803077	-0.002641	discard	mutate [7] skill:FUNC_QUADRATICâ†’FUNC_TRANSFORM; arch:constraint_optimization_chainâ†’spatial_coordinate_bridge; style:applied_real_worldâ†’modelling; mechs:[multi_representation,hidden_structure,proof_unfamiliar_context]
2026-04-03T21:05:56Z	0.805718	0.802086	-0.003632	discard	mutate [7] skill:FUNC_QUADRATICâ†’FUNC_TRANSFORM; arch:constraint_optimization_chainâ†’spatial_coordinate_bridge; style:applied_real_worldâ†’modelling; mechs:[cross_topic_synthesis,proof_unfamiliar_context,multi_representation]
2026-04-03T21:48:49Z	0.805718	0.802088	-0.003630	discard	mutate [7] skill:FUNC_QUADRATICâ†’FUNC_TRANSFORM; arch:constraint_optimization_chainâ†’spatial_coordinate_bridge; style:applied_real_worldâ†’modelling; mechs:[cross_topic_synthesis,multi_representation,proof_unfamiliar_context]
2026-04-03T22:18:39Z	0.805718	0.802065	-0.003653	discard	mutate [7] skill:FUNC_QUADRATICâ†’FUNC_TRANSFORM; arch:constraint_optimization_chainâ†’spatial_coordinate_bridge; style:applied_real_worldâ†’modelling; mechs:[cross_topic_synthesis,multi_representation,hidden_structure]
2026-04-03T22:57:17Z	0.805718	0.802561	-0.003157	discard	mutate [7] skill:FUNC_QUADRATICâ†’FUNC_GRAPH_SKETCH; arch:constraint_optimization_chainâ†’representation_bridge; style:applied_real_worldâ†’modelling; mechs:[multi_representation,cross_topic_synthesis,hidden_structure,proof_unfamiliar_context]
2026-04-03T23:35:27Z	0.805718	0.803330	-0.002388	discard	mutate [7] skill:FUNC_QUADRATICâ†’FUNC_TRANSFORM; arch:constraint_optimization_chainâ†’spatial_coordinate_bridge; style:applied_real_worldâ†’modelling; mechs:[multi_representation,cross_topic_synthesis,proof_unfamiliar_context]
2026-04-04T00:01:56Z	0.805718	0.801906	-0.003812	discard	mutate [7] skill:FUNC_QUADRATICâ†’FUNC_TRANSFORM; arch:constraint_optimization_chainâ†’spatial_coordinate_bridge; style:applied_real_worldâ†’modelling; mechs:[cross_topic_synthesis,multi_representation,hidden_structure]
2026-04-04T03:14:23Z	0.805718	0.801856	-0.003862	discard	mutate [7] skill:FUNC_QUADRATICâ†’FUNC_TRANSFORM; arch:constraint_optimization_chainâ†’spatial_coordinate_bridge; style:applied_real_worldâ†’modelling; mechs:[multi_representation,cross_topic_synthesis,proof_unfamiliar_context]
2026-04-04T05:04:50Z	0.805718	0.802022	-0.003696	discard	mutate [7] skill:FUNC_QUADRATICâ†’FUNC_GRAPH_SKETCH; arch:constraint_optimization_chainâ†’representation_bridge; style:applied_real_worldâ†’modelling; mechs:[multi_representation,proof_unfamiliar_context,hidden_structure]
2026-04-04T06:10:58Z	0.805718	0.803207	-0.002511	discard	mutate [7] skill:FUNC_QUADRATICâ†’FUNC_TRANSFORM; arch:constraint_optimization_chainâ†’spatial_coordinate_bridge; style:applied_real_worldâ†’modelling; mechs:[cross_topic_synthesis,proof_unfamiliar_context,hidden_structure]
2026-04-04T07:17:45Z	0.805718	0.802215	-0.003503	discard	mutate [7] skill:FUNC_QUADRATICâ†’FUNC_TRANSFORM; arch:constraint_optimization_chainâ†’spatial_coordinate_bridge; style:applied_real_worldâ†’modelling; mechs:[cross_topic_synthesis,multi_representation,proof_unfamiliar_context,hidden_structure]
2026-04-04T07:58:59Z	0.805718	0.802437	-0.003281	discard	mutate [7] skill:FUNC_QUADRATICâ†’FUNC_TRANSFORM; arch:constraint_optimization_chainâ†’spatial_coordinate_bridge; style:applied_real_worldâ†’modelling; mechs:[hidden_structure,proof_unfamiliar_context,cross_topic_synthesis]
2026-04-04T08:50:40Z	0.805718	0.803163	-0.002555	discard	mutate [7] skill:FUNC_QUADRATICâ†’FUNC_TRANSFORM; arch:constraint_optimization_chainâ†’spatial_coordinate_bridge; style:applied_real_worldâ†’modelling; mechs:[cross_topic_synthesis,hidden_structure,proof_unfamiliar_context]
2026-04-04T09:25:42Z	0.805718	0.802534	-0.003184	discard	mutate [7] skill:FUNC_QUADRATICâ†’FUNC_TRANSFORM; arch:constraint_optimization_chainâ†’spatial_coordinate_bridge; style:applied_real_worldâ†’modelling; mechs:[multi_representation,cross_topic_synthesis,hidden_structure,proof_unfamiliar_context]
2026-04-04T10:01:55Z	0.805718	0.802167	-0.003551	discard	mutate [7] skill:FUNC_QUADRATICâ†’FUNC_TRANSFORM; arch:constraint_optimization_chainâ†’spatial_coordinate_bridge; style:applied_real_worldâ†’modelling; mechs:[cross_topic_synthesis,multi_representation,hence_chains,proof_unfamiliar_context]
2026-04-04T10:51:39Z	0.805718	0.802944	-0.002774	discard	mutate [7] skill:FUNC_QUADRATICâ†’FUNC_TRANSFORM; arch:constraint_optimization_chainâ†’spatial_coordinate_bridge; style:applied_real_worldâ†’modelling; mechs:[cross_topic_synthesis,proof_unfamiliar_context,multi_representation]
2026-04-04T11:28:58Z	0.805718	0.803505	-0.002213	discard	mutate [7] skill:FUNC_QUADRATICâ†’FUNC_TRANSFORM; arch:constraint_optimization_chainâ†’spatial_coordinate_bridge; style:applied_real_worldâ†’modelling; mechs:[cross_topic_synthesis,multi_representation,proof_unfamiliar_context]
2026-04-04T11:53:41Z	0.000000	0.000000	+0.000000	crash	error: Missing required field: question
2026-04-04T12:52:27Z	0.805718	0.802362	-0.003356	discard	mutate [7] skill:FUNC_QUADRATICâ†’FUNC_TRANSFORM; arch:constraint_optimization_chainâ†’spatial_coordinate_bridge; style:applied_real_worldâ†’modelling; mechs:[multi_representation,cross_topic_synthesis,hence_chains,hidden_structure]
2026-04-04T13:52:40Z	0.805718	0.802213	-0.003505	discard	mutate [7] skill:FUNC_QUADRATICâ†’FUNC_TRANSFORM; arch:constraint_optimization_chainâ†’spatial_coordinate_bridge; style:applied_real_worldâ†’modelling; mechs:[cross_topic_synthesis,multi_representation,proof_unfamiliar_context]
2026-04-04T14:32:42Z	0.805718	0.802301	-0.003417	discard	mutate [7] skill:FUNC_QUADRATICâ†’FUNC_TRANSFORM; arch:constraint_optimization_chainâ†’spatial_coordinate_bridge; style:applied_real_worldâ†’modelling; mechs:[multi_representation,cross_topic_synthesis,proof_unfamiliar_context]
2026-04-04T15:04:03Z	0.805718	0.802540	-0.003178	discard	mutate [7] skill:FUNC_QUADRATICâ†’FUNC_TRANSFORM; arch:constraint_optimization_chainâ†’spatial_coordinate_bridge; style:applied_real_worldâ†’modelling; mechs:[cross_topic_synthesis,multi_representation,proof_unfamiliar_context,hidden_structure]
2026-04-04T15:46:36Z	0.805718	0.802586	-0.003132	discard	mutate [7] skill:FUNC_QUADRATICâ†’FUNC_GRAPH_SKETCH; arch:constraint_optimization_chainâ†’representation_bridge; style:applied_real_worldâ†’modelling; mechs:[multi_representation,proof_unfamiliar_context,hidden_structure]
2026-04-04T16:17:57Z	0.805718	0.801948	-0.003770	discard	mutate [7] skill:FUNC_QUADRATICâ†’FUNC_GRAPH_SKETCH; arch:constraint_optimization_chainâ†’representation_bridge; style:applied_real_worldâ†’modelling; mechs:[multi_representation,hidden_structure,hence_chains]
