timestamp	old_score	new_score	delta	status	description
2026-05-03T15:28:36Z	0.805438	0.802161	-0.003277	discard	mutate [12] skill:FUNC_TRANSFORMâ†’FUNC_QUADRATIC; arch:spatial_coordinate_bridgeâ†’constraint_optimization_chain; style:applied_real_worldâ†’modelling; mechs:[constraint_reasoning,cross_topic_synthesis,hidden_structure]
2026-05-03T16:10:35Z	0.805438	0.802838	-0.002600	discard	mutate [12] skill:FUNC_TRANSFORMâ†’FUNC_QUADRATIC; arch:spatial_coordinate_bridgeâ†’constraint_optimization_chain; style:applied_real_worldâ†’modelling; mechs:[constraint_reasoning,cross_topic_synthesis]
2026-05-03T17:08:32Z	0.805438	0.802920	-0.002518	discard	mutate [12] skill:FUNC_TRANSFORMâ†’FUNC_QUADRATIC; arch:spatial_coordinate_bridgeâ†’constraint_optimization_chain; style:applied_real_worldâ†’modelling; mechs:[constraint_reasoning,cross_topic_synthesis,hence_chains]
2026-05-03T18:01:28Z	0.805438	0.802952	-0.002486	discard	mutate [12] skill:FUNC_TRANSFORMâ†’FUNC_QUADRATIC; arch:spatial_coordinate_bridgeâ†’constraint_optimization_chain; style:applied_real_worldâ†’modelling; mechs:[constraint_reasoning,cross_topic_synthesis,hence_chains]
2026-05-03T19:13:12Z	0.805438	0.802301	-0.003137	discard	mutate [12] skill:FUNC_TRANSFORMâ†’FUNC_QUADRATIC; arch:spatial_coordinate_bridgeâ†’constraint_optimization_chain; style:applied_real_worldâ†’modelling; mechs:[constraint_reasoning,cross_topic_synthesis]
2026-05-03T20:02:45Z	0.805438	0.802182	-0.003256	discard	mutate [12] skill:FUNC_TRANSFORMâ†’FUNC_QUADRATIC; arch:spatial_coordinate_bridgeâ†’constraint_optimization_chain; style:applied_real_worldâ†’modelling; mechs:[constraint_reasoning,cross_topic_synthesis,hence_chains]
2026-05-03T21:00:01Z	0.805438	0.801706	-0.003732	discard	mutate [12] skill:FUNC_TRANSFORMâ†’FUNC_QUADRATIC; arch:spatial_coordinate_bridgeâ†’constraint_optimization_chain; style:applied_real_worldâ†’modelling; mechs:[constraint_reasoning,cross_topic_synthesis,hidden_structure]
2026-05-03T21:52:47Z	0.805438	0.802851	-0.002587	discard	mutate [12] skill:FUNC_TRANSFORMâ†’FUNC_QUADRATIC; arch:spatial_coordinate_bridgeâ†’constraint_optimization_chain; style:applied_real_worldâ†’modelling; mechs:[constraint_reasoning,hence_chains,cross_topic_synthesis]
2026-05-03T22:38:51Z	0.805438	0.801661	-0.003777	discard	mutate [12] skill:FUNC_TRANSFORMâ†’FUNC_QUADRATIC; arch:spatial_coordinate_bridgeâ†’constraint_optimization_chain; style:applied_real_worldâ†’modelling; mechs:[constraint_reasoning,cross_topic_synthesis,hence_chains]
2026-05-03T23:27:38Z	0.805438	0.802459	-0.002979	discard	mutate [12] skill:FUNC_TRANSFORMâ†’FUNC_QUADRATIC; arch:spatial_coordinate_bridgeâ†’constraint_optimization_chain; style:applied_real_worldâ†’modelling; mechs:[constraint_reasoning,cross_topic_synthesis]
2026-05-04T00:12:02Z	0.805438	0.802285	-0.003153	discard	mutate [12] skill:FUNC_TRANSFORMâ†’FUNC_QUADRATIC; arch:spatial_coordinate_bridgeâ†’constraint_optimization_chain; style:applied_real_worldâ†’modelling; mechs:[cross_topic_synthesis,constraint_reasoning,hence_chains]
2026-05-04T04:13:33Z	0.805438	0.802181	-0.003257	discard	mutate [12] skill:FUNC_TRANSFORMâ†’FUNC_QUADRATIC; arch:spatial_coordinate_bridgeâ†’constraint_optimization_chain; style:applied_real_worldâ†’modelling; mechs:[constraint_reasoning,cross_topic_synthesis,hence_chains]
2026-05-04T07:27:59Z	0.805438	0.803564	-0.001874	discard	mutate [12] skill:FUNC_TRANSFORMâ†’FUNC_RATIONAL; arch:spatial_coordinate_bridgeâ†’constraint_optimization_chain; mechs:[constraint_reasoning,hence_chains,cross_topic_synthesis]
2026-05-04T09:37:47Z	0.805438	0.801851	-0.003587	discard	mutate [12] skill:FUNC_TRANSFORMâ†’FUNC_QUADRATIC; arch:spatial_coordinate_bridgeâ†’constraint_optimization_chain; style:applied_real_worldâ†’modelling; mechs:[constraint_reasoning,cross_topic_synthesis]
2026-05-04T11:26:17Z	0.805438	0.802446	-0.002992	discard	mutate [12] skill:FUNC_TRANSFORMâ†’FUNC_SUM_PRODUCT_ROOTS; arch:spatial_coordinate_bridgeâ†’constraint_optimization_chain; style:applied_real_worldâ†’modelling; mechs:[constraint_reasoning,cross_topic_synthesis]
2026-05-04T13:06:33Z	0.805438	0.803096	-0.002342	discard	mutate [12] skill:FUNC_TRANSFORMâ†’FUNC_QUADRATIC; arch:spatial_coordinate_bridgeâ†’constraint_optimization_chain; style:applied_real_worldâ†’modelling; mechs:[constraint_reasoning,cross_topic_synthesis,hence_chains]
2026-05-04T15:18:18Z	0.805438	0.803289	-0.002149	discard	mutate [12] skill:FUNC_TRANSFORMâ†’FUNC_QUADRATIC; arch:spatial_coordinate_bridgeâ†’constraint_optimization_chain; mechs:[constraint_reasoning,hence_chains,cross_topic_synthesis]
2026-05-04T17:04:56Z	0.805438	0.802499	-0.002939	discard	mutate [12] skill:FUNC_TRANSFORMâ†’FUNC_QUADRATIC; arch:spatial_coordinate_bridgeâ†’constraint_optimization_chain; mechs:[constraint_reasoning,hence_chains,cross_topic_synthesis,proof_unfamiliar_context]
2026-05-04T18:51:16Z	0.805438	0.802906	-0.002532	discard	mutate [12] skill:FUNC_TRANSFORMâ†’FUNC_RATIONAL; arch:spatial_coordinate_bridgeâ†’constraint_optimization_chain; mechs:[constraint_reasoning,hence_chains,cross_topic_synthesis]
2026-05-04T20:08:47Z	0.805438	0.803028	-0.002410	discard	mutate [12] skill:FUNC_TRANSFORMâ†’FUNC_SUM_PRODUCT_ROOTS; arch:spatial_coordinate_bridgeâ†’constraint_optimization_chain; style:applied_real_worldâ†’modelling; mechs:[constraint_reasoning,cross_topic_synthesis,hidden_structure]
2026-05-04T21:19:19Z	0.805438	0.801752	-0.003686	discard	mutate [12] skill:FUNC_TRANSFORMâ†’FUNC_QUADRATIC; arch:spatial_coordinate_bridgeâ†’constraint_optimization_chain; style:applied_real_worldâ†’modelling; mechs:[constraint_reasoning,cross_topic_synthesis]
2026-05-04T22:18:32Z	0.805438	0.802364	-0.003074	discard	mutate [12] skill:FUNC_TRANSFORMâ†’FUNC_RATIONAL; arch:spatial_coordinate_bridgeâ†’constraint_optimization_chain; style:applied_real_worldâ†’modelling; mechs:[constraint_reasoning,cross_topic_synthesis]
