timestamp	old_score	new_score	delta	status	description
2026-04-11T14:53:18Z	0.805718	0.802082	-0.003636	discard	mutate [7] skill:FUNC_QUADRATICâ†’FUNC_GRAPH_SKETCH; arch:constraint_optimization_chainâ†’representation_bridge; style:applied_real_worldâ†’modelling; mechs:[multi_representation,hidden_structure,proof_unfamiliar_context]
2026-04-11T15:32:24Z	0.805718	0.802522	-0.003196	discard	mutate [7] skill:FUNC_QUADRATICâ†’FUNC_TRANSFORM; arch:constraint_optimization_chainâ†’spatial_coordinate_bridge; style:applied_real_worldâ†’modelling; mechs:[multi_representation,cross_topic_synthesis,proof_unfamiliar_context]
2026-04-11T16:02:17Z	0.000000	0.000000	+0.000000	crash	error: Missing required field: question
2026-04-11T16:54:10Z	0.805718	0.801952	-0.003766	discard	mutate [7] skill:FUNC_QUADRATICâ†’FUNC_TRANSFORM; arch:constraint_optimization_chainâ†’spatial_coordinate_bridge; style:applied_real_worldâ†’modelling; mechs:[cross_topic_synthesis,proof_unfamiliar_context,multi_representation]
2026-04-11T17:30:55Z	0.805718	0.803044	-0.002674	discard	mutate [7] skill:FUNC_QUADRATICâ†’FUNC_TRANSFORM; arch:constraint_optimization_chainâ†’representation_bridge; style:applied_real_worldâ†’modelling; mechs:[cross_topic_synthesis,proof_unfamiliar_context,hidden_structure]
2026-04-11T18:00:35Z	0.805718	0.802253	-0.003465	discard	mutate [7] skill:FUNC_QUADRATICâ†’FUNC_TRANSFORM; arch:constraint_optimization_chainâ†’spatial_coordinate_bridge; style:applied_real_worldâ†’modelling; mechs:[cross_topic_synthesis,proof_unfamiliar_context,multi_representation]
2026-04-11T19:00:25Z	0.805718	0.802946	-0.002772	discard	mutate [7] skill:FUNC_QUADRATICâ†’FUNC_TRANSFORM; arch:constraint_optimization_chainâ†’spatial_coordinate_bridge; style:applied_real_worldâ†’modelling; mechs:[cross_topic_synthesis,multi_representation,proof_unfamiliar_context]
2026-04-11T19:41:02Z	0.805718	0.802024	-0.003694	discard	mutate [7] skill:FUNC_QUADRATICâ†’FUNC_TRANSFORM; arch:constraint_optimization_chainâ†’spatial_coordinate_bridge; style:applied_real_worldâ†’modelling; mechs:[cross_topic_synthesis,multi_representation,hence_chains,proof_unfamiliar_context]
2026-04-11T20:01:30Z	0.805718	0.802486	-0.003232	discard	mutate [7] skill:FUNC_QUADRATICâ†’FUNC_TRANSFORM; arch:constraint_optimization_chainâ†’spatial_coordinate_bridge; style:applied_real_worldâ†’modelling; mechs:[multi_representation,cross_topic_synthesis,hidden_structure,proof_unfamiliar_context]
2026-04-11T20:51:16Z	0.805718	0.802744	-0.002974	discard	mutate [7] skill:FUNC_QUADRATICâ†’FUNC_TRANSFORM; arch:constraint_optimization_chainâ†’reverse_engineering; style:applied_real_worldâ†’modelling; mechs:[cross_topic_synthesis,hidden_structure,proof_unfamiliar_context]
2026-04-11T21:21:49Z	0.805718	0.803975	-0.001743	discard	mutate [7] skill:FUNC_QUADRATICâ†’FUNC_TRANSFORM; arch:constraint_optimization_chainâ†’spatial_coordinate_bridge; style:applied_real_worldâ†’modelling; mechs:[multi_representation,cross_topic_synthesis,proof_unfamiliar_context,hidden_structure]
2026-04-11T21:53:30Z	0.805718	0.802906	-0.002812	discard	mutate [7] skill:FUNC_QUADRATICâ†’FUNC_TRANSFORM; arch:constraint_optimization_chainâ†’spatial_coordinate_bridge; style:applied_real_worldâ†’modelling; mechs:[multi_representation,cross_topic_synthesis,hidden_structure]
2026-04-11T22:30:39Z	0.805718	0.801927	-0.003791	discard	mutate [7] skill:FUNC_QUADRATICâ†’FUNC_TRANSFORM; arch:constraint_optimization_chainâ†’spatial_coordinate_bridge; style:applied_real_worldâ†’modelling; mechs:[multi_representation,cross_topic_synthesis,proof_unfamiliar_context,hidden_structure]
2026-04-11T23:03:54Z	0.805718	0.802813	-0.002905	discard	mutate [7] skill:FUNC_QUADRATICâ†’FUNC_TRANSFORM; arch:constraint_optimization_chainâ†’spatial_coordinate_bridge; style:applied_real_worldâ†’modelling; mechs:[cross_topic_synthesis,hidden_structure,proof_unfamiliar_context]
2026-04-11T23:49:35Z	0.805718	0.803187	-0.002531	discard	mutate [7] skill:FUNC_QUADRATICâ†’FUNC_TRANSFORM; arch:constraint_optimization_chainâ†’spatial_coordinate_bridge; style:applied_real_worldâ†’modelling; mechs:[multi_representation,proof_unfamiliar_context,hidden_structure]
2026-04-12T01:10:30Z	0.805718	0.801854	-0.003864	discard	mutate [7] skill:FUNC_QUADRATICâ†’FUNC_TRANSFORM; arch:constraint_optimization_chainâ†’spatial_coordinate_bridge; style:applied_real_worldâ†’modelling; mechs:[cross_topic_synthesis,hidden_structure,multi_representation]
2026-04-12T04:20:34Z	0.805718	0.802055	-0.003663	discard	mutate [7] skill:FUNC_QUADRATICâ†’FUNC_TRANSFORM; arch:constraint_optimization_chainâ†’spatial_coordinate_bridge; style:applied_real_worldâ†’modelling; mechs:[multi_representation,cross_topic_synthesis,proof_unfamiliar_context]
2026-04-12T06:07:43Z	0.805718	0.802444	-0.003274	discard	mutate [7] skill:FUNC_QUADRATICâ†’FUNC_TRANSFORM; arch:constraint_optimization_chainâ†’spatial_coordinate_bridge; style:applied_real_worldâ†’modelling; mechs:[hidden_structure,cross_topic_synthesis,multi_representation]
2026-04-12T07:43:15Z	0.805718	0.803556	-0.002162	discard	mutate [7] skill:FUNC_QUADRATICâ†’FUNC_TRANSFORM; arch:constraint_optimization_chainâ†’spatial_coordinate_bridge; style:applied_real_worldâ†’modelling; mechs:[multi_representation,proof_unfamiliar_context,hidden_structure,cross_topic_synthesis]
2026-04-12T08:33:31Z	0.805718	0.803167	-0.002551	discard	mutate [7] skill:FUNC_QUADRATICâ†’FUNC_TRANSFORM; arch:constraint_optimization_chainâ†’spatial_coordinate_bridge; style:applied_real_worldâ†’modelling; mechs:[multi_representation,hidden_structure,proof_unfamiliar_context]
2026-04-12T09:30:36Z	0.805718	0.802658	-0.003060	discard	mutate [7] skill:FUNC_QUADRATICâ†’FUNC_TRANSFORM; arch:constraint_optimization_chainâ†’spatial_coordinate_bridge; style:applied_real_worldâ†’modelling; mechs:[cross_topic_synthesis,multi_representation,proof_unfamiliar_context]
2026-04-12T10:10:17Z	0.000000	0.000000	+0.000000	crash	JSON parse error: Extra data: line 31 column 1 (char 3688)
2026-04-12T10:59:58Z	0.805718	0.803258	-0.002460	discard	mutate [7] skill:FUNC_QUADRATICâ†’FUNC_TRANSFORM; arch:constraint_optimization_chainâ†’spatial_coordinate_bridge; style:applied_real_worldâ†’modelling; mechs:[cross_topic_synthesis,multi_representation,proof_unfamiliar_context]
2026-04-12T11:39:17Z	0.805718	0.802680	-0.003038	discard	mutate [7] skill:FUNC_QUADRATICâ†’FUNC_GRAPH_SKETCH; arch:constraint_optimization_chainâ†’representation_bridge; style:applied_real_worldâ†’modelling; mechs:[multi_representation,hidden_structure,proof_unfamiliar_context]
2026-04-12T12:03:37Z	0.805718	0.802982	-0.002736	discard	mutate [7] skill:FUNC_QUADRATICâ†’FUNC_TRANSFORM; arch:constraint_optimization_chainâ†’spatial_coordinate_bridge; style:applied_real_worldâ†’modelling; mechs:[multi_representation,cross_topic_synthesis,hidden_structure]
2026-04-12T13:24:16Z	0.805718	0.804034	-0.001684	discard	mutate [7] skill:FUNC_QUADRATICâ†’FUNC_TRANSFORM; arch:constraint_optimization_chainâ†’spatial_coordinate_bridge; style:applied_real_worldâ†’modelling; mechs:[multi_representation,hidden_structure,proof_unfamiliar_context]
2026-04-12T14:09:29Z	0.805718	0.802028	-0.003690	discard	mutate [7] skill:FUNC_QUADRATICâ†’FUNC_TRANSFORM; arch:constraint_optimization_chainâ†’spatial_coordinate_bridge; style:applied_real_worldâ†’modelling; mechs:[multi_representation,cross_topic_synthesis,hidden_structure]
2026-04-12T14:58:09Z	0.000000	0.000000	+0.000000	crash	error: Missing required field: question
2026-04-12T15:39:01Z	0.805718	0.802461	-0.003257	discard	mutate [7] skill:FUNC_QUADRATICâ†’FUNC_TRANSFORM; arch:constraint_optimization_chainâ†’spatial_coordinate_bridge; style:applied_real_worldâ†’modelling; mechs:[multi_representation,cross_topic_synthesis,proof_unfamiliar_context]
2026-04-12T16:06:43Z	0.000000	0.000000	+0.000000	crash	JSON parse error: Extra data: line 31 column 1 (char 3937)
2026-04-12T16:56:50Z	0.805718	0.801763	-0.003955	discard	mutate [7] skill:FUNC_QUADRATICâ†’FUNC_TRANSFORM; arch:constraint_optimization_chainâ†’generalization_from_special_case; style:applied_real_worldâ†’modelling; mechs:[hidden_structure,hence_chains,proof_unfamiliar_context]
2026-04-12T17:33:27Z	0.000000	0.000000	+0.000000	crash	error: Missing required field: question
2026-04-12T18:05:21Z	0.000000	0.000000	+0.000000	crash	error: 503 UNAVAILABLE. {'error': {'code': 503, 'message': 'This model is currently experiencing high deman
2026-04-12T19:06:55Z	0.805718	0.802914	-0.002804	discard	mutate [7] skill:FUNC_QUADRATICâ†’FUNC_TRANSFORM; arch:constraint_optimization_chainâ†’generalization_from_special_case; style:applied_real_worldâ†’modelling; mechs:[proof_unfamiliar_context,hidden_structure,multi_representation]
2026-04-12T19:50:43Z	0.805718	0.802211	-0.003507	discard	mutate [7] skill:FUNC_QUADRATICâ†’FUNC_TRANSFORM; arch:constraint_optimization_chainâ†’spatial_coordinate_bridge; style:applied_real_worldâ†’modelling; mechs:[proof_unfamiliar_context,hidden_structure,cross_topic_synthesis]
2026-04-12T20:20:15Z	0.805718	0.803199	-0.002519	discard	mutate [7] skill:FUNC_QUADRATICâ†’FUNC_TRANSFORM; arch:constraint_optimization_chainâ†’spatial_coordinate_bridge; style:applied_real_worldâ†’modelling; mechs:[multi_representation,cross_topic_synthesis,proof_unfamiliar_context,hence_chains]
2026-04-12T20:57:56Z	0.805718	0.803063	-0.002655	discard	mutate [7] skill:FUNC_QUADRATICâ†’FUNC_TRANSFORM; arch:constraint_optimization_chainâ†’spatial_coordinate_bridge; style:applied_real_worldâ†’modelling; mechs:[multi_representation,hidden_structure,proof_unfamiliar_context]
2026-04-12T21:38:50Z	0.805718	0.803109	-0.002609	discard	mutate [7] skill:FUNC_QUADRATICâ†’FUNC_TRANSFORM; arch:constraint_optimization_chainâ†’spatial_coordinate_bridge; style:applied_real_worldâ†’modelling; mechs:[multi_representation,hidden_structure,proof_unfamiliar_context]
2026-04-12T22:04:07Z	0.805718	0.802118	-0.003600	discard	mutate [7] skill:FUNC_QUADRATICâ†’FUNC_TRANSFORM; arch:constraint_optimization_chainâ†’spatial_coordinate_bridge; style:applied_real_worldâ†’modelling; mechs:[multi_representation,cross_topic_synthesis,proof_unfamiliar_context]
2026-04-12T22:53:42Z	0.805718	0.802062	-0.003656	discard	mutate [7] skill:FUNC_QUADRATICâ†’FUNC_GRAPH_SKETCH; arch:constraint_optimization_chainâ†’representation_bridge; style:applied_real_worldâ†’modelling; mechs:[multi_representation,hidden_structure,proof_unfamiliar_context]
2026-04-12T23:33:12Z	0.805718	0.803096	-0.002622	discard	mutate [7] skill:FUNC_QUADRATICâ†’FUNC_TRANSFORM; arch:constraint_optimization_chainâ†’spatial_coordinate_bridge; style:applied_real_worldâ†’modelling; mechs:[proof_unfamiliar_context,cross_topic_synthesis,multi_representation]
2026-04-13T00:06:02Z	0.805718	0.801912	-0.003806	discard	mutate [7] skill:FUNC_QUADRATICâ†’FUNC_TRANSFORM; arch:constraint_optimization_chainâ†’spatial_coordinate_bridge; style:applied_real_worldâ†’modelling; mechs:[cross_topic_synthesis,hidden_structure,proof_unfamiliar_context]
2026-04-13T03:51:00Z	0.805718	0.802809	-0.002909	discard	mutate [7] skill:FUNC_QUADRATICâ†’FUNC_TRANSFORM; arch:constraint_optimization_chainâ†’spatial_coordinate_bridge; style:applied_real_worldâ†’modelling; mechs:[cross_topic_synthesis,multi_representation,constraint_reasoning,proof_unfamiliar_context]
2026-04-13T06:07:46Z	0.805718	0.803513	-0.002205	discard	mutate [7] skill:FUNC_QUADRATICâ†’FUNC_TRANSFORM; arch:constraint_optimization_chainâ†’spatial_coordinate_bridge; style:applied_real_worldâ†’modelling; mechs:[multi_representation,cross_topic_synthesis,hidden_structure,hence_chains]
2026-04-13T08:21:12Z	0.000000	0.000000	+0.000000	crash	error: 503 UNAVAILABLE. {'error': {'code': 503, 'message': 'This model is currently experiencing high deman
2026-04-13T10:12:32Z	0.000000	0.000000	+0.000000	crash	error: 503 UNAVAILABLE. {'error': {'code': 503, 'message': 'This model is currently experiencing high deman
2026-04-13T11:44:47Z	0.000000	0.000000	+0.000000	crash	error: Missing required field: question
2026-04-13T12:49:21Z	0.805718	0.802061	-0.003657	discard	mutate [7] skill:FUNC_QUADRATICâ†’FUNC_TRANSFORM; arch:constraint_optimization_chainâ†’spatial_coordinate_bridge; style:applied_real_worldâ†’modelling; mechs:[cross_topic_synthesis,multi_representation,proof_unfamiliar_context]
2026-04-13T14:24:57Z	0.805718	0.916885	+0.111167	keep	mutate [7] skill:FUNC_QUADRATICâ†’FUNC_TRANSFORM; arch:constraint_optimization_chainâ†’spatial_coordinate_bridge; style:applied_real_worldâ†’modelling; mechs:[cross_topic_synthesis,multi_representation,hidden_structure]
2026-04-13T15:56:40Z	0.803237	0.801658	-0.001579	discard	mutate [7] skill:FUNC_TRANSFORMâ†’FUNC_QUADRATIC; arch:spatial_coordinate_bridgeâ†’constraint_optimization_chain; style:modellingâ†’applied_real_world; mechs:[constraint_reasoning,proof_unfamiliar_context,cross_topic_synthesis]
2026-04-13T18:15:46Z	0.803237	0.801272	-0.001965	discard	mutate [7] skill:FUNC_TRANSFORMâ†’FUNC_QUADRATIC; arch:spatial_coordinate_bridgeâ†’constraint_optimization_chain; style:modellingâ†’applied_real_world; mechs:[constraint_reasoning,proof_unfamiliar_context,cross_topic_synthesis]
2026-04-13T19:41:53Z	0.803237	0.800770	-0.002467	discard	mutate [7] skill:FUNC_TRANSFORMâ†’FUNC_QUADRATIC; arch:spatial_coordinate_bridgeâ†’constraint_optimization_chain; style:modellingâ†’applied_real_world; mechs:[constraint_reasoning,cross_topic_synthesis,hence_chains]
2026-04-13T20:39:43Z	0.803237	0.801608	-0.001629	discard	mutate [7] skill:FUNC_TRANSFORMâ†’FUNC_QUADRATIC; arch:spatial_coordinate_bridgeâ†’constraint_optimization_chain; style:modellingâ†’applied_real_world; mechs:[constraint_reasoning,proof_unfamiliar_context,hence_chains]
2026-04-13T21:31:36Z	0.803237	0.801236	-0.002001	discard	mutate [7] skill:FUNC_TRANSFORMâ†’FUNC_RATIONAL; arch:spatial_coordinate_bridgeâ†’constraint_optimization_chain; style:modellingâ†’applied_real_world; mechs:[constraint_reasoning,proof_unfamiliar_context,cross_topic_synthesis]
2026-04-13T22:28:09Z	0.803237	0.800762	-0.002475	discard	mutate [7] skill:FUNC_TRANSFORMâ†’FUNC_QUADRATIC; arch:spatial_coordinate_bridgeâ†’constraint_optimization_chain; style:modellingâ†’applied_real_world; mechs:[constraint_reasoning,cross_topic_synthesis,proof_unfamiliar_context]
2026-04-13T23:12:36Z	0.803237	0.801338	-0.001899	discard	mutate [7] skill:FUNC_TRANSFORMâ†’FUNC_QUADRATIC; arch:spatial_coordinate_bridgeâ†’constraint_optimization_chain; style:modellingâ†’applied_real_world; mechs:[constraint_reasoning,hence_chains,cross_topic_synthesis,proof_unfamiliar_context]
2026-04-14T00:03:01Z	0.803237	0.800735	-0.002502	discard	mutate [7] skill:FUNC_TRANSFORMâ†’FUNC_RATIONAL; arch:spatial_coordinate_bridgeâ†’constraint_optimization_chain; style:modellingâ†’applied_real_world; mechs:[constraint_reasoning,proof_unfamiliar_context,cross_topic_synthesis]
2026-04-14T03:38:12Z	0.803237	0.800735	-0.002502	discard	mutate [7] skill:FUNC_TRANSFORMâ†’FUNC_QUADRATIC; arch:spatial_coordinate_bridgeâ†’constraint_optimization_chain; style:modellingâ†’applied_real_world; mechs:[constraint_reasoning,proof_unfamiliar_context,hence_chains]
2026-04-14T05:49:51Z	0.803237	0.800724	-0.002513	discard	mutate [7] skill:FUNC_TRANSFORMâ†’FUNC_QUADRATIC; arch:spatial_coordinate_bridgeâ†’constraint_optimization_chain; style:modellingâ†’applied_real_world; mechs:[constraint_reasoning,proof_unfamiliar_context,cross_topic_synthesis,hidden_structure]
2026-04-14T07:13:26Z	0.803237	0.801219	-0.002018	discard	mutate [7] skill:FUNC_TRANSFORMâ†’FUNC_QUADRATIC; arch:spatial_coordinate_bridgeâ†’constraint_optimization_chain; style:modellingâ†’applied_real_world; mechs:[constraint_reasoning,cross_topic_synthesis,proof_unfamiliar_context]
2026-04-14T08:57:35Z	0.803237	0.801073	-0.002164	discard	mutate [7] skill:FUNC_TRANSFORMâ†’FUNC_QUADRATIC; arch:spatial_coordinate_bridgeâ†’constraint_optimization_chain; style:modellingâ†’applied_real_world; mechs:[constraint_reasoning,cross_topic_synthesis,hence_chains]
2026-04-14T10:16:50Z	0.803237	0.801917	-0.001320	discard	mutate [7] skill:FUNC_TRANSFORMâ†’FUNC_DOMAIN; arch:spatial_coordinate_bridgeâ†’constraint_optimization_chain; style:modellingâ†’applied_real_world; mechs:[constraint_reasoning,proof_unfamiliar_context,cross_topic_synthesis]
2026-04-14T11:33:34Z	0.803237	0.801178	-0.002059	discard	mutate [7] skill:FUNC_TRANSFORMâ†’FUNC_QUADRATIC; arch:spatial_coordinate_bridgeâ†’constraint_optimization_chain; style:modellingâ†’applied_real_world; mechs:[constraint_reasoning,cross_topic_synthesis,proof_unfamiliar_context]
2026-04-14T12:44:02Z	0.803237	0.801683	-0.001554	discard	mutate [7] skill:FUNC_TRANSFORMâ†’FUNC_QUADRATIC; arch:spatial_coordinate_bridgeâ†’constraint_optimization_chain; style:modellingâ†’applied_real_world; mechs:[constraint_reasoning,proof_unfamiliar_context]
2026-04-14T14:27:52Z	0.803237	0.801723	-0.001514	discard	mutate [7] skill:FUNC_TRANSFORMâ†’FUNC_QUADRATIC; arch:spatial_coordinate_bridgeâ†’constraint_optimization_chain; style:modellingâ†’applied_real_world; mechs:[constraint_reasoning,cross_topic_synthesis,hence_chains]
2026-04-14T15:50:05Z	0.803237	0.801583	-0.001654	discard	mutate [7] skill:FUNC_TRANSFORMâ†’FUNC_QUADRATIC; arch:spatial_coordinate_bridgeâ†’constraint_optimization_chain; style:modellingâ†’applied_real_world; mechs:[constraint_reasoning,proof_unfamiliar_context,cross_topic_synthesis]
2026-04-14T16:52:30Z	0.803237	0.801491	-0.001746	discard	mutate [7] skill:FUNC_TRANSFORMâ†’FUNC_QUADRATIC; arch:spatial_coordinate_bridgeâ†’constraint_optimization_chain; style:modellingâ†’applied_real_world; mechs:[constraint_reasoning,proof_unfamiliar_context,cross_topic_synthesis,hence_chains]
2026-04-14T18:04:51Z	0.916885	0.917756	+0.000871	keep	mutate [11] skill:FUNC_TRANSFORMâ†’FUNC_QUADRATIC; arch:proveâ†’constraint_optimization_chain; style:Noneâ†’applied_real_world; mechs:[constraint_reasoning,proof_unfamiliar_context,hidden_structure]
2026-04-14T19:40:37Z	0.803447	0.802207	-0.001240	discard	mutate [31] skill:FUNC_QUADRATICâ†’FUNC_TRANSFORM; arch:constraint_optimization_chainâ†’representation_bridge; style:applied_real_worldâ†’modelling; mechs:[cross_topic_synthesis,constraint_reasoning,hence_chains,proof_unfamiliar_context]
2026-04-14T20:35:24Z	0.803447	0.804391	+0.000944	keep	mutate [31] skill:FUNC_QUADRATICâ†’FUNC_TRANSFORM; arch:constraint_optimization_chainâ†’representation_bridge; style:applied_real_worldâ†’modelling; mechs:[cross_topic_synthesis,multi_representation,hidden_structure,hence_chains]
2026-04-14T21:31:26Z	0.804391	0.803007	-0.001384	discard	mutate [7] skill:FUNC_TRANSFORMâ†’FUNC_QUADRATIC; arch:spatial_coordinate_bridgeâ†’constraint_optimization_chain; style:modellingâ†’applied_real_world; mechs:[cross_topic_synthesis,constraint_reasoning,hence_chains]
2026-04-14T22:25:26Z	0.804391	0.803739	-0.000652	discard	mutate [7] skill:FUNC_TRANSFORMâ†’FUNC_QUADRATIC; arch:spatial_coordinate_bridgeâ†’constraint_optimization_chain; style:modellingâ†’applied_real_world; mechs:[constraint_reasoning,cross_topic_synthesis]
2026-04-14T23:11:07Z	0.000000	0.000000	+0.000000	crash	error: 503 UNAVAILABLE. {'error': {'code': 503, 'message': 'This model is currently experiencing high deman
2026-04-15T00:03:23Z	0.804391	0.802837	-0.001554	discard	mutate [7] skill:FUNC_TRANSFORMâ†’FUNC_QUADRATIC; arch:spatial_coordinate_bridgeâ†’constraint_optimization_chain; style:modellingâ†’applied_real_world; mechs:[constraint_reasoning,hence_chains,cross_topic_synthesis]
2026-04-15T03:37:56Z	0.804391	0.802954	-0.001437	discard	mutate [7] skill:FUNC_TRANSFORMâ†’FUNC_RATIONAL; arch:spatial_coordinate_bridgeâ†’constraint_optimization_chain; style:modellingâ†’applied_real_world; mechs:[constraint_reasoning,cross_topic_synthesis,hence_chains]
2026-04-15T05:50:25Z	0.804391	0.802914	-0.001477	discard	mutate [7] skill:FUNC_TRANSFORMâ†’FUNC_QUADRATIC; arch:spatial_coordinate_bridgeâ†’constraint_optimization_chain; style:modellingâ†’applied_real_world; mechs:[cross_topic_synthesis,constraint_reasoning,hence_chains]
2026-04-15T07:14:23Z	0.804391	0.803772	-0.000619	discard	mutate [7] skill:FUNC_TRANSFORMâ†’FUNC_QUADRATIC; arch:spatial_coordinate_bridgeâ†’constraint_optimization_chain; style:modellingâ†’applied_real_world; mechs:[cross_topic_synthesis,hence_chains,constraint_reasoning]
2026-04-15T08:57:55Z	0.804391	0.802500	-0.001891	discard	mutate [7] skill:FUNC_TRANSFORMâ†’FUNC_RATIONAL; arch:spatial_coordinate_bridgeâ†’constraint_optimization_chain; style:modellingâ†’applied_real_world; mechs:[constraint_reasoning,cross_topic_synthesis,hence_chains]
2026-04-15T10:18:51Z	0.804391	0.803038	-0.001353	discard	mutate [7] skill:FUNC_TRANSFORMâ†’FUNC_QUADRATIC; arch:spatial_coordinate_bridgeâ†’constraint_optimization_chain; style:modellingâ†’applied_real_world; mechs:[constraint_reasoning,cross_topic_synthesis]
2026-04-15T11:30:06Z	0.000000	0.000000	+0.000000	crash	error: 503 UNAVAILABLE. {'error': {'code': 503, 'message': 'This model is currently experiencing high deman
2026-04-15T12:41:12Z	0.804391	0.803595	-0.000796	discard	mutate [7] skill:FUNC_TRANSFORMâ†’FUNC_QUADRATIC; arch:spatial_coordinate_bridgeâ†’constraint_optimization_chain; style:modellingâ†’applied_real_world; mechs:[constraint_reasoning,cross_topic_synthesis,hence_chains]
2026-04-15T14:18:52Z	0.804391	0.803794	-0.000597	discard	mutate [7] skill:FUNC_TRANSFORMâ†’FUNC_QUADRATIC; arch:spatial_coordinate_bridgeâ†’constraint_optimization_chain; style:modellingâ†’applied_real_world; mechs:[constraint_reasoning,hence_chains,cross_topic_synthesis]
2026-04-15T15:42:39Z	0.804391	0.803654	-0.000737	discard	mutate [7] skill:FUNC_TRANSFORMâ†’FUNC_QUADRATIC; arch:spatial_coordinate_bridgeâ†’constraint_optimization_chain; style:modellingâ†’applied_real_world; mechs:[constraint_reasoning,cross_topic_synthesis,hence_chains]
2026-04-15T16:45:06Z	0.000000	0.000000	+0.000000	crash	error: 503 UNAVAILABLE. {'error': {'code': 503, 'message': 'This model is currently experiencing high deman
