timestamp	old_score	new_score	delta	status	description
2026-04-15T17:52:07Z	0.804391	0.802630	-0.001761	discard	mutate [7] skill:FUNC_TRANSFORMâ†’FUNC_RATIONAL; arch:spatial_coordinate_bridgeâ†’constraint_optimization_chain; style:modellingâ†’applied_real_world; mechs:[constraint_reasoning,cross_topic_synthesis]
2026-04-15T19:14:14Z	0.804391	0.802877	-0.001514	discard	mutate [7] skill:FUNC_TRANSFORMâ†’FUNC_QUADRATIC; arch:spatial_coordinate_bridgeâ†’constraint_optimization_chain; style:modellingâ†’applied_real_world; mechs:[constraint_reasoning,hence_chains,cross_topic_synthesis]
2026-04-15T20:12:31Z	0.804391	0.803054	-0.001337	discard	mutate [7] skill:FUNC_TRANSFORMâ†’FUNC_QUADRATIC; arch:spatial_coordinate_bridgeâ†’constraint_optimization_chain; style:modellingâ†’applied_real_world; mechs:[constraint_reasoning,cross_topic_synthesis,hence_chains]
2026-04-15T21:10:11Z	0.804391	0.803032	-0.001359	discard	mutate [7] skill:FUNC_TRANSFORMâ†’FUNC_QUADRATIC; arch:spatial_coordinate_bridgeâ†’constraint_optimization_chain; style:modellingâ†’applied_real_world; mechs:[constraint_reasoning,hence_chains,cross_topic_synthesis]
2026-04-15T22:04:43Z	0.804391	0.803106	-0.001285	discard	mutate [7] skill:FUNC_TRANSFORMâ†’FUNC_QUADRATIC; arch:spatial_coordinate_bridgeâ†’constraint_optimization_chain; style:modellingâ†’applied_real_world; mechs:[constraint_reasoning,cross_topic_synthesis,hidden_structure]
2026-04-15T22:58:48Z	0.804391	0.802596	-0.001795	discard	mutate [7] skill:FUNC_TRANSFORMâ†’FUNC_QUADRATIC; arch:spatial_coordinate_bridgeâ†’constraint_optimization_chain; style:modellingâ†’applied_real_world; mechs:[constraint_reasoning,hidden_structure,hence_chains]
2026-04-15T23:50:02Z	0.804391	0.802979	-0.001412	discard	mutate [7] skill:FUNC_TRANSFORMâ†’FUNC_QUADRATIC; arch:spatial_coordinate_bridgeâ†’constraint_optimization_chain; style:modellingâ†’applied_real_world; mechs:[constraint_reasoning,cross_topic_synthesis,proof_unfamiliar_context]
2026-04-16T01:15:21Z	0.804391	0.803830	-0.000561	discard	mutate [7] skill:FUNC_TRANSFORMâ†’FUNC_QUADRATIC; arch:spatial_coordinate_bridgeâ†’constraint_optimization_chain; style:modellingâ†’applied_real_world; mechs:[constraint_reasoning,cross_topic_synthesis,proof_unfamiliar_context]
2026-04-16T04:26:57Z	0.804391	0.917016	+0.112625	keep	mutate [7] skill:FUNC_TRANSFORMâ†’FUNC_QUADRATIC; arch:spatial_coordinate_bridgeâ†’constraint_optimization_chain; style:modellingâ†’applied_real_world; mechs:[constraint_reasoning,proof_unfamiliar_context,cross_topic_synthesis]
2026-04-16T06:20:08Z	0.802808	0.805622	+0.002814	keep	mutate [26] skill:FUNC_QUADRATICâ†’FUNC_TRANSFORM; arch:constraint_optimization_chainâ†’spatial_coordinate_bridge; mechs:[multi_representation,hidden_structure,hence_chains,cross_topic_synthesis]
2026-04-16T08:09:59Z	0.805622	0.802593	-0.003029	discard	mutate [26] skill:FUNC_TRANSFORMâ†’FUNC_QUADRATIC; arch:spatial_coordinate_bridgeâ†’constraint_optimization_chain; style:applied_real_worldâ†’modelling; mechs:[constraint_reasoning,cross_topic_synthesis,hidden_structure]
2026-04-16T09:48:14Z	0.805622	0.803589	-0.002033	discard	mutate [26] skill:FUNC_TRANSFORMâ†’FUNC_QUADRATIC; arch:spatial_coordinate_bridgeâ†’constraint_optimization_chain; mechs:[constraint_reasoning,cross_topic_synthesis,hidden_structure]
2026-04-16T10:51:57Z	0.805622	0.803609	-0.002013	discard	mutate [26] skill:FUNC_TRANSFORMâ†’FUNC_QUADRATIC; arch:spatial_coordinate_bridgeâ†’constraint_optimization_chain; style:applied_real_worldâ†’modelling; mechs:[constraint_reasoning,cross_topic_synthesis,hidden_structure]
2026-04-16T11:58:59Z	0.805622	0.803047	-0.002575	discard	mutate [26] skill:FUNC_TRANSFORMâ†’FUNC_QUADRATIC; arch:spatial_coordinate_bridgeâ†’constraint_optimization_chain; style:applied_real_worldâ†’modelling; mechs:[constraint_reasoning,cross_topic_synthesis,hence_chains]
2026-04-16T13:54:29Z	0.805622	0.802270	-0.003352	discard	mutate [26] skill:FUNC_TRANSFORMâ†’FUNC_QUADRATIC; arch:spatial_coordinate_bridgeâ†’constraint_optimization_chain; style:applied_real_worldâ†’modelling; mechs:[constraint_reasoning,cross_topic_synthesis,hence_chains]
2026-04-16T15:24:28Z	0.805622	0.803068	-0.002554	discard	mutate [26] skill:FUNC_TRANSFORMâ†’FUNC_RATIONAL; arch:spatial_coordinate_bridgeâ†’constraint_optimization_chain; style:applied_real_worldâ†’modelling; mechs:[constraint_reasoning,hence_chains,cross_topic_synthesis]
2026-04-16T16:55:46Z	0.805622	0.802553	-0.003069	discard	mutate [26] skill:FUNC_TRANSFORMâ†’FUNC_QUADRATIC; arch:spatial_coordinate_bridgeâ†’constraint_optimization_chain; style:applied_real_worldâ†’modelling; mechs:[cross_topic_synthesis,hidden_structure,constraint_reasoning]
2026-04-16T18:08:20Z	0.805622	0.802977	-0.002645	discard	mutate [26] skill:FUNC_TRANSFORMâ†’FUNC_QUADRATIC; arch:spatial_coordinate_bridgeâ†’constraint_optimization_chain; style:applied_real_worldâ†’modelling; mechs:[constraint_reasoning,cross_topic_synthesis,hence_chains]
2026-04-16T19:37:21Z	0.805622	0.802362	-0.003260	discard	mutate [26] skill:FUNC_TRANSFORMâ†’FUNC_QUADRATIC; arch:spatial_coordinate_bridgeâ†’constraint_optimization_chain; style:applied_real_worldâ†’modelling; mechs:[constraint_reasoning,cross_topic_synthesis,hence_chains]
2026-04-16T20:27:31Z	0.805622	0.802796	-0.002826	discard	mutate [26] skill:FUNC_TRANSFORMâ†’FUNC_QUADRATIC; arch:spatial_coordinate_bridgeâ†’constraint_optimization_chain; style:applied_real_worldâ†’modelling; mechs:[constraint_reasoning,cross_topic_synthesis,hence_chains]
2026-04-16T21:11:37Z	0.805622	0.804279	-0.001343	discard	mutate [26] skill:FUNC_TRANSFORMâ†’FUNC_QUADRATIC; arch:spatial_coordinate_bridgeâ†’constraint_optimization_chain; mechs:[constraint_reasoning,cross_topic_synthesis,hence_chains]
2026-04-16T22:00:15Z	0.805622	0.802716	-0.002906	discard	mutate [26] skill:FUNC_TRANSFORMâ†’FUNC_QUADRATIC; arch:spatial_coordinate_bridgeâ†’constraint_optimization_chain; style:applied_real_worldâ†’modelling; mechs:[constraint_reasoning,cross_topic_synthesis,hence_chains,hidden_structure]
2026-04-16T22:54:02Z	0.000000	0.000000	+0.000000	crash	JSON parse error: Extra data: line 28 column 1 (char 3555)
2026-04-16T23:39:12Z	0.805622	0.803702	-0.001920	discard	mutate [26] skill:FUNC_TRANSFORMâ†’FUNC_QUADRATIC; arch:spatial_coordinate_bridgeâ†’constraint_optimization_chain; style:applied_real_worldâ†’modelling; mechs:[constraint_reasoning,hence_chains,cross_topic_synthesis]
2026-04-17T01:10:21Z	0.805622	0.802363	-0.003259	discard	mutate [26] skill:FUNC_TRANSFORMâ†’FUNC_LOG; arch:spatial_coordinate_bridgeâ†’constraint_optimization_chain; style:applied_real_worldâ†’modelling; mechs:[constraint_reasoning,cross_topic_synthesis,hidden_structure]
2026-04-17T04:22:09Z	0.805622	0.803037	-0.002585	discard	mutate [26] skill:FUNC_TRANSFORMâ†’FUNC_QUADRATIC; arch:spatial_coordinate_bridgeâ†’constraint_optimization_chain; style:applied_real_worldâ†’modelling; mechs:[constraint_reasoning,cross_topic_synthesis,hidden_structure]
2026-04-17T06:20:43Z	0.805622	0.802631	-0.002991	discard	mutate [26] skill:FUNC_TRANSFORMâ†’FUNC_QUADRATIC; arch:spatial_coordinate_bridgeâ†’constraint_optimization_chain; style:applied_real_worldâ†’modelling; mechs:[constraint_reasoning,hence_chains,cross_topic_synthesis]
2026-04-17T08:09:33Z	0.805622	0.803629	-0.001993	discard	mutate [26] skill:FUNC_TRANSFORMâ†’FUNC_QUADRATIC; arch:spatial_coordinate_bridgeâ†’constraint_optimization_chain; style:applied_real_worldâ†’modelling; mechs:[constraint_reasoning,cross_topic_synthesis,hence_chains,hidden_structure]
2026-04-17T09:46:25Z	0.805622	0.803044	-0.002578	discard	mutate [26] skill:FUNC_TRANSFORMâ†’FUNC_QUADRATIC; arch:spatial_coordinate_bridgeâ†’constraint_optimization_chain; style:applied_real_worldâ†’modelling; mechs:[constraint_reasoning,hence_chains,cross_topic_synthesis]
2026-04-17T10:44:19Z	0.805622	0.802902	-0.002720	discard	mutate [26] skill:FUNC_TRANSFORMâ†’FUNC_RATIONAL; arch:spatial_coordinate_bridgeâ†’constraint_optimization_chain; style:applied_real_worldâ†’modelling; mechs:[constraint_reasoning,cross_topic_synthesis,hence_chains]
2026-04-17T11:39:54Z	0.805622	0.802540	-0.003082	discard	mutate [26] skill:FUNC_TRANSFORMâ†’FUNC_QUADRATIC; arch:spatial_coordinate_bridgeâ†’constraint_optimization_chain; style:applied_real_worldâ†’modelling; mechs:[constraint_reasoning,cross_topic_synthesis]
2026-04-17T12:43:41Z	0.805622	0.802955	-0.002667	discard	mutate [26] skill:FUNC_TRANSFORMâ†’FUNC_QUADRATIC; arch:spatial_coordinate_bridgeâ†’constraint_optimization_chain; style:applied_real_worldâ†’modelling; mechs:[constraint_reasoning,cross_topic_synthesis,hence_chains]
2026-04-17T14:11:35Z	0.920142	0.917115	-0.003027	discard	mutate [12] skill:FUNC_TRANSFORMâ†’FUNC_QUADRATIC; arch:spatial_coordinate_bridgeâ†’constraint_optimization_chain; style:applied_real_worldâ†’modelling; mechs:[constraint_reasoning,cross_topic_synthesis,hence_chains]
2026-04-17T15:20:04Z	0.920142	0.916462	-0.003680	discard	mutate [12] skill:FUNC_TRANSFORMâ†’FUNC_SUM_PRODUCT_ROOTS; arch:spatial_coordinate_bridgeâ†’constraint_optimization_chain; style:applied_real_worldâ†’modelling; mechs:[constraint_reasoning,cross_topic_synthesis,hidden_structure,hence_chains]
2026-04-17T16:17:09Z	0.805622	0.802943	-0.002679	discard	mutate [26] skill:FUNC_TRANSFORMâ†’FUNC_QUADRATIC; arch:spatial_coordinate_bridgeâ†’constraint_optimization_chain; style:applied_real_worldâ†’modelling; mechs:[constraint_reasoning,hence_chains,cross_topic_synthesis]
2026-04-17T17:11:14Z	0.805622	0.802592	-0.003030	discard	mutate [26] skill:FUNC_TRANSFORMâ†’FUNC_QUADRATIC; arch:spatial_coordinate_bridgeâ†’constraint_optimization_chain; style:applied_real_worldâ†’modelling; mechs:[constraint_reasoning,cross_topic_synthesis,hence_chains]
2026-04-17T18:06:05Z	0.805622	0.802777	-0.002845	discard	mutate [26] skill:FUNC_TRANSFORMâ†’FUNC_QUADRATIC; arch:spatial_coordinate_bridgeâ†’constraint_optimization_chain; style:applied_real_worldâ†’modelling; mechs:[constraint_reasoning,hence_chains,cross_topic_synthesis]
2026-04-17T19:19:19Z	0.805622	0.802188	-0.003434	discard	mutate [26] skill:FUNC_TRANSFORMâ†’FUNC_QUADRATIC; arch:spatial_coordinate_bridgeâ†’constraint_optimization_chain; style:applied_real_worldâ†’modelling; mechs:[cross_topic_synthesis,constraint_reasoning,hence_chains]
2026-04-17T20:06:27Z	0.805622	0.802265	-0.003357	discard	mutate [26] skill:FUNC_TRANSFORMâ†’FUNC_QUADRATIC; arch:spatial_coordinate_bridgeâ†’constraint_optimization_chain; style:applied_real_worldâ†’modelling; mechs:[hence_chains,constraint_reasoning,cross_topic_synthesis]
2026-04-17T21:01:43Z	0.805622	0.803693	-0.001929	discard	mutate [26] skill:FUNC_TRANSFORMâ†’FUNC_QUADRATIC; arch:spatial_coordinate_bridgeâ†’constraint_optimization_chain; style:applied_real_worldâ†’modelling; mechs:[constraint_reasoning,cross_topic_synthesis,hence_chains]
2026-04-17T21:55:19Z	0.805622	0.803672	-0.001950	discard	mutate [26] skill:FUNC_TRANSFORMâ†’FUNC_QUADRATIC; arch:spatial_coordinate_bridgeâ†’constraint_optimization_chain; style:applied_real_worldâ†’modelling; mechs:[constraint_reasoning,hence_chains,cross_topic_synthesis]
2026-04-17T22:37:31Z	0.920142	0.917115	-0.003027	discard	mutate [12] skill:FUNC_TRANSFORMâ†’FUNC_QUADRATIC; arch:spatial_coordinate_bridgeâ†’constraint_optimization_chain; style:applied_real_worldâ†’modelling; mechs:[constraint_reasoning,cross_topic_synthesis,hence_chains]
2026-04-17T23:23:12Z	0.805622	0.803365	-0.002257	discard	mutate [26] skill:FUNC_TRANSFORMâ†’FUNC_QUADRATIC; arch:spatial_coordinate_bridgeâ†’constraint_optimization_chain; mechs:[constraint_reasoning,cross_topic_synthesis,hence_chains]
2026-04-18T00:04:36Z	0.805622	0.803718	-0.001904	discard	mutate [26] skill:FUNC_TRANSFORMâ†’FUNC_QUADRATIC; arch:spatial_coordinate_bridgeâ†’constraint_optimization_chain; style:applied_real_worldâ†’modelling; mechs:[constraint_reasoning,cross_topic_synthesis]
2026-04-18T03:28:50Z	0.805622	0.803019	-0.002603	discard	mutate [26] skill:FUNC_TRANSFORMâ†’FUNC_QUADRATIC; arch:spatial_coordinate_bridgeâ†’constraint_optimization_chain; style:applied_real_worldâ†’modelling; mechs:[constraint_reasoning,cross_topic_synthesis,hence_chains]
2026-04-18T05:23:49Z	0.805622	0.802656	-0.002966	discard	mutate [26] skill:FUNC_TRANSFORMâ†’FUNC_QUADRATIC; arch:spatial_coordinate_bridgeâ†’constraint_optimization_chain; style:applied_real_worldâ†’modelling; mechs:[constraint_reasoning,cross_topic_synthesis,hence_chains]
2026-04-18T06:45:40Z	0.805622	0.803445	-0.002177	discard	mutate [26] skill:FUNC_TRANSFORMâ†’FUNC_QUADRATIC; arch:spatial_coordinate_bridgeâ†’constraint_optimization_chain; style:applied_real_worldâ†’modelling; mechs:[constraint_reasoning,cross_topic_synthesis]
2026-04-18T07:48:48Z	0.805622	0.802877	-0.002745	discard	mutate [26] skill:FUNC_TRANSFORMâ†’FUNC_QUADRATIC; arch:spatial_coordinate_bridgeâ†’constraint_optimization_chain; style:applied_real_worldâ†’modelling; mechs:[constraint_reasoning,cross_topic_synthesis,hidden_structure]
2026-04-18T08:33:29Z	0.805622	0.802950	-0.002672	discard	mutate [26] skill:FUNC_TRANSFORMâ†’FUNC_RATIONAL; arch:spatial_coordinate_bridgeâ†’constraint_optimization_chain; style:applied_real_worldâ†’modelling; mechs:[constraint_reasoning,cross_topic_synthesis,hence_chains]
2026-04-18T09:31:50Z	0.805622	0.803673	-0.001949	discard	mutate [26] skill:FUNC_TRANSFORMâ†’FUNC_QUADRATIC; arch:spatial_coordinate_bridgeâ†’constraint_optimization_chain; style:applied_real_worldâ†’modelling; mechs:[constraint_reasoning,hence_chains,hidden_structure]
2026-04-18T10:25:18Z	0.805622	0.803234	-0.002388	discard	mutate [26] skill:FUNC_TRANSFORMâ†’FUNC_QUADRATIC; arch:spatial_coordinate_bridgeâ†’constraint_optimization_chain; style:applied_real_worldâ†’modelling; mechs:[constraint_reasoning,cross_topic_synthesis,hence_chains]
2026-04-18T11:07:48Z	0.805622	0.802636	-0.002986	discard	mutate [26] skill:FUNC_TRANSFORMâ†’FUNC_QUADRATIC; arch:spatial_coordinate_bridgeâ†’constraint_optimization_chain; style:applied_real_worldâ†’modelling; mechs:[constraint_reasoning,cross_topic_synthesis]
2026-04-18T11:49:04Z	0.805622	0.802758	-0.002864	discard	mutate [26] skill:FUNC_TRANSFORMâ†’FUNC_QUADRATIC; arch:spatial_coordinate_bridgeâ†’constraint_optimization_chain; style:applied_real_worldâ†’modelling; mechs:[constraint_reasoning,cross_topic_synthesis]
2026-04-18T12:28:53Z	0.805622	0.803079	-0.002543	discard	mutate [26] skill:FUNC_TRANSFORMâ†’FUNC_RATIONAL; arch:spatial_coordinate_bridgeâ†’constraint_optimization_chain; style:applied_real_worldâ†’modelling; mechs:[constraint_reasoning,cross_topic_synthesis,hence_chains]
2026-04-18T13:42:57Z	0.805622	0.802255	-0.003367	discard	mutate [26] skill:FUNC_TRANSFORMâ†’FUNC_QUADRATIC; arch:spatial_coordinate_bridgeâ†’constraint_optimization_chain; style:applied_real_worldâ†’modelling; mechs:[constraint_reasoning,cross_topic_synthesis,hidden_structure,hence_chains]
2026-04-18T14:28:38Z	0.805622	0.802303	-0.003319	discard	mutate [26] skill:FUNC_TRANSFORMâ†’FUNC_QUADRATIC; arch:spatial_coordinate_bridgeâ†’constraint_optimization_chain; style:applied_real_worldâ†’modelling; mechs:[constraint_reasoning,cross_topic_synthesis,hence_chains]
2026-04-18T15:08:26Z	0.920142	0.803334	-0.116808	discard	mutate [12] skill:FUNC_TRANSFORMâ†’FUNC_QUADRATIC; arch:spatial_coordinate_bridgeâ†’constraint_optimization_chain; style:applied_real_worldâ†’modelling; mechs:[constraint_reasoning,hence_chains]
2026-04-18T15:52:49Z	0.805622	0.802606	-0.003016	discard	mutate [26] skill:FUNC_TRANSFORMâ†’FUNC_LOG; arch:spatial_coordinate_bridgeâ†’constraint_optimization_chain; style:applied_real_worldâ†’modelling; mechs:[constraint_reasoning,cross_topic_synthesis,hence_chains]
2026-04-18T16:38:52Z	0.805622	0.802690	-0.002932	discard	mutate [26] skill:FUNC_TRANSFORMâ†’FUNC_QUADRATIC; arch:spatial_coordinate_bridgeâ†’constraint_optimization_chain; style:applied_real_worldâ†’modelling; mechs:[cross_topic_synthesis,constraint_reasoning]
2026-04-18T17:21:15Z	0.805622	0.802823	-0.002799	discard	mutate [26] skill:FUNC_TRANSFORMâ†’FUNC_QUADRATIC; arch:spatial_coordinate_bridgeâ†’constraint_optimization_chain; style:applied_real_worldâ†’modelling; mechs:[constraint_reasoning,hence_chains,hidden_structure]
2026-04-18T17:58:16Z	0.805622	0.802956	-0.002666	discard	mutate [26] skill:FUNC_TRANSFORMâ†’FUNC_QUADRATIC; arch:spatial_coordinate_bridgeâ†’constraint_optimization_chain; style:applied_real_worldâ†’modelling; mechs:[constraint_reasoning,cross_topic_synthesis,hidden_structure]
2026-04-18T18:53:46Z	0.805622	0.802821	-0.002801	discard	mutate [26] skill:FUNC_TRANSFORMâ†’FUNC_QUADRATIC; arch:spatial_coordinate_bridgeâ†’constraint_optimization_chain; mechs:[constraint_reasoning,cross_topic_synthesis,hence_chains]
2026-04-18T19:40:28Z	0.805622	0.803323	-0.002299	discard	mutate [26] skill:FUNC_TRANSFORMâ†’FUNC_QUADRATIC; arch:spatial_coordinate_bridgeâ†’constraint_optimization_chain; mechs:[constraint_reasoning,cross_topic_synthesis,hence_chains]
2026-04-18T20:06:24Z	0.805622	0.803753	-0.001869	discard	mutate [26] skill:FUNC_TRANSFORMâ†’FUNC_SUM_PRODUCT_ROOTS; arch:spatial_coordinate_bridgeâ†’constraint_optimization_chain; style:applied_real_worldâ†’modelling; mechs:[constraint_reasoning,cross_topic_synthesis,hence_chains]
2026-04-18T20:52:28Z	0.805622	0.803753	-0.001869	discard	mutate [26] skill:FUNC_TRANSFORMâ†’FUNC_QUADRATIC; arch:spatial_coordinate_bridgeâ†’constraint_optimization_chain; style:applied_real_worldâ†’modelling; mechs:[constraint_reasoning,cross_topic_synthesis]
2026-04-18T21:33:30Z	0.805622	0.802658	-0.002964	discard	mutate [26] skill:FUNC_TRANSFORMâ†’FUNC_QUADRATIC; arch:spatial_coordinate_bridgeâ†’constraint_optimization_chain; style:applied_real_worldâ†’modelling; mechs:[constraint_reasoning,cross_topic_synthesis,hence_chains]
2026-04-18T22:04:01Z	0.805622	0.803747	-0.001875	discard	mutate [26] skill:FUNC_TRANSFORMâ†’FUNC_QUADRATIC; arch:spatial_coordinate_bridgeâ†’constraint_optimization_chain; mechs:[constraint_reasoning,cross_topic_synthesis,hence_chains]
2026-04-18T22:54:39Z	0.805622	0.802896	-0.002726	discard	mutate [26] skill:FUNC_TRANSFORMâ†’FUNC_QUADRATIC; arch:spatial_coordinate_bridgeâ†’constraint_optimization_chain; style:applied_real_worldâ†’modelling; mechs:[constraint_reasoning,cross_topic_synthesis,hence_chains]
2026-04-18T23:33:01Z	0.805622	0.803592	-0.002030	discard	mutate [26] skill:FUNC_TRANSFORMâ†’FUNC_QUADRATIC; arch:spatial_coordinate_bridgeâ†’constraint_optimization_chain; mechs:[constraint_reasoning,hence_chains,proof_unfamiliar_context]
2026-04-19T00:05:04Z	0.805622	0.802849	-0.002773	discard	mutate [26] skill:FUNC_TRANSFORMâ†’FUNC_QUADRATIC; arch:spatial_coordinate_bridgeâ†’constraint_optimization_chain; style:applied_real_worldâ†’modelling; mechs:[constraint_reasoning,cross_topic_synthesis,hidden_structure,hence_chains]
2026-04-19T03:48:57Z	0.805622	0.802818	-0.002804	discard	mutate [26] skill:FUNC_TRANSFORMâ†’FUNC_QUADRATIC; arch:spatial_coordinate_bridgeâ†’constraint_optimization_chain; style:applied_real_worldâ†’modelling; mechs:[constraint_reasoning,cross_topic_synthesis]
2026-04-19T05:51:37Z	0.805622	0.802918	-0.002704	discard	mutate [26] skill:FUNC_TRANSFORMâ†’FUNC_RATIONAL; arch:spatial_coordinate_bridgeâ†’constraint_optimization_chain; style:applied_real_worldâ†’modelling; mechs:[constraint_reasoning,cross_topic_synthesis,hence_chains]
2026-04-19T07:16:55Z	0.805622	0.802910	-0.002712	discard	mutate [26] skill:FUNC_TRANSFORMâ†’FUNC_QUADRATIC; arch:spatial_coordinate_bridgeâ†’constraint_optimization_chain; style:applied_real_worldâ†’modelling; mechs:[constraint_reasoning,cross_topic_synthesis]
2026-04-19T08:15:53Z	0.805622	0.803741	-0.001881	discard	mutate [26] skill:FUNC_TRANSFORMâ†’FUNC_QUADRATIC; arch:spatial_coordinate_bridgeâ†’constraint_optimization_chain; style:applied_real_worldâ†’modelling; mechs:[constraint_reasoning,cross_topic_synthesis,hidden_structure]
2026-04-19T09:10:05Z	0.805622	0.803235	-0.002387	discard	mutate [26] skill:FUNC_TRANSFORMâ†’FUNC_QUADRATIC; arch:spatial_coordinate_bridgeâ†’constraint_optimization_chain; mechs:[constraint_reasoning,cross_topic_synthesis,hence_chains]
2026-04-19T10:00:53Z	0.805622	0.802368	-0.003254	discard	mutate [26] skill:FUNC_TRANSFORMâ†’FUNC_QUADRATIC; arch:spatial_coordinate_bridgeâ†’constraint_optimization_chain; style:applied_real_worldâ†’modelling; mechs:[constraint_reasoning,cross_topic_synthesis,hence_chains]
2026-04-19T10:53:15Z	0.805622	0.803268	-0.002354	discard	mutate [26] skill:FUNC_TRANSFORMâ†’FUNC_QUADRATIC; arch:spatial_coordinate_bridgeâ†’constraint_optimization_chain; style:applied_real_worldâ†’modelling; mechs:[constraint_reasoning,cross_topic_synthesis,hence_chains]
2026-04-19T11:34:44Z	0.805622	0.803793	-0.001829	discard	mutate [26] skill:FUNC_TRANSFORMâ†’FUNC_QUADRATIC; arch:spatial_coordinate_bridgeâ†’constraint_optimization_chain; style:applied_real_worldâ†’modelling; mechs:[constraint_reasoning,hence_chains,hidden_structure,cross_topic_synthesis]
2026-04-19T12:02:38Z	0.805622	0.802875	-0.002747	discard	mutate [26] skill:FUNC_TRANSFORMâ†’FUNC_QUADRATIC; arch:spatial_coordinate_bridgeâ†’constraint_optimization_chain; style:applied_real_worldâ†’modelling; mechs:[constraint_reasoning,cross_topic_synthesis,hence_chains]
2026-04-19T13:24:24Z	0.805622	0.802727	-0.002895	discard	mutate [26] skill:FUNC_TRANSFORMâ†’FUNC_QUADRATIC; arch:spatial_coordinate_bridgeâ†’constraint_optimization_chain; style:applied_real_worldâ†’modelling; mechs:[constraint_reasoning,cross_topic_synthesis,hence_chains]
2026-04-19T14:09:38Z	0.805622	0.802925	-0.002697	discard	mutate [26] skill:FUNC_TRANSFORMâ†’FUNC_QUADRATIC; arch:spatial_coordinate_bridgeâ†’constraint_optimization_chain; style:applied_real_worldâ†’modelling; mechs:[constraint_reasoning,cross_topic_synthesis,hence_chains]
