timestamp	old_score	new_score	delta	status	description
2026-03-25T11:59:51Z	0.804977	0.800841	-0.004136	discard	mutate [7] skill:FUNC_TRANSFORMâ†’FUNC_QUADRATIC; arch:generalization_from_special_caseâ†’constraint_optimization_chain; style:modellingâ†’applied_real_world; mechs:[constraint_reasoning,cross_topic_synthesis,hence_chains]
2026-03-25T13:27:47Z	0.804977	0.800683	-0.004294	discard	mutate [7] skill:FUNC_TRANSFORMâ†’FUNC_QUADRATIC; arch:generalization_from_special_caseâ†’constraint_optimization_chain; style:modellingâ†’applied_real_world; mechs:[constraint_reasoning,cross_topic_synthesis]
2026-03-25T14:42:47Z	0.804977	0.800652	-0.004325	discard	mutate [7] skill:FUNC_TRANSFORMâ†’FUNC_QUADRATIC; arch:generalization_from_special_caseâ†’constraint_optimization_chain; style:modellingâ†’applied_real_world; mechs:[constraint_reasoning,cross_topic_synthesis,hence_chains]
2026-03-25T15:53:11Z	0.804977	0.800670	-0.004307	discard	mutate [7] skill:FUNC_TRANSFORMâ†’FUNC_QUADRATIC; arch:generalization_from_special_caseâ†’constraint_optimization_chain; style:modellingâ†’applied_real_world; mechs:[constraint_reasoning,hence_chains]
2026-03-25T17:01:59Z	0.804977	0.800847	-0.004130	discard	mutate [7] skill:FUNC_TRANSFORMâ†’FUNC_RATIONAL; arch:generalization_from_special_caseâ†’constraint_optimization_chain; style:modellingâ†’applied_real_world; mechs:[constraint_reasoning,cross_topic_synthesis]
2026-03-25T18:05:38Z	0.000000	0.000000	+0.000000	crash	error: Missing required field: question
2026-03-25T19:11:32Z	0.804977	0.801272	-0.003705	discard	mutate [7] skill:FUNC_TRANSFORMâ†’FUNC_QUADRATIC; arch:generalization_from_special_caseâ†’constraint_optimization_chain; style:modellingâ†’applied_real_world; mechs:[cross_topic_synthesis,constraint_reasoning,hence_chains]
2026-03-25T19:54:37Z	0.804977	0.800667	-0.004310	discard	mutate [7] skill:FUNC_TRANSFORMâ†’FUNC_QUADRATIC; arch:generalization_from_special_caseâ†’constraint_optimization_chain; style:modellingâ†’applied_real_world; mechs:[constraint_reasoning,cross_topic_synthesis,hence_chains]
2026-03-25T20:37:48Z	0.804977	0.801472	-0.003505	discard	mutate [7] skill:FUNC_TRANSFORMâ†’FUNC_QUADRATIC; arch:generalization_from_special_caseâ†’constraint_optimization_chain; style:modellingâ†’applied_real_world; mechs:[constraint_reasoning,hence_chains,cross_topic_synthesis]
2026-03-25T21:08:27Z	0.804977	0.802395	-0.002582	discard	mutate [7] skill:FUNC_TRANSFORMâ†’FUNC_SUM_PRODUCT_ROOTS; arch:generalization_from_special_caseâ†’constraint_optimization_chain; style:modellingâ†’applied_real_world; mechs:[cross_topic_synthesis,constraint_reasoning,hence_chains]
2026-03-25T21:53:49Z	0.804977	0.801254	-0.003723	discard	mutate [7] skill:FUNC_TRANSFORMâ†’FUNC_QUADRATIC; arch:generalization_from_special_caseâ†’constraint_optimization_chain; style:modellingâ†’applied_real_world; mechs:[constraint_reasoning,cross_topic_synthesis]
2026-03-25T22:34:31Z	0.000000	0.000000	+0.000000	crash	JSON parse error: Extra data: line 28 column 1 (char 3434)
2026-03-25T23:07:58Z	0.804977	0.800172	-0.004805	discard	mutate [7] skill:FUNC_TRANSFORMâ†’FUNC_QUADRATIC; arch:generalization_from_special_caseâ†’constraint_optimization_chain; style:modellingâ†’applied_real_world; mechs:[constraint_reasoning,hence_chains,cross_topic_synthesis]
2026-03-25T23:51:05Z	0.804977	0.801329	-0.003648	discard	mutate [7] skill:FUNC_TRANSFORMâ†’FUNC_QUADRATIC; arch:generalization_from_special_caseâ†’constraint_optimization_chain; style:modellingâ†’applied_real_world; mechs:[constraint_reasoning,hence_chains,cross_topic_synthesis]
2026-03-26T01:05:04Z	0.804977	0.801324	-0.003653	discard	mutate [7] skill:FUNC_TRANSFORMâ†’FUNC_QUADRATIC; arch:generalization_from_special_caseâ†’constraint_optimization_chain; style:modellingâ†’applied_real_world; mechs:[constraint_reasoning,cross_topic_synthesis,hence_chains]
2026-03-26T04:05:18Z	0.804977	0.801376	-0.003601	discard	mutate [7] skill:FUNC_TRANSFORMâ†’FUNC_QUADRATIC; arch:generalization_from_special_caseâ†’constraint_optimization_chain; style:modellingâ†’applied_real_world; mechs:[constraint_reasoning,cross_topic_synthesis,hence_chains]
2026-03-26T05:48:06Z	0.804977	0.800843	-0.004134	discard	mutate [7] skill:FUNC_TRANSFORMâ†’FUNC_QUADRATIC; arch:generalization_from_special_caseâ†’constraint_optimization_chain; style:modellingâ†’applied_real_world; mechs:[constraint_reasoning,hence_chains]
2026-03-26T06:52:03Z	0.804977	0.801448	-0.003529	discard	mutate [7] skill:FUNC_TRANSFORMâ†’FUNC_QUADRATIC; arch:generalization_from_special_caseâ†’constraint_optimization_chain; style:modellingâ†’applied_real_world; mechs:[constraint_reasoning,cross_topic_synthesis,hence_chains]
2026-03-26T08:02:32Z	0.804977	0.800614	-0.004363	discard	mutate [7] skill:FUNC_TRANSFORMâ†’FUNC_QUADRATIC; arch:generalization_from_special_caseâ†’constraint_optimization_chain; style:modellingâ†’applied_real_world; mechs:[constraint_reasoning,cross_topic_synthesis,hence_chains]
2026-03-26T09:12:29Z	0.804977	0.800527	-0.004450	discard	mutate [7] skill:FUNC_TRANSFORMâ†’FUNC_RATIONAL; arch:generalization_from_special_caseâ†’constraint_optimization_chain; style:modellingâ†’applied_real_world; mechs:[constraint_reasoning,cross_topic_synthesis,hence_chains]
2026-03-26T10:15:16Z	0.804977	0.801410	-0.003567	discard	mutate [7] skill:FUNC_TRANSFORMâ†’FUNC_QUADRATIC; arch:generalization_from_special_caseâ†’constraint_optimization_chain; style:modellingâ†’applied_real_world; mechs:[constraint_reasoning,hence_chains,cross_topic_synthesis]
2026-03-26T11:14:37Z	0.804977	0.801273	-0.003704	discard	mutate [7] skill:FUNC_TRANSFORMâ†’FUNC_QUADRATIC; arch:generalization_from_special_caseâ†’constraint_optimization_chain; style:modellingâ†’applied_real_world; mechs:[constraint_reasoning,hence_chains,cross_topic_synthesis]
2026-03-26T12:03:59Z	0.804977	0.801295	-0.003682	discard	mutate [7] skill:FUNC_TRANSFORMâ†’FUNC_QUADRATIC; arch:generalization_from_special_caseâ†’constraint_optimization_chain; style:modellingâ†’applied_real_world; mechs:[constraint_reasoning,hence_chains,cross_topic_synthesis]
2026-03-26T13:56:08Z	0.804977	0.800999	-0.003978	discard	mutate [7] skill:FUNC_TRANSFORMâ†’FUNC_QUADRATIC; arch:generalization_from_special_caseâ†’constraint_optimization_chain; style:modellingâ†’applied_real_world; mechs:[constraint_reasoning,cross_topic_synthesis,hence_chains]
2026-03-26T15:03:44Z	0.804977	0.800099	-0.004878	discard	mutate [7] skill:FUNC_TRANSFORMâ†’FUNC_RATIONAL; arch:generalization_from_special_caseâ†’constraint_optimization_chain; style:modellingâ†’applied_real_world; mechs:[constraint_reasoning,cross_topic_synthesis,hence_chains]
2026-03-26T16:22:06Z	0.804977	0.801361	-0.003616	discard	mutate [7] skill:FUNC_TRANSFORMâ†’FUNC_QUADRATIC; arch:generalization_from_special_caseâ†’constraint_optimization_chain; style:modellingâ†’applied_real_world; mechs:[constraint_reasoning,hence_chains,cross_topic_synthesis]
2026-03-26T17:33:46Z	0.804977	0.800155	-0.004822	discard	mutate [7] skill:FUNC_TRANSFORMâ†’FUNC_RATIONAL; arch:generalization_from_special_caseâ†’constraint_optimization_chain; style:modellingâ†’applied_real_world; mechs:[constraint_reasoning,cross_topic_synthesis]
2026-03-26T18:39:19Z	0.804977	0.801331	-0.003646	discard	mutate [7] skill:FUNC_TRANSFORMâ†’FUNC_QUADRATIC; arch:generalization_from_special_caseâ†’constraint_optimization_chain; style:modellingâ†’applied_real_world; mechs:[constraint_reasoning,hence_chains,cross_topic_synthesis]
2026-03-26T19:43:02Z	0.804977	0.800672	-0.004305	discard	mutate [7] skill:FUNC_TRANSFORMâ†’FUNC_QUADRATIC; arch:generalization_from_special_caseâ†’constraint_optimization_chain; style:modellingâ†’applied_real_world; mechs:[constraint_reasoning,hence_chains]
2026-03-26T20:22:08Z	0.804977	0.800541	-0.004436	discard	mutate [7] skill:FUNC_TRANSFORMâ†’FUNC_QUADRATIC; arch:generalization_from_special_caseâ†’constraint_optimization_chain; style:modellingâ†’applied_real_world; mechs:[constraint_reasoning,cross_topic_synthesis,hence_chains]
2026-03-26T20:59:12Z	0.804977	0.800079	-0.004898	discard	mutate [7] skill:FUNC_TRANSFORMâ†’FUNC_QUADRATIC; arch:generalization_from_special_caseâ†’constraint_optimization_chain; style:modellingâ†’applied_real_world; mechs:[constraint_reasoning,cross_topic_synthesis,hence_chains]
2026-03-26T21:37:28Z	0.804977	0.801185	-0.003792	discard	mutate [7] skill:FUNC_TRANSFORMâ†’FUNC_QUADRATIC; arch:generalization_from_special_caseâ†’constraint_optimization_chain; style:modellingâ†’applied_real_world; mechs:[constraint_reasoning,hence_chains,cross_topic_synthesis]
2026-03-26T21:59:27Z	0.000000	0.000000	+0.000000	crash	error: Missing required field: question
2026-03-26T22:35:48Z	0.804977	0.800942	-0.004035	discard	mutate [7] skill:FUNC_TRANSFORMâ†’FUNC_QUADRATIC; arch:generalization_from_special_caseâ†’constraint_optimization_chain; style:modellingâ†’applied_real_world; mechs:[constraint_reasoning,hence_chains,cross_topic_synthesis]
2026-03-26T23:00:37Z	0.804977	0.800122	-0.004855	discard	mutate [7] skill:FUNC_TRANSFORMâ†’FUNC_RATIONAL; arch:generalization_from_special_caseâ†’constraint_optimization_chain; style:modellingâ†’applied_real_world; mechs:[constraint_reasoning,cross_topic_synthesis]
2026-03-26T23:42:08Z	0.804977	0.800835	-0.004142	discard	mutate [7] skill:FUNC_TRANSFORMâ†’FUNC_QUADRATIC; arch:generalization_from_special_caseâ†’constraint_optimization_chain; style:modellingâ†’applied_real_world; mechs:[constraint_reasoning,cross_topic_synthesis,hence_chains]
2026-03-27T01:03:06Z	0.804977	0.800508	-0.004469	discard	mutate [7] skill:FUNC_TRANSFORMâ†’FUNC_QUADRATIC; arch:generalization_from_special_caseâ†’constraint_optimization_chain; style:modellingâ†’applied_real_world; mechs:[hidden_structure,constraint_reasoning,hence_chains,cross_topic_synthesis]
2026-03-27T04:06:02Z	0.804977	0.801477	-0.003500	discard	mutate [7] skill:FUNC_TRANSFORMâ†’FUNC_QUADRATIC; arch:generalization_from_special_caseâ†’constraint_optimization_chain; style:modellingâ†’applied_real_world; mechs:[constraint_reasoning,hence_chains,cross_topic_synthesis]
2026-03-27T05:49:26Z	0.804977	0.800303	-0.004674	discard	mutate [7] skill:FUNC_TRANSFORMâ†’FUNC_QUADRATIC; arch:generalization_from_special_caseâ†’constraint_optimization_chain; style:modellingâ†’applied_real_world; mechs:[constraint_reasoning,hence_chains,cross_topic_synthesis]
2026-03-27T06:52:22Z	0.804977	0.800148	-0.004829	discard	mutate [7] skill:FUNC_TRANSFORMâ†’FUNC_QUADRATIC; arch:generalization_from_special_caseâ†’constraint_optimization_chain; style:modellingâ†’applied_real_world; mechs:[constraint_reasoning,cross_topic_synthesis,hence_chains]
2026-03-27T08:00:40Z	0.804977	0.801437	-0.003540	discard	mutate [7] skill:FUNC_TRANSFORMâ†’FUNC_QUADRATIC; arch:generalization_from_special_caseâ†’constraint_optimization_chain; style:modellingâ†’applied_real_world; mechs:[constraint_reasoning,cross_topic_synthesis,hence_chains]
2026-03-27T09:03:40Z	0.804977	0.800631	-0.004346	discard	mutate [7] skill:FUNC_TRANSFORMâ†’FUNC_QUADRATIC; arch:generalization_from_special_caseâ†’constraint_optimization_chain; style:modellingâ†’applied_real_world; mechs:[constraint_reasoning,hence_chains,cross_topic_synthesis]
2026-03-27T10:04:47Z	0.804977	0.800416	-0.004561	discard	mutate [7] skill:FUNC_TRANSFORMâ†’FUNC_QUADRATIC; arch:generalization_from_special_caseâ†’constraint_optimization_chain; style:modellingâ†’applied_real_world; mechs:[hence_chains,cross_topic_synthesis,constraint_reasoning]
2026-03-27T11:04:19Z	0.804977	0.801395	-0.003582	discard	mutate [7] skill:FUNC_TRANSFORMâ†’FUNC_QUADRATIC; arch:generalization_from_special_caseâ†’constraint_optimization_chain; style:modellingâ†’applied_real_world; mechs:[constraint_reasoning,hence_chains,cross_topic_synthesis]
2026-03-27T11:53:40Z	0.804977	0.800666	-0.004311	discard	mutate [7] skill:FUNC_TRANSFORMâ†’FUNC_QUADRATIC; arch:generalization_from_special_caseâ†’constraint_optimization_chain; style:modellingâ†’applied_real_world; mechs:[constraint_reasoning,cross_topic_synthesis,hence_chains]
2026-03-27T13:03:05Z	0.804977	0.800546	-0.004431	discard	mutate [7] skill:FUNC_TRANSFORMâ†’FUNC_QUADRATIC; arch:generalization_from_special_caseâ†’constraint_optimization_chain; style:modellingâ†’applied_real_world; mechs:[constraint_reasoning,hence_chains,cross_topic_synthesis]
2026-03-27T14:17:22Z	0.804977	0.801276	-0.003701	discard	mutate [7] skill:FUNC_TRANSFORMâ†’FUNC_QUADRATIC; arch:generalization_from_special_caseâ†’constraint_optimization_chain; style:modellingâ†’applied_real_world; mechs:[constraint_reasoning,cross_topic_synthesis,hence_chains]
2026-03-27T15:13:00Z	0.804977	0.801439	-0.003538	discard	mutate [7] skill:FUNC_TRANSFORMâ†’FUNC_QUADRATIC; arch:generalization_from_special_caseâ†’constraint_optimization_chain; style:modellingâ†’applied_real_world; mechs:[constraint_reasoning,hence_chains]
2026-03-27T16:10:03Z	0.804977	0.802090	-0.002887	discard	mutate [7] skill:FUNC_TRANSFORMâ†’FUNC_QUADRATIC; arch:generalization_from_special_caseâ†’constraint_optimization_chain; style:modellingâ†’applied_real_world; mechs:[constraint_reasoning,hence_chains]
2026-03-27T17:09:54Z	0.000000	0.000000	+0.000000	crash	error: Server disconnected without sending a response.
2026-03-27T18:04:29Z	0.804977	0.800162	-0.004815	discard	mutate [7] skill:FUNC_TRANSFORMâ†’FUNC_RATIONAL; arch:generalization_from_special_caseâ†’constraint_optimization_chain; style:modellingâ†’applied_real_world; mechs:[constraint_reasoning,cross_topic_synthesis]
2026-03-27T19:10:56Z	0.804977	0.800080	-0.004897	discard	mutate [7] skill:FUNC_TRANSFORMâ†’FUNC_QUADRATIC; arch:generalization_from_special_caseâ†’constraint_optimization_chain; style:modellingâ†’applied_real_world; mechs:[constraint_reasoning,cross_topic_synthesis,hence_chains]
2026-03-27T19:51:07Z	0.804977	0.801312	-0.003665	discard	mutate [7] skill:FUNC_TRANSFORMâ†’FUNC_QUADRATIC; arch:generalization_from_special_caseâ†’constraint_optimization_chain; style:modellingâ†’applied_real_world; mechs:[constraint_reasoning,hence_chains]
2026-03-27T20:23:54Z	0.804977	0.801254	-0.003723	discard	mutate [7] skill:FUNC_TRANSFORMâ†’FUNC_QUADRATIC; arch:generalization_from_special_caseâ†’constraint_optimization_chain; style:modellingâ†’applied_real_world; mechs:[constraint_reasoning,hence_chains,cross_topic_synthesis]
2026-03-27T21:04:06Z	0.804977	0.801404	-0.003573	discard	mutate [7] skill:FUNC_TRANSFORMâ†’FUNC_QUADRATIC; arch:generalization_from_special_caseâ†’constraint_optimization_chain; style:modellingâ†’applied_real_world; mechs:[constraint_reasoning,cross_topic_synthesis,hence_chains]
2026-03-27T21:50:30Z	0.804977	0.801407	-0.003570	discard	mutate [7] skill:FUNC_TRANSFORMâ†’FUNC_QUADRATIC; arch:generalization_from_special_caseâ†’constraint_optimization_chain; style:modellingâ†’applied_real_world; mechs:[constraint_reasoning,hence_chains,cross_topic_synthesis]
2026-03-27T22:18:24Z	0.804977	0.800709	-0.004268	discard	mutate [7] skill:FUNC_TRANSFORMâ†’FUNC_QUADRATIC; arch:generalization_from_special_caseâ†’constraint_optimization_chain; style:modellingâ†’applied_real_world; mechs:[constraint_reasoning,cross_topic_synthesis,hence_chains]
2026-03-27T22:55:52Z	0.804977	0.801477	-0.003500	discard	mutate [7] skill:FUNC_TRANSFORMâ†’FUNC_QUADRATIC; arch:generalization_from_special_caseâ†’constraint_optimization_chain; style:modellingâ†’applied_real_world; mechs:[constraint_reasoning,cross_topic_synthesis,hence_chains]
2026-03-27T23:31:19Z	0.804977	0.800994	-0.003983	discard	mutate [7] skill:FUNC_TRANSFORMâ†’FUNC_QUADRATIC; arch:generalization_from_special_caseâ†’constraint_optimization_chain; style:modellingâ†’applied_real_world; mechs:[constraint_reasoning,hence_chains]
2026-03-27T23:56:15Z	0.000000	0.000000	+0.000000	crash	error: Missing required field: question
2026-03-28T01:59:35Z	0.804977	0.800099	-0.004878	discard	mutate [7] skill:FUNC_TRANSFORMâ†’FUNC_RATIONAL; arch:generalization_from_special_caseâ†’constraint_optimization_chain; style:modellingâ†’applied_real_world; mechs:[constraint_reasoning,hence_chains,cross_topic_synthesis]
2026-03-28T04:26:41Z	0.804977	0.800734	-0.004243	discard	mutate [7] skill:FUNC_TRANSFORMâ†’FUNC_QUADRATIC; arch:generalization_from_special_caseâ†’constraint_optimization_chain; style:modellingâ†’applied_real_world; mechs:[constraint_reasoning,hence_chains,cross_topic_synthesis]
2026-03-28T05:41:10Z	0.804977	0.800985	-0.003992	discard	mutate [7] skill:FUNC_TRANSFORMâ†’FUNC_QUADRATIC; arch:generalization_from_special_caseâ†’constraint_optimization_chain; style:modellingâ†’applied_real_world; mechs:[constraint_reasoning,cross_topic_synthesis,hence_chains]
2026-03-28T06:39:44Z	0.804977	0.800544	-0.004433	discard	mutate [7] skill:FUNC_TRANSFORMâ†’FUNC_QUADRATIC; arch:generalization_from_special_caseâ†’constraint_optimization_chain; style:modellingâ†’applied_real_world; mechs:[constraint_reasoning,cross_topic_synthesis,hence_chains]
2026-03-28T07:33:17Z	0.804977	0.801374	-0.003603	discard	mutate [7] skill:FUNC_TRANSFORMâ†’FUNC_QUADRATIC; arch:generalization_from_special_caseâ†’constraint_optimization_chain; style:modellingâ†’applied_real_world; mechs:[constraint_reasoning,hence_chains,cross_topic_synthesis]
2026-03-28T08:05:52Z	0.804977	0.800562	-0.004415	discard	mutate [7] skill:FUNC_TRANSFORMâ†’FUNC_QUADRATIC; arch:generalization_from_special_caseâ†’constraint_optimization_chain; style:modellingâ†’applied_real_world; mechs:[constraint_reasoning,cross_topic_synthesis,hence_chains]
2026-03-28T08:56:00Z	0.804977	0.800373	-0.004604	discard	mutate [7] skill:FUNC_TRANSFORMâ†’FUNC_QUADRATIC; arch:generalization_from_special_caseâ†’constraint_optimization_chain; style:modellingâ†’applied_real_world; mechs:[constraint_reasoning,cross_topic_synthesis,hence_chains]
2026-03-28T09:36:45Z	0.804977	0.800343	-0.004634	discard	mutate [7] skill:FUNC_TRANSFORMâ†’FUNC_QUADRATIC; arch:generalization_from_special_caseâ†’representation_bridge; style:modellingâ†’applied_real_world; mechs:[cross_topic_synthesis,hence_chains,constraint_reasoning]
2026-03-28T10:05:06Z	0.804977	0.800830	-0.004147	discard	mutate [7] skill:FUNC_TRANSFORMâ†’FUNC_QUADRATIC; arch:generalization_from_special_caseâ†’constraint_optimization_chain; style:modellingâ†’applied_real_world; mechs:[constraint_reasoning,cross_topic_synthesis,hence_chains]
2026-03-28T10:50:20Z	0.804977	0.800656	-0.004321	discard	mutate [7] skill:FUNC_TRANSFORMâ†’FUNC_QUADRATIC; arch:generalization_from_special_caseâ†’constraint_optimization_chain; style:modellingâ†’applied_real_world; mechs:[constraint_reasoning,cross_topic_synthesis,hence_chains]
2026-03-28T11:17:08Z	0.804977	0.800136	-0.004841	discard	mutate [7] skill:FUNC_TRANSFORMâ†’FUNC_QUADRATIC; arch:generalization_from_special_caseâ†’constraint_optimization_chain; style:modellingâ†’applied_real_world; mechs:[constraint_reasoning,hence_chains,cross_topic_synthesis]
2026-03-28T11:46:39Z	0.804977	0.800562	-0.004415	discard	mutate [7] skill:FUNC_TRANSFORMâ†’FUNC_QUADRATIC; arch:generalization_from_special_caseâ†’constraint_optimization_chain; style:modellingâ†’applied_real_world; mechs:[constraint_reasoning,hence_chains,cross_topic_synthesis]
2026-03-28T12:03:09Z	0.804977	0.801335	-0.003642	discard	mutate [7] skill:FUNC_TRANSFORMâ†’FUNC_QUADRATIC; arch:generalization_from_special_caseâ†’constraint_optimization_chain; style:modellingâ†’applied_real_world; mechs:[constraint_reasoning,hence_chains,cross_topic_synthesis]
2026-03-28T13:18:29Z	0.000000	0.000000	+0.000000	crash	error: Missing required field: question
2026-03-28T14:01:12Z	0.804977	0.800656	-0.004321	discard	mutate [7] skill:FUNC_TRANSFORMâ†’FUNC_QUADRATIC; arch:generalization_from_special_caseâ†’constraint_optimization_chain; style:modellingâ†’applied_real_world; mechs:[constraint_reasoning,hence_chains,hidden_structure,cross_topic_synthesis]
2026-03-28T14:42:22Z	0.804977	0.801283	-0.003694	discard	mutate [7] skill:FUNC_TRANSFORMâ†’FUNC_QUADRATIC; arch:generalization_from_special_caseâ†’constraint_optimization_chain; style:modellingâ†’applied_real_world; mechs:[constraint_reasoning,cross_topic_synthesis,hence_chains]
2026-03-28T15:18:07Z	0.000000	0.000000	+0.000000	crash	error: Missing required field: question
2026-03-28T15:49:57Z	0.804977	0.800419	-0.004558	discard	mutate [7] skill:FUNC_TRANSFORMâ†’FUNC_QUADRATIC; arch:generalization_from_special_caseâ†’constraint_optimization_chain; style:modellingâ†’applied_real_world; mechs:[constraint_reasoning,hence_chains,cross_topic_synthesis]
2026-03-28T16:18:28Z	0.804977	0.800592	-0.004385	discard	mutate [7] skill:FUNC_TRANSFORMâ†’FUNC_QUADRATIC; arch:generalization_from_special_caseâ†’constraint_optimization_chain; style:modellingâ†’applied_real_world; mechs:[constraint_reasoning,cross_topic_synthesis,hence_chains]
2026-03-28T16:55:23Z	0.804977	0.800094	-0.004883	discard	mutate [7] skill:FUNC_TRANSFORMâ†’FUNC_QUADRATIC; arch:generalization_from_special_caseâ†’constraint_optimization_chain; style:modellingâ†’applied_real_world; mechs:[constraint_reasoning,cross_topic_synthesis,hence_chains]
2026-03-28T17:27:53Z	0.804977	0.800710	-0.004267	discard	mutate [7] skill:FUNC_TRANSFORMâ†’FUNC_QUADRATIC; arch:generalization_from_special_caseâ†’constraint_optimization_chain; style:modellingâ†’applied_real_world; mechs:[constraint_reasoning,cross_topic_synthesis,hence_chains]
2026-03-28T17:56:16Z	0.804977	0.800125	-0.004852	discard	mutate [7] skill:FUNC_TRANSFORMâ†’FUNC_QUADRATIC; arch:generalization_from_special_caseâ†’constraint_optimization_chain; style:modellingâ†’applied_real_world; mechs:[constraint_reasoning,hence_chains,cross_topic_synthesis]
2026-03-28T18:39:03Z	0.804977	0.800204	-0.004773	discard	mutate [7] skill:FUNC_TRANSFORMâ†’FUNC_RATIONAL; arch:generalization_from_special_caseâ†’constraint_optimization_chain; style:modellingâ†’applied_real_world; mechs:[cross_topic_synthesis,constraint_reasoning,hence_chains]
