timestamp	old_score	new_score	delta	status	description
2026-04-28T07:21:49Z	0.805622	0.802834	-0.002788	discard	mutate [26] skill:FUNC_TRANSFORMâ†’FUNC_QUADRATIC; arch:spatial_coordinate_bridgeâ†’constraint_optimization_chain; style:applied_real_worldâ†’modelling; mechs:[constraint_reasoning,proof_unfamiliar_context,cross_topic_synthesis]
2026-04-28T09:40:57Z	0.805622	0.802293	-0.003329	discard	mutate [26] skill:FUNC_TRANSFORMâ†’FUNC_LOG; arch:spatial_coordinate_bridgeâ†’constraint_optimization_chain; style:applied_real_worldâ†’modelling; mechs:[constraint_reasoning,hence_chains,cross_topic_synthesis]
2026-04-28T11:28:08Z	0.805622	0.802223	-0.003399	discard	mutate [26] skill:FUNC_TRANSFORMâ†’FUNC_QUADRATIC; arch:spatial_coordinate_bridgeâ†’constraint_optimization_chain; style:applied_real_worldâ†’modelling; mechs:[constraint_reasoning,cross_topic_synthesis,hence_chains]
2026-04-28T13:13:55Z	0.805622	0.803689	-0.001933	discard	mutate [26] skill:FUNC_TRANSFORMâ†’FUNC_QUADRATIC; arch:spatial_coordinate_bridgeâ†’constraint_optimization_chain; style:applied_real_worldâ†’modelling; mechs:[constraint_reasoning,cross_topic_synthesis,hence_chains]
2026-04-28T15:40:57Z	0.000000	0.000000	+0.000000	crash	error: Missing required field: question
2026-04-28T17:21:05Z	0.805622	0.804266	-0.001356	discard	mutate [26] skill:FUNC_TRANSFORMâ†’FUNC_QUADRATIC; arch:spatial_coordinate_bridgeâ†’constraint_optimization_chain; mechs:[constraint_reasoning,cross_topic_synthesis,hence_chains]
2026-04-28T18:59:47Z	0.805622	0.803638	-0.001984	discard	mutate [26] skill:FUNC_TRANSFORMâ†’FUNC_SUM_PRODUCT_ROOTS; arch:spatial_coordinate_bridgeâ†’constraint_optimization_chain; style:applied_real_worldâ†’modelling; mechs:[hidden_structure,constraint_reasoning,hence_chains]
2026-04-28T20:20:05Z	0.805622	0.803597	-0.002025	discard	mutate [26] skill:FUNC_TRANSFORMâ†’FUNC_QUADRATIC; arch:spatial_coordinate_bridgeâ†’constraint_optimization_chain; style:applied_real_worldâ†’modelling; mechs:[constraint_reasoning,cross_topic_synthesis]
2026-04-28T21:34:10Z	0.805622	0.803580	-0.002042	discard	mutate [26] skill:FUNC_TRANSFORMâ†’FUNC_QUADRATIC; arch:spatial_coordinate_bridgeâ†’constraint_optimization_chain; mechs:[constraint_reasoning,hence_chains,cross_topic_synthesis]
2026-04-28T22:36:38Z	0.805622	0.802921	-0.002701	discard	mutate [26] skill:FUNC_TRANSFORMâ†’FUNC_QUADRATIC; arch:spatial_coordinate_bridgeâ†’constraint_optimization_chain; style:applied_real_worldâ†’modelling; mechs:[constraint_reasoning,hence_chains,cross_topic_synthesis]
2026-04-28T23:34:23Z	0.000000	0.000000	+0.000000	crash	error: Missing required field: question
2026-04-29T01:22:52Z	0.805622	0.802791	-0.002831	discard	mutate [26] skill:FUNC_TRANSFORMâ†’FUNC_QUADRATIC; arch:spatial_coordinate_bridgeâ†’constraint_optimization_chain; style:applied_real_worldâ†’modelling; mechs:[constraint_reasoning,hence_chains,hidden_structure]
2026-04-29T04:51:14Z	0.000000	0.000000	+0.000000	crash	JSON parse error: Extra data: line 27 column 1 (char 3414)
2026-04-29T07:14:48Z	0.805622	0.803049	-0.002573	discard	mutate [26] skill:FUNC_TRANSFORMâ†’FUNC_QUADRATIC; arch:spatial_coordinate_bridgeâ†’constraint_optimization_chain; style:applied_real_worldâ†’modelling; mechs:[cross_topic_synthesis,constraint_reasoning]
2026-04-29T09:29:24Z	0.805622	0.802813	-0.002809	discard	mutate [26] skill:FUNC_TRANSFORMâ†’FUNC_QUADRATIC; arch:spatial_coordinate_bridgeâ†’constraint_optimization_chain; style:applied_real_worldâ†’modelling; mechs:[constraint_reasoning,hence_chains,cross_topic_synthesis]
2026-04-29T11:16:27Z	0.805622	0.803780	-0.001842	discard	mutate [26] skill:FUNC_TRANSFORMâ†’FUNC_QUADRATIC; arch:spatial_coordinate_bridgeâ†’constraint_optimization_chain; style:applied_real_worldâ†’modelling; mechs:[constraint_reasoning,cross_topic_synthesis,hence_chains]
2026-04-29T12:57:31Z	0.805622	0.806770	+0.001148	keep	mutate [26] skill:FUNC_TRANSFORMâ†’FUNC_QUADRATIC; arch:spatial_coordinate_bridgeâ†’constraint_optimization_chain; style:applied_real_worldâ†’modelling; mechs:[constraint_reasoning,cross_topic_synthesis,strategic_path]
2026-04-29T15:16:32Z	0.806770	0.803690	-0.003080	discard	mutate [26] skill:FUNC_QUADRATICâ†’FUNC_TRANSFORM; arch:constraint_optimization_chainâ†’spatial_coordinate_bridge; style:modellingâ†’applied_real_world; mechs:[cross_topic_synthesis,hence_chains,multi_representation]
2026-04-29T16:56:08Z	0.806770	0.804495	-0.002275	discard	mutate [26] skill:FUNC_QUADRATICâ†’FUNC_TRANSFORM; arch:constraint_optimization_chainâ†’spatial_coordinate_bridge; style:modellingâ†’applied_real_world; mechs:[cross_topic_synthesis,hence_chains,multi_representation]
2026-04-29T18:11:06Z	0.806770	0.804709	-0.002061	discard	mutate [26] skill:FUNC_QUADRATICâ†’FUNC_TRANSFORM; arch:constraint_optimization_chainâ†’spatial_coordinate_bridge; style:modellingâ†’applied_real_world; mechs:[cross_topic_synthesis,hence_chains,hidden_structure]
2026-04-29T19:55:03Z	0.806770	0.804353	-0.002417	discard	mutate [26] skill:FUNC_QUADRATICâ†’FUNC_TRANSFORM; arch:constraint_optimization_chainâ†’spatial_coordinate_bridge; style:modellingâ†’applied_real_world; mechs:[cross_topic_synthesis,hence_chains,multi_representation,hidden_structure]
2026-04-29T21:02:40Z	0.806770	0.804961	-0.001809	discard	mutate [26] skill:FUNC_QUADRATICâ†’FUNC_TRANSFORM; arch:constraint_optimization_chainâ†’spatial_coordinate_bridge; style:modellingâ†’applied_real_world; mechs:[cross_topic_synthesis,hence_chains,hidden_structure]
2026-04-29T22:10:39Z	0.806770	0.805277	-0.001493	discard	mutate [26] skill:FUNC_QUADRATICâ†’FUNC_TRANSFORM; arch:constraint_optimization_chainâ†’spatial_coordinate_bridge; style:modellingâ†’applied_real_world; mechs:[cross_topic_synthesis,hence_chains,multi_representation]
2026-04-29T23:11:02Z	0.806770	0.805670	-0.001100	discard	mutate [26] skill:FUNC_QUADRATICâ†’FUNC_TRANSFORM; arch:constraint_optimization_chainâ†’spatial_coordinate_bridge; style:modellingâ†’applied_real_world; mechs:[cross_topic_synthesis,hence_chains,hidden_structure]
2026-04-30T00:08:53Z	0.806770	0.804950	-0.001820	discard	mutate [26] skill:FUNC_QUADRATICâ†’FUNC_TRANSFORM; arch:constraint_optimization_chainâ†’spatial_coordinate_bridge; style:modellingâ†’applied_real_world; mechs:[cross_topic_synthesis,hence_chains,hidden_structure]
2026-04-30T04:02:05Z	0.806770	0.803875	-0.002895	discard	mutate [26] skill:FUNC_QUADRATICâ†’FUNC_TRANSFORM; arch:constraint_optimization_chainâ†’spatial_coordinate_bridge; style:modellingâ†’applied_real_world; mechs:[cross_topic_synthesis,hidden_structure,hence_chains]
2026-04-30T06:39:16Z	0.806770	0.804830	-0.001940	discard	mutate [26] skill:FUNC_QUADRATICâ†’FUNC_TRANSFORM; arch:constraint_optimization_chainâ†’spatial_coordinate_bridge; style:modellingâ†’applied_real_world; mechs:[hence_chains,cross_topic_synthesis,constraint_reasoning]
2026-04-30T09:01:52Z	0.806770	0.804614	-0.002156	discard	mutate [26] skill:FUNC_QUADRATICâ†’FUNC_TRANSFORM; arch:constraint_optimization_chainâ†’spatial_coordinate_bridge; style:modellingâ†’applied_real_world; mechs:[cross_topic_synthesis,multi_representation,hence_chains,hidden_structure,constraint_reasoning]
2026-04-30T11:04:04Z	0.806770	0.804944	-0.001826	discard	mutate [26] skill:FUNC_QUADRATICâ†’FUNC_TRANSFORM; arch:constraint_optimization_chainâ†’spatial_coordinate_bridge; style:modellingâ†’applied_real_world; mechs:[multi_representation,hence_chains,hidden_structure,cross_topic_synthesis]
2026-04-30T12:22:57Z	0.806770	0.804388	-0.002382	discard	mutate [26] skill:FUNC_QUADRATICâ†’FUNC_TRANSFORM; arch:constraint_optimization_chainâ†’spatial_coordinate_bridge; style:modellingâ†’applied_real_world; mechs:[multi_representation,hence_chains,constraint_reasoning,cross_topic_synthesis]
2026-04-30T14:32:55Z	0.806770	0.804835	-0.001935	discard	mutate [26] skill:FUNC_QUADRATICâ†’FUNC_TRANSFORM; arch:constraint_optimization_chainâ†’spatial_coordinate_bridge; style:modellingâ†’applied_real_world; mechs:[cross_topic_synthesis,hence_chains]
2026-04-30T16:08:52Z	0.806770	0.805598	-0.001172	discard	mutate [26] skill:FUNC_QUADRATICâ†’FUNC_TRANSFORM; arch:constraint_optimization_chainâ†’spatial_coordinate_bridge; style:modellingâ†’applied_real_world; mechs:[hence_chains,multi_representation,cross_topic_synthesis,hidden_structure]
2026-04-30T17:43:50Z	0.806770	0.805601	-0.001169	discard	mutate [26] skill:FUNC_QUADRATICâ†’FUNC_TRANSFORM; arch:constraint_optimization_chainâ†’spatial_coordinate_bridge; style:modellingâ†’applied_real_world; mechs:[cross_topic_synthesis,hence_chains,multi_representation]
2026-04-30T19:00:24Z	0.806770	0.805613	-0.001157	discard	mutate [26] skill:FUNC_QUADRATICâ†’FUNC_TRANSFORM; arch:constraint_optimization_chainâ†’spatial_coordinate_bridge; style:modellingâ†’applied_real_world; mechs:[cross_topic_synthesis,hence_chains,multi_representation]
2026-04-30T20:15:19Z	0.806770	0.804777	-0.001993	discard	mutate [26] skill:FUNC_QUADRATICâ†’FUNC_TRANSFORM; arch:constraint_optimization_chainâ†’spatial_coordinate_bridge; style:modellingâ†’applied_real_world; mechs:[multi_representation,cross_topic_synthesis,hence_chains,hidden_structure]
2026-04-30T21:17:46Z	0.806770	0.805320	-0.001450	discard	mutate [26] skill:FUNC_QUADRATICâ†’FUNC_TRANSFORM; arch:constraint_optimization_chainâ†’spatial_coordinate_bridge; style:modellingâ†’applied_real_world; mechs:[cross_topic_synthesis,hence_chains,multi_representation]
2026-04-30T22:14:05Z	0.806770	0.804770	-0.002000	discard	mutate [26] skill:FUNC_QUADRATICâ†’FUNC_TRANSFORM; arch:constraint_optimization_chainâ†’spatial_coordinate_bridge; style:modellingâ†’applied_real_world; mechs:[cross_topic_synthesis,hence_chains,hidden_structure]
2026-04-30T23:13:39Z	0.806770	0.805162	-0.001608	discard	mutate [26] skill:FUNC_QUADRATICâ†’FUNC_TRANSFORM; arch:constraint_optimization_chainâ†’spatial_coordinate_bridge; style:modellingâ†’applied_real_world; mechs:[cross_topic_synthesis,hence_chains,multi_representation]
2026-05-01T00:10:21Z	0.806770	0.804986	-0.001784	discard	mutate [26] skill:FUNC_QUADRATICâ†’FUNC_TRANSFORM; arch:constraint_optimization_chainâ†’spatial_coordinate_bridge; style:modellingâ†’applied_real_world; mechs:[cross_topic_synthesis,hidden_structure,hence_chains]
2026-05-01T04:15:14Z	0.000000	0.000000	+0.000000	crash	error: 503 UNAVAILABLE. {'error': {'code': 503, 'message': 'This model is currently experiencing high deman
2026-05-01T06:47:40Z	0.806770	0.804658	-0.002112	discard	mutate [26] skill:FUNC_QUADRATICâ†’FUNC_TRANSFORM; arch:constraint_optimization_chainâ†’spatial_coordinate_bridge; style:modellingâ†’applied_real_world; mechs:[cross_topic_synthesis,multi_representation,hence_chains]
2026-05-01T08:52:34Z	0.806770	0.805362	-0.001408	discard	mutate [26] skill:FUNC_QUADRATICâ†’FUNC_TRANSFORM; arch:constraint_optimization_chainâ†’spatial_coordinate_bridge; style:modellingâ†’applied_real_world; mechs:[cross_topic_synthesis,hidden_structure,hence_chains]
2026-05-01T10:22:05Z	0.806770	0.804970	-0.001800	discard	mutate [26] skill:FUNC_QUADRATICâ†’FUNC_TRANSFORM; arch:constraint_optimization_chainâ†’spatial_coordinate_bridge; style:modellingâ†’applied_real_world; mechs:[cross_topic_synthesis,hence_chains,multi_representation]
2026-05-01T11:38:49Z	0.806770	0.804437	-0.002333	discard	mutate [26] skill:FUNC_QUADRATICâ†’FUNC_TRANSFORM; arch:constraint_optimization_chainâ†’spatial_coordinate_bridge; style:modellingâ†’applied_real_world; mechs:[multi_representation,hence_chains,cross_topic_synthesis]
2026-05-01T12:41:23Z	0.806770	0.804151	-0.002619	discard	mutate [26] skill:FUNC_QUADRATICâ†’FUNC_TRANSFORM; arch:constraint_optimization_chainâ†’spatial_coordinate_bridge; style:modellingâ†’applied_real_world; mechs:[cross_topic_synthesis,hence_chains]
2026-05-01T14:06:50Z	0.806770	0.806065	-0.000705	discard	mutate [26] skill:FUNC_QUADRATICâ†’FUNC_TRANSFORM; arch:constraint_optimization_chainâ†’spatial_coordinate_bridge; style:modellingâ†’applied_real_world; mechs:[cross_topic_synthesis,hence_chains,multi_representation]
2026-05-01T15:13:18Z	0.806770	0.805682	-0.001088	discard	mutate [26] skill:FUNC_QUADRATICâ†’FUNC_TRANSFORM; arch:constraint_optimization_chainâ†’spatial_coordinate_bridge; style:modellingâ†’applied_real_world; mechs:[cross_topic_synthesis,hence_chains,multi_representation]
2026-05-01T16:14:33Z	0.806770	0.804565	-0.002205	discard	mutate [26] skill:FUNC_QUADRATICâ†’FUNC_TRANSFORM; arch:constraint_optimization_chainâ†’spatial_coordinate_bridge; style:modellingâ†’applied_real_world; mechs:[cross_topic_synthesis,hence_chains,multi_representation]
2026-05-01T17:17:28Z	0.806770	0.805243	-0.001527	discard	mutate [26] skill:FUNC_QUADRATICâ†’FUNC_TRANSFORM; arch:constraint_optimization_chainâ†’spatial_coordinate_bridge; style:modellingâ†’applied_real_world; mechs:[cross_topic_synthesis,hence_chains,multi_representation]
2026-05-01T18:14:49Z	0.806770	0.805019	-0.001751	discard	mutate [26] skill:FUNC_QUADRATICâ†’FUNC_TRANSFORM; arch:constraint_optimization_chainâ†’spatial_coordinate_bridge; style:modellingâ†’applied_real_world; mechs:[cross_topic_synthesis,hence_chains,constraint_reasoning]
2026-05-01T19:43:22Z	0.806770	0.804633	-0.002137	discard	mutate [26] skill:FUNC_QUADRATICâ†’FUNC_TRANSFORM; arch:constraint_optimization_chainâ†’spatial_coordinate_bridge; style:modellingâ†’applied_real_world; mechs:[cross_topic_synthesis,hence_chains,multi_representation]
2026-05-01T20:36:19Z	0.806770	0.805667	-0.001103	discard	mutate [26] skill:FUNC_QUADRATICâ†’FUNC_TRANSFORM; arch:constraint_optimization_chainâ†’spatial_coordinate_bridge; style:modellingâ†’applied_real_world; mechs:[cross_topic_synthesis,hence_chains,multi_representation]
2026-05-01T21:32:25Z	0.000000	0.000000	+0.000000	crash	error: 503 UNAVAILABLE. {'error': {'code': 503, 'message': 'This model is currently experiencing high deman
2026-05-01T22:31:45Z	0.806770	0.804930	-0.001840	discard	mutate [26] skill:FUNC_QUADRATICâ†’FUNC_TRANSFORM; arch:constraint_optimization_chainâ†’spatial_coordinate_bridge; style:modellingâ†’applied_real_world; mechs:[cross_topic_synthesis,hence_chains,constraint_reasoning]
2026-05-01T23:34:23Z	0.806770	0.805634	-0.001136	discard	mutate [26] skill:FUNC_QUADRATICâ†’FUNC_TRANSFORM; arch:constraint_optimization_chainâ†’spatial_coordinate_bridge; style:modellingâ†’applied_real_world; mechs:[cross_topic_synthesis,hence_chains,multi_representation]
2026-05-02T01:16:49Z	0.806770	0.804425	-0.002345	discard	mutate [26] skill:FUNC_QUADRATICâ†’FUNC_TRANSFORM; arch:constraint_optimization_chainâ†’spatial_coordinate_bridge; style:modellingâ†’applied_real_world; mechs:[cross_topic_synthesis,hence_chains,multi_representation]
2026-05-02T04:29:26Z	0.000000	0.000000	+0.000000	crash	error: 503 UNAVAILABLE. {'error': {'code': 503, 'message': 'This model is currently experiencing high deman
2026-05-02T06:26:41Z	0.000000	0.000000	+0.000000	crash	error: 503 UNAVAILABLE. {'error': {'code': 503, 'message': 'This model is currently experiencing high deman
2026-05-02T08:08:51Z	0.806770	0.805270	-0.001500	discard	mutate [26] skill:FUNC_QUADRATICâ†’FUNC_TRANSFORM; arch:constraint_optimization_chainâ†’spatial_coordinate_bridge; style:modellingâ†’applied_real_world; mechs:[cross_topic_synthesis,multi_representation,hence_chains]
2026-05-02T09:20:42Z	0.806770	0.805541	-0.001229	discard	mutate [26] skill:FUNC_QUADRATICâ†’FUNC_TRANSFORM; arch:constraint_optimization_chainâ†’spatial_coordinate_bridge; style:modellingâ†’applied_real_world; mechs:[cross_topic_synthesis,hence_chains,multi_representation]
2026-05-02T10:14:42Z	0.806770	0.804518	-0.002252	discard	mutate [26] skill:FUNC_QUADRATICâ†’FUNC_TRANSFORM; arch:constraint_optimization_chainâ†’spatial_coordinate_bridge; style:modellingâ†’applied_real_world; mechs:[multi_representation,cross_topic_synthesis,hence_chains]
2026-05-02T11:10:37Z	0.806770	0.805290	-0.001480	discard	mutate [26] skill:FUNC_QUADRATICâ†’FUNC_TRANSFORM; arch:constraint_optimization_chainâ†’spatial_coordinate_bridge; style:modellingâ†’applied_real_world; mechs:[cross_topic_synthesis,hence_chains,hidden_structure]
2026-05-02T11:58:59Z	0.806770	0.804439	-0.002331	discard	mutate [26] skill:FUNC_QUADRATICâ†’FUNC_TRANSFORM; arch:constraint_optimization_chainâ†’spatial_coordinate_bridge; style:modellingâ†’applied_real_world; mechs:[cross_topic_synthesis,hence_chains,multi_representation]
2026-05-02T13:22:19Z	0.806770	0.804511	-0.002259	discard	mutate [26] skill:FUNC_QUADRATICâ†’FUNC_TRANSFORM; arch:constraint_optimization_chainâ†’spatial_coordinate_bridge; style:modellingâ†’applied_real_world; mechs:[hence_chains,cross_topic_synthesis,multi_representation]
2026-05-02T14:28:56Z	0.000000	0.000000	+0.000000	crash	error: 503 UNAVAILABLE. {'error': {'code': 503, 'message': 'This model is currently experiencing high deman
2026-05-02T15:25:14Z	0.806770	0.804428	-0.002342	discard	mutate [26] skill:FUNC_QUADRATICâ†’FUNC_TRANSFORM; arch:constraint_optimization_chainâ†’spatial_coordinate_bridge; style:modellingâ†’applied_real_world; mechs:[multi_representation,cross_topic_synthesis,hence_chains,constraint_reasoning]
2026-05-02T16:08:47Z	0.000000	0.000000	+0.000000	crash	error: 503 UNAVAILABLE. {'error': {'code': 503, 'message': 'This model is currently experiencing high deman
2026-05-02T17:07:41Z	0.806770	0.804905	-0.001865	discard	mutate [26] skill:FUNC_QUADRATICâ†’FUNC_TRANSFORM; arch:constraint_optimization_chainâ†’spatial_coordinate_bridge; style:modellingâ†’applied_real_world; mechs:[cross_topic_synthesis,hence_chains,hidden_structure]
2026-05-02T18:00:30Z	0.806770	0.804817	-0.001953	discard	mutate [26] skill:FUNC_QUADRATICâ†’FUNC_TRANSFORM; arch:constraint_optimization_chainâ†’spatial_coordinate_bridge; style:modellingâ†’applied_real_world; mechs:[multi_representation,hence_chains,cross_topic_synthesis]
2026-05-02T19:12:06Z	0.000000	0.000000	+0.000000	crash	error: 503 UNAVAILABLE. {'error': {'code': 503, 'message': 'This model is currently experiencing high deman
2026-05-02T20:01:32Z	0.806770	0.804587	-0.002183	discard	mutate [26] skill:FUNC_QUADRATICâ†’FUNC_TRANSFORM; arch:constraint_optimization_chainâ†’spatial_coordinate_bridge; style:modellingâ†’applied_real_world; mechs:[cross_topic_synthesis,hence_chains,hidden_structure]
2026-05-02T20:58:20Z	0.806770	0.920142	+0.113372	keep	mutate [26] skill:FUNC_QUADRATICâ†’FUNC_TRANSFORM; arch:constraint_optimization_chainâ†’spatial_coordinate_bridge; style:modellingâ†’applied_real_world; mechs:[cross_topic_synthesis,hence_chains,multi_representation]
2026-05-02T21:44:01Z	0.805438	0.802224	-0.003214	discard	mutate [12] skill:FUNC_TRANSFORMâ†’FUNC_QUADRATIC; arch:spatial_coordinate_bridgeâ†’constraint_optimization_chain; style:applied_real_worldâ†’modelling; mechs:[constraint_reasoning,cross_topic_synthesis,hence_chains]
2026-05-02T22:25:05Z	0.805438	0.803644	-0.001794	discard	mutate [12] skill:FUNC_TRANSFORMâ†’FUNC_QUADRATIC; arch:spatial_coordinate_bridgeâ†’constraint_optimization_chain; mechs:[constraint_reasoning,hence_chains,cross_topic_synthesis]
2026-05-02T23:10:11Z	0.805438	0.802967	-0.002471	discard	mutate [12] skill:FUNC_TRANSFORMâ†’FUNC_QUADRATIC; arch:spatial_coordinate_bridgeâ†’constraint_optimization_chain; style:applied_real_worldâ†’modelling; mechs:[constraint_reasoning,cross_topic_synthesis,hence_chains]
2026-05-03T00:00:24Z	0.805438	0.802087	-0.003351	discard	mutate [12] skill:FUNC_TRANSFORMâ†’FUNC_QUADRATIC; arch:spatial_coordinate_bridgeâ†’constraint_optimization_chain; style:applied_real_worldâ†’modelling; mechs:[cross_topic_synthesis,constraint_reasoning,hence_chains]
2026-05-03T04:03:47Z	0.805438	0.802960	-0.002478	discard	mutate [12] skill:FUNC_TRANSFORMâ†’FUNC_QUADRATIC; arch:spatial_coordinate_bridgeâ†’constraint_optimization_chain; style:applied_real_worldâ†’modelling; mechs:[constraint_reasoning,cross_topic_synthesis,hence_chains]
2026-05-03T06:35:38Z	0.000000	0.000000	+0.000000	crash	error: 503 UNAVAILABLE. {'error': {'code': 503, 'message': 'This model is currently experiencing high deman
2026-05-03T08:22:21Z	0.000000	0.000000	+0.000000	crash	error: 503 UNAVAILABLE. {'error': {'code': 503, 'message': 'This model is currently experiencing high deman
2026-05-03T09:47:12Z	0.805438	0.802295	-0.003143	discard	mutate [12] skill:FUNC_TRANSFORMâ†’FUNC_QUADRATIC; arch:spatial_coordinate_bridgeâ†’constraint_optimization_chain; style:applied_real_worldâ†’modelling; mechs:[constraint_reasoning,cross_topic_synthesis,hence_chains]
2026-05-03T10:40:24Z	0.805438	0.802508	-0.002930	discard	mutate [12] skill:FUNC_TRANSFORMâ†’FUNC_QUADRATIC; arch:spatial_coordinate_bridgeâ†’constraint_optimization_chain; mechs:[constraint_reasoning,cross_topic_synthesis,hidden_structure]
2026-05-03T11:27:37Z	0.805438	0.802993	-0.002445	discard	mutate [12] skill:FUNC_TRANSFORMâ†’FUNC_SUM_PRODUCT_ROOTS; arch:spatial_coordinate_bridgeâ†’constraint_optimization_chain; style:applied_real_worldâ†’modelling; mechs:[constraint_reasoning,hidden_structure,cross_topic_synthesis,hence_chains]
2026-05-03T12:06:29Z	0.805438	0.801619	-0.003819	discard	mutate [12] skill:FUNC_TRANSFORMâ†’FUNC_QUADRATIC; arch:spatial_coordinate_bridgeâ†’constraint_optimization_chain; style:applied_real_worldâ†’modelling; mechs:[constraint_reasoning,cross_topic_synthesis,hence_chains]
2026-05-03T13:46:08Z	0.805438	0.802928	-0.002510	discard	mutate [12] skill:FUNC_TRANSFORMâ†’FUNC_QUADRATIC; arch:spatial_coordinate_bridgeâ†’constraint_optimization_chain; style:applied_real_worldâ†’modelling; mechs:[constraint_reasoning,cross_topic_synthesis,hence_chains]
2026-05-03T14:37:47Z	0.805438	0.802945	-0.002493	discard	mutate [12] skill:FUNC_TRANSFORMâ†’FUNC_QUADRATIC; arch:spatial_coordinate_bridgeâ†’constraint_optimization_chain; style:applied_real_worldâ†’modelling; mechs:[constraint_reasoning,cross_topic_synthesis,hence_chains]
