timestamp	old_score	new_score	delta	status	description
2026-03-28T19:18:18Z	0.804977	0.801051	-0.003926	discard	mutate [7] skill:FUNC_TRANSFORMâ†’FUNC_QUADRATIC; arch:generalization_from_special_caseâ†’constraint_optimization_chain; style:modellingâ†’applied_real_world; mechs:[constraint_reasoning,hence_chains,cross_topic_synthesis]
2026-03-28T19:48:29Z	0.804977	0.800724	-0.004253	discard	mutate [7] skill:FUNC_TRANSFORMâ†’FUNC_RATIONAL; arch:generalization_from_special_caseâ†’constraint_optimization_chain; style:modellingâ†’applied_real_world; mechs:[constraint_reasoning,hence_chains,cross_topic_synthesis]
2026-03-28T20:04:16Z	0.804977	0.802051	-0.002926	discard	mutate [7] skill:FUNC_TRANSFORMâ†’FUNC_SUM_PRODUCT_ROOTS; arch:generalization_from_special_caseâ†’spatial_coordinate_bridge; style:modellingâ†’applied_real_world; mechs:[cross_topic_synthesis,constraint_reasoning,hidden_structure]
2026-03-28T20:48:41Z	0.804977	0.800760	-0.004217	discard	mutate [7] skill:FUNC_TRANSFORMâ†’FUNC_QUADRATIC; arch:generalization_from_special_caseâ†’constraint_optimization_chain; style:modellingâ†’applied_real_world; mechs:[constraint_reasoning,hence_chains,cross_topic_synthesis]
2026-03-28T21:17:40Z	0.804977	0.800662	-0.004315	discard	mutate [7] skill:FUNC_TRANSFORMâ†’FUNC_QUADRATIC; arch:generalization_from_special_caseâ†’constraint_optimization_chain; style:modellingâ†’applied_real_world; mechs:[constraint_reasoning,hence_chains,cross_topic_synthesis]
2026-03-28T21:48:57Z	0.804977	0.801231	-0.003746	discard	mutate [7] skill:FUNC_TRANSFORMâ†’FUNC_QUADRATIC; arch:generalization_from_special_caseâ†’constraint_optimization_chain; style:modellingâ†’applied_real_world; mechs:[constraint_reasoning,hence_chains,cross_topic_synthesis]
2026-03-28T22:04:30Z	0.804977	0.800245	-0.004732	discard	mutate [7] skill:FUNC_TRANSFORMâ†’FUNC_QUADRATIC; arch:generalization_from_special_caseâ†’constraint_optimization_chain; style:modellingâ†’applied_real_world; mechs:[constraint_reasoning,hence_chains,cross_topic_synthesis]
2026-03-28T22:48:02Z	0.804977	0.801477	-0.003500	discard	mutate [7] skill:FUNC_TRANSFORMâ†’FUNC_QUADRATIC; arch:generalization_from_special_caseâ†’constraint_optimization_chain; style:modellingâ†’applied_real_world; mechs:[constraint_reasoning,hence_chains,cross_topic_synthesis]
2026-03-28T23:17:51Z	0.804977	0.800788	-0.004189	discard	mutate [7] skill:FUNC_TRANSFORMâ†’FUNC_QUADRATIC; arch:generalization_from_special_caseâ†’spatial_coordinate_bridge; style:modellingâ†’applied_real_world; mechs:[cross_topic_synthesis,multi_representation,constraint_reasoning]
2026-03-28T23:50:07Z	0.804977	0.800842	-0.004135	discard	mutate [7] skill:FUNC_TRANSFORMâ†’FUNC_QUADRATIC; arch:generalization_from_special_caseâ†’constraint_optimization_chain; style:modellingâ†’applied_real_world; mechs:[constraint_reasoning,hence_chains,cross_topic_synthesis]
2026-03-29T01:06:55Z	0.000000	0.000000	+0.000000	crash	JSON parse error: Extra data: line 27 column 1 (char 3151)
2026-03-29T04:10:43Z	0.804977	0.801291	-0.003686	discard	mutate [7] skill:FUNC_TRANSFORMâ†’FUNC_QUADRATIC; arch:generalization_from_special_caseâ†’constraint_optimization_chain; style:modellingâ†’applied_real_world; mechs:[constraint_reasoning,cross_topic_synthesis,hence_chains]
2026-03-29T05:51:42Z	0.804977	0.801599	-0.003378	discard	mutate [7] skill:FUNC_TRANSFORMâ†’FUNC_QUADRATIC; arch:generalization_from_special_caseâ†’constraint_optimization_chain; style:modellingâ†’applied_real_world; mechs:[constraint_reasoning,hence_chains,cross_topic_synthesis]
2026-03-29T07:01:21Z	0.804977	0.801015	-0.003962	discard	mutate [7] skill:FUNC_TRANSFORMâ†’FUNC_QUADRATIC; arch:generalization_from_special_caseâ†’constraint_optimization_chain; style:modellingâ†’applied_real_world; mechs:[constraint_reasoning,cross_topic_synthesis,hence_chains]
2026-03-29T07:57:04Z	0.804977	0.800123	-0.004854	discard	mutate [7] skill:FUNC_TRANSFORMâ†’FUNC_RATIONAL; arch:generalization_from_special_caseâ†’constraint_optimization_chain; style:modellingâ†’applied_real_world; mechs:[constraint_reasoning,hence_chains,cross_topic_synthesis]
2026-03-29T08:40:50Z	0.000000	0.000000	+0.000000	crash	error: Missing required field: question
2026-03-29T09:22:08Z	0.804977	0.800091	-0.004886	discard	mutate [7] skill:FUNC_TRANSFORMâ†’FUNC_QUADRATIC; arch:generalization_from_special_caseâ†’constraint_optimization_chain; style:modellingâ†’applied_real_world; mechs:[constraint_reasoning,hence_chains,cross_topic_synthesis]
2026-03-29T10:02:21Z	0.804977	0.800548	-0.004429	discard	mutate [7] skill:FUNC_TRANSFORMâ†’FUNC_QUADRATIC; arch:generalization_from_special_caseâ†’constraint_optimization_chain; style:modellingâ†’applied_real_world; mechs:[constraint_reasoning,cross_topic_synthesis,hidden_structure,hence_chains]
2026-03-29T10:53:13Z	0.804977	0.801892	-0.003085	discard	mutate [7] skill:FUNC_TRANSFORMâ†’FUNC_SUM_PRODUCT_ROOTS; arch:generalization_from_special_caseâ†’representation_bridge; style:modellingâ†’applied_real_world; mechs:[hidden_structure,cross_topic_synthesis,constraint_reasoning,multi_representation]
2026-03-29T11:28:30Z	0.804977	0.800944	-0.004033	discard	mutate [7] skill:FUNC_TRANSFORMâ†’FUNC_QUADRATIC; arch:generalization_from_special_caseâ†’constraint_optimization_chain; style:modellingâ†’applied_real_world; mechs:[constraint_reasoning,hence_chains,cross_topic_synthesis]
2026-03-29T11:54:03Z	0.804977	0.800387	-0.004590	discard	mutate [7] skill:FUNC_TRANSFORMâ†’FUNC_RATIONAL; arch:generalization_from_special_caseâ†’constraint_optimization_chain; style:modellingâ†’applied_real_world; mechs:[constraint_reasoning,cross_topic_synthesis,hence_chains]
2026-03-29T12:52:31Z	0.804977	0.800605	-0.004372	discard	mutate [7] skill:FUNC_TRANSFORMâ†’FUNC_QUADRATIC; arch:generalization_from_special_caseâ†’constraint_optimization_chain; style:modellingâ†’applied_real_world; mechs:[constraint_reasoning,hence_chains,cross_topic_synthesis]
2026-03-29T13:52:54Z	0.804977	0.801310	-0.003667	discard	mutate [7] skill:FUNC_TRANSFORMâ†’FUNC_QUADRATIC; arch:generalization_from_special_caseâ†’constraint_optimization_chain; style:modellingâ†’applied_real_world; mechs:[constraint_reasoning,hence_chains,cross_topic_synthesis]
2026-03-29T14:33:25Z	0.804977	0.800837	-0.004140	discard	mutate [7] skill:FUNC_TRANSFORMâ†’FUNC_RATIONAL; arch:generalization_from_special_caseâ†’constraint_optimization_chain; style:modellingâ†’applied_real_world; mechs:[constraint_reasoning,cross_topic_synthesis,hence_chains]
2026-03-29T15:04:24Z	0.804977	0.800708	-0.004269	discard	mutate [7] skill:FUNC_TRANSFORMâ†’FUNC_QUADRATIC; arch:generalization_from_special_caseâ†’constraint_optimization_chain; style:modellingâ†’applied_real_world; mechs:[constraint_reasoning,cross_topic_synthesis,hence_chains]
2026-03-29T15:46:12Z	0.804977	0.802015	-0.002962	discard	mutate [7] skill:FUNC_TRANSFORMâ†’FUNC_SUM_PRODUCT_ROOTS; arch:generalization_from_special_caseâ†’spatial_coordinate_bridge; style:modellingâ†’applied_real_world; mechs:[cross_topic_synthesis,constraint_reasoning,multi_representation]
2026-03-29T16:17:53Z	0.804977	0.801297	-0.003680	discard	mutate [7] skill:FUNC_TRANSFORMâ†’FUNC_RATIONAL; arch:generalization_from_special_caseâ†’constraint_optimization_chain; style:modellingâ†’applied_real_world; mechs:[cross_topic_synthesis,constraint_reasoning,hence_chains,hidden_structure]
2026-03-29T16:57:02Z	0.804977	0.800587	-0.004390	discard	mutate [7] skill:FUNC_TRANSFORMâ†’FUNC_QUADRATIC; arch:generalization_from_special_caseâ†’constraint_optimization_chain; style:modellingâ†’applied_real_world; mechs:[constraint_reasoning,hence_chains,cross_topic_synthesis]
2026-03-29T17:28:40Z	0.804977	0.801326	-0.003651	discard	mutate [7] skill:FUNC_TRANSFORMâ†’FUNC_QUADRATIC; arch:generalization_from_special_caseâ†’constraint_optimization_chain; style:modellingâ†’applied_real_world; mechs:[constraint_reasoning,hence_chains,cross_topic_synthesis]
2026-03-29T18:00:07Z	0.804977	0.800781	-0.004196	discard	mutate [7] skill:FUNC_TRANSFORMâ†’FUNC_QUADRATIC; arch:generalization_from_special_caseâ†’constraint_optimization_chain; style:modellingâ†’applied_real_world; mechs:[cross_topic_synthesis,constraint_reasoning,hence_chains]
2026-03-29T18:54:03Z	0.804977	0.800804	-0.004173	discard	mutate [7] skill:FUNC_TRANSFORMâ†’FUNC_QUADRATIC; arch:generalization_from_special_caseâ†’constraint_optimization_chain; style:modellingâ†’applied_real_world; mechs:[constraint_reasoning,hence_chains,cross_topic_synthesis]
2026-03-29T19:31:58Z	0.804977	0.801479	-0.003498	discard	mutate [7] skill:FUNC_TRANSFORMâ†’FUNC_QUADRATIC; arch:generalization_from_special_caseâ†’constraint_optimization_chain; style:modellingâ†’applied_real_world; mechs:[constraint_reasoning,cross_topic_synthesis,hence_chains]
2026-03-29T20:00:57Z	0.000000	0.000000	+0.000000	crash	error: Missing required field: question
2026-03-29T20:39:39Z	0.804977	0.800796	-0.004181	discard	mutate [7] skill:FUNC_TRANSFORMâ†’FUNC_QUADRATIC; arch:generalization_from_special_caseâ†’constraint_optimization_chain; style:modellingâ†’applied_real_world; mechs:[constraint_reasoning,hence_chains,cross_topic_synthesis]
2026-03-29T21:04:30Z	0.804977	0.800139	-0.004838	discard	mutate [7] skill:FUNC_TRANSFORMâ†’FUNC_QUADRATIC; arch:generalization_from_special_caseâ†’constraint_optimization_chain; style:modellingâ†’applied_real_world; mechs:[constraint_reasoning,hence_chains,cross_topic_synthesis]
2026-03-29T21:47:06Z	0.804977	0.800619	-0.004358	discard	mutate [7] skill:FUNC_TRANSFORMâ†’FUNC_QUADRATIC; arch:generalization_from_special_caseâ†’constraint_optimization_chain; style:modellingâ†’applied_real_world; mechs:[constraint_reasoning,cross_topic_synthesis,hence_chains]
2026-03-29T22:04:22Z	0.804977	0.801088	-0.003889	discard	mutate [7] skill:FUNC_TRANSFORMâ†’FUNC_QUADRATIC; arch:generalization_from_special_caseâ†’constraint_optimization_chain; style:modellingâ†’applied_real_world; mechs:[constraint_reasoning,cross_topic_synthesis,hence_chains]
2026-03-29T22:50:04Z	0.804977	0.800094	-0.004883	discard	mutate [7] skill:FUNC_TRANSFORMâ†’FUNC_RATIONAL; arch:generalization_from_special_caseâ†’constraint_optimization_chain; style:modellingâ†’applied_real_world; mechs:[constraint_reasoning,cross_topic_synthesis]
2026-03-29T23:19:30Z	0.000000	0.000000	+0.000000	crash	error: Missing required field: question
2026-03-29T23:52:43Z	0.804977	0.800577	-0.004400	discard	mutate [7] skill:FUNC_TRANSFORMâ†’FUNC_QUADRATIC; arch:generalization_from_special_caseâ†’constraint_optimization_chain; style:modellingâ†’applied_real_world; mechs:[constraint_reasoning,hence_chains,hidden_structure]
2026-03-30T02:13:32Z	0.804977	0.800755	-0.004222	discard	mutate [7] skill:FUNC_TRANSFORMâ†’FUNC_QUADRATIC; arch:generalization_from_special_caseâ†’constraint_optimization_chain; style:modellingâ†’applied_real_world; mechs:[constraint_reasoning,cross_topic_synthesis,hence_chains]
2026-03-30T05:09:48Z	0.804977	0.801875	-0.003102	discard	mutate [7] skill:FUNC_TRANSFORMâ†’FUNC_SUM_PRODUCT_ROOTS; arch:generalization_from_special_caseâ†’spatial_coordinate_bridge; style:modellingâ†’applied_real_world; mechs:[constraint_reasoning,cross_topic_synthesis,multi_representation]
2026-03-30T07:01:30Z	0.804977	0.801332	-0.003645	discard	mutate [7] skill:FUNC_TRANSFORMâ†’FUNC_QUADRATIC; arch:generalization_from_special_caseâ†’constraint_optimization_chain; style:modellingâ†’applied_real_world; mechs:[constraint_reasoning,cross_topic_synthesis]
2026-03-30T08:27:31Z	0.804977	0.800104	-0.004873	discard	mutate [7] skill:FUNC_TRANSFORMâ†’FUNC_RATIONAL; arch:generalization_from_special_caseâ†’constraint_optimization_chain; style:modellingâ†’applied_real_world; mechs:[cross_topic_synthesis,constraint_reasoning,hence_chains]
2026-03-30T09:56:04Z	0.804977	0.800160	-0.004817	discard	mutate [7] skill:FUNC_TRANSFORMâ†’FUNC_RATIONAL; arch:generalization_from_special_caseâ†’constraint_optimization_chain; style:modellingâ†’applied_real_world; mechs:[constraint_reasoning,cross_topic_synthesis,hence_chains]
2026-03-30T11:01:06Z	0.000000	0.000000	+0.000000	crash	error: Missing required field: question
2026-03-30T12:01:56Z	0.804977	0.800645	-0.004332	discard	mutate [7] skill:FUNC_TRANSFORMâ†’FUNC_QUADRATIC; arch:generalization_from_special_caseâ†’constraint_optimization_chain; style:modellingâ†’applied_real_world; mechs:[constraint_reasoning,cross_topic_synthesis,hence_chains]
2026-03-30T14:01:38Z	0.804977	0.800625	-0.004352	discard	mutate [7] skill:FUNC_TRANSFORMâ†’FUNC_QUADRATIC; arch:generalization_from_special_caseâ†’constraint_optimization_chain; style:modellingâ†’applied_real_world; mechs:[constraint_reasoning,cross_topic_synthesis,hence_chains]
2026-03-30T15:14:53Z	0.804977	0.800060	-0.004917	discard	mutate [7] skill:FUNC_TRANSFORMâ†’FUNC_RATIONAL; arch:generalization_from_special_caseâ†’constraint_optimization_chain; style:modellingâ†’applied_real_world; mechs:[constraint_reasoning,cross_topic_synthesis,hence_chains]
2026-03-30T16:15:15Z	0.000000	0.000000	+0.000000	crash	error: 503 UNAVAILABLE. {'error': {'code': 503, 'message': 'This model is currently experiencing high deman
2026-03-30T17:14:53Z	0.804977	0.800622	-0.004355	discard	mutate [7] skill:FUNC_TRANSFORMâ†’FUNC_QUADRATIC; arch:generalization_from_special_caseâ†’constraint_optimization_chain; style:modellingâ†’applied_real_world; mechs:[constraint_reasoning,hence_chains,cross_topic_synthesis]
2026-03-30T18:10:28Z	0.804977	0.801311	-0.003666	discard	mutate [7] skill:FUNC_TRANSFORMâ†’FUNC_QUADRATIC; arch:generalization_from_special_caseâ†’spatial_coordinate_bridge; style:modellingâ†’applied_real_world; mechs:[cross_topic_synthesis,constraint_reasoning,hidden_structure]
2026-03-30T19:20:15Z	0.804977	0.800138	-0.004839	discard	mutate [7] skill:FUNC_TRANSFORMâ†’FUNC_RATIONAL; arch:generalization_from_special_caseâ†’constraint_optimization_chain; style:modellingâ†’applied_real_world; mechs:[constraint_reasoning,hence_chains,cross_topic_synthesis]
2026-03-30T20:04:14Z	0.804977	0.800721	-0.004256	discard	mutate [7] skill:FUNC_TRANSFORMâ†’FUNC_QUADRATIC; arch:generalization_from_special_caseâ†’constraint_optimization_chain; style:modellingâ†’applied_real_world; mechs:[constraint_reasoning,cross_topic_synthesis,hence_chains]
2026-03-30T21:00:49Z	0.804977	0.800136	-0.004841	discard	mutate [7] skill:FUNC_TRANSFORMâ†’FUNC_QUADRATIC; arch:generalization_from_special_caseâ†’constraint_optimization_chain; style:modellingâ†’applied_real_world; mechs:[constraint_reasoning,hence_chains,cross_topic_synthesis]
2026-03-30T21:53:37Z	0.804977	0.800868	-0.004109	discard	mutate [7] skill:FUNC_TRANSFORMâ†’FUNC_QUADRATIC; arch:generalization_from_special_caseâ†’constraint_optimization_chain; style:modellingâ†’applied_real_world; mechs:[constraint_reasoning,hence_chains,cross_topic_synthesis]
2026-03-30T22:34:26Z	0.804977	0.801387	-0.003590	discard	mutate [7] skill:FUNC_TRANSFORMâ†’FUNC_QUADRATIC; arch:generalization_from_special_caseâ†’constraint_optimization_chain; style:modellingâ†’applied_real_world; mechs:[constraint_reasoning,hence_chains,cross_topic_synthesis]
2026-03-30T23:08:08Z	0.804977	0.801435	-0.003542	discard	mutate [7] skill:FUNC_TRANSFORMâ†’FUNC_QUADRATIC; arch:generalization_from_special_caseâ†’constraint_optimization_chain; style:modellingâ†’applied_real_world; mechs:[cross_topic_synthesis,constraint_reasoning,hidden_structure]
2026-03-30T23:50:25Z	0.804977	0.800770	-0.004207	discard	mutate [7] skill:FUNC_TRANSFORMâ†’FUNC_RATIONAL; arch:generalization_from_special_caseâ†’constraint_optimization_chain; style:modellingâ†’applied_real_world; mechs:[constraint_reasoning,cross_topic_synthesis,hence_chains]
2026-03-31T01:05:20Z	0.804977	0.801416	-0.003561	discard	mutate [7] skill:FUNC_TRANSFORMâ†’FUNC_QUADRATIC; arch:generalization_from_special_caseâ†’constraint_optimization_chain; style:modellingâ†’applied_real_world; mechs:[constraint_reasoning,hence_chains,cross_topic_synthesis]
2026-03-31T04:07:59Z	0.804977	0.800706	-0.004271	discard	mutate [7] skill:FUNC_TRANSFORMâ†’FUNC_QUADRATIC; arch:generalization_from_special_caseâ†’constraint_optimization_chain; style:modellingâ†’applied_real_world; mechs:[constraint_reasoning,hence_chains,cross_topic_synthesis]
2026-03-31T05:52:44Z	0.804977	0.801383	-0.003594	discard	mutate [7] skill:FUNC_TRANSFORMâ†’FUNC_QUADRATIC; arch:generalization_from_special_caseâ†’constraint_optimization_chain; style:modellingâ†’applied_real_world; mechs:[cross_topic_synthesis,hidden_structure,constraint_reasoning,hence_chains]
2026-03-31T07:11:27Z	0.804977	0.801417	-0.003560	discard	mutate [7] skill:FUNC_TRANSFORMâ†’FUNC_QUADRATIC; arch:generalization_from_special_caseâ†’constraint_optimization_chain; style:modellingâ†’applied_real_world; mechs:[constraint_reasoning,hence_chains,cross_topic_synthesis]
2026-03-31T08:18:42Z	0.804977	0.801347	-0.003630	discard	mutate [7] skill:FUNC_TRANSFORMâ†’FUNC_QUADRATIC; arch:generalization_from_special_caseâ†’constraint_optimization_chain; style:modellingâ†’applied_real_world; mechs:[constraint_reasoning,hence_chains,hidden_structure]
2026-03-31T09:36:03Z	0.000000	0.000000	+0.000000	crash	error: Missing required field: question
2026-03-31T10:38:19Z	0.804977	0.800619	-0.004358	discard	mutate [7] skill:FUNC_TRANSFORMâ†’FUNC_QUADRATIC; arch:generalization_from_special_caseâ†’constraint_optimization_chain; style:modellingâ†’applied_real_world; mechs:[constraint_reasoning,cross_topic_synthesis,hence_chains]
2026-03-31T11:32:48Z	0.804977	0.800024	-0.004953	discard	mutate [7] skill:FUNC_TRANSFORMâ†’FUNC_QUADRATIC; arch:generalization_from_special_caseâ†’constraint_optimization_chain; style:modellingâ†’applied_real_world; mechs:[constraint_reasoning,hence_chains,cross_topic_synthesis]
2026-03-31T12:39:07Z	0.804977	0.800121	-0.004856	discard	mutate [7] skill:FUNC_TRANSFORMâ†’FUNC_QUADRATIC; arch:generalization_from_special_caseâ†’constraint_optimization_chain; style:modellingâ†’applied_real_world; mechs:[constraint_reasoning,cross_topic_synthesis,hence_chains]
2026-03-31T14:13:34Z	0.804977	0.801438	-0.003539	discard	mutate [7] skill:FUNC_TRANSFORMâ†’FUNC_QUADRATIC; arch:generalization_from_special_caseâ†’constraint_optimization_chain; style:modellingâ†’applied_real_world; mechs:[constraint_reasoning,hence_chains]
2026-03-31T15:39:51Z	0.804977	0.801350	-0.003627	discard	mutate [7] skill:FUNC_TRANSFORMâ†’FUNC_QUADRATIC; arch:generalization_from_special_caseâ†’constraint_optimization_chain; style:modellingâ†’applied_real_world; mechs:[constraint_reasoning,hence_chains,cross_topic_synthesis]
2026-03-31T16:38:54Z	0.804977	0.801167	-0.003810	discard	mutate [7] skill:FUNC_TRANSFORMâ†’FUNC_QUADRATIC; arch:generalization_from_special_caseâ†’constraint_optimization_chain; style:modellingâ†’applied_real_world; mechs:[constraint_reasoning,cross_topic_synthesis,hence_chains]
2026-03-31T17:39:14Z	0.804977	0.801276	-0.003701	discard	mutate [7] skill:FUNC_TRANSFORMâ†’FUNC_QUADRATIC; arch:generalization_from_special_caseâ†’constraint_optimization_chain; style:modellingâ†’applied_real_world; mechs:[constraint_reasoning,hence_chains,cross_topic_synthesis]
2026-03-31T18:37:29Z	0.804977	0.801405	-0.003572	discard	mutate [7] skill:FUNC_TRANSFORMâ†’FUNC_QUADRATIC; arch:generalization_from_special_caseâ†’constraint_optimization_chain; style:modellingâ†’applied_real_world; mechs:[constraint_reasoning,hence_chains,cross_topic_synthesis]
2026-03-31T19:39:58Z	0.804977	0.800992	-0.003985	discard	mutate [7] skill:FUNC_TRANSFORMâ†’FUNC_QUADRATIC; arch:generalization_from_special_caseâ†’constraint_optimization_chain; style:modellingâ†’applied_real_world; mechs:[constraint_reasoning,cross_topic_synthesis,hence_chains]
2026-03-31T20:25:20Z	0.804977	0.801313	-0.003664	discard	mutate [7] skill:FUNC_TRANSFORMâ†’FUNC_QUADRATIC; arch:generalization_from_special_caseâ†’constraint_optimization_chain; style:modellingâ†’applied_real_world; mechs:[constraint_reasoning,hence_chains,cross_topic_synthesis]
2026-03-31T21:03:14Z	0.804977	0.800986	-0.003991	discard	mutate [7] skill:FUNC_TRANSFORMâ†’FUNC_QUADRATIC; arch:generalization_from_special_caseâ†’constraint_optimization_chain; style:modellingâ†’applied_real_world; mechs:[constraint_reasoning,hence_chains,cross_topic_synthesis]
2026-03-31T21:53:26Z	0.804977	0.801468	-0.003509	discard	mutate [7] skill:FUNC_TRANSFORMâ†’FUNC_QUADRATIC; arch:generalization_from_special_caseâ†’constraint_optimization_chain; style:modellingâ†’applied_real_world; mechs:[constraint_reasoning,hence_chains,cross_topic_synthesis]
2026-03-31T22:33:44Z	0.804977	0.801471	-0.003506	discard	mutate [7] skill:FUNC_TRANSFORMâ†’FUNC_QUADRATIC; arch:generalization_from_special_caseâ†’constraint_optimization_chain; style:modellingâ†’applied_real_world; mechs:[constraint_reasoning,cross_topic_synthesis,hence_chains]
2026-03-31T23:04:38Z	0.804977	0.800789	-0.004188	discard	mutate [7] skill:FUNC_TRANSFORMâ†’FUNC_QUADRATIC; arch:generalization_from_special_caseâ†’constraint_optimization_chain; style:modellingâ†’applied_real_world; mechs:[constraint_reasoning,hence_chains,cross_topic_synthesis]
2026-03-31T23:48:32Z	0.804977	0.801319	-0.003658	discard	mutate [7] skill:FUNC_TRANSFORMâ†’FUNC_QUADRATIC; arch:generalization_from_special_caseâ†’constraint_optimization_chain; style:modellingâ†’applied_real_world; mechs:[constraint_reasoning,cross_topic_synthesis]
2026-04-01T01:10:51Z	0.804977	0.801080	-0.003897	discard	mutate [7] skill:FUNC_TRANSFORMâ†’FUNC_RATIONAL; arch:generalization_from_special_caseâ†’constraint_optimization_chain; style:modellingâ†’applied_real_world; mechs:[constraint_reasoning,cross_topic_synthesis,hence_chains]
2026-04-01T04:22:02Z	0.804977	0.800604	-0.004373	discard	mutate [7] skill:FUNC_TRANSFORMâ†’FUNC_QUADRATIC; arch:generalization_from_special_caseâ†’constraint_optimization_chain; style:modellingâ†’applied_real_world; mechs:[constraint_reasoning,cross_topic_synthesis,hence_chains]
