timestamp	old_score	new_score	delta	status	description
2026-04-19T14:58:26Z	0.805622	0.802900	-0.002722	discard	mutate [26] skill:FUNC_TRANSFORMâ†’FUNC_QUADRATIC; arch:spatial_coordinate_bridgeâ†’constraint_optimization_chain; style:applied_real_worldâ†’modelling; mechs:[constraint_reasoning,hence_chains,cross_topic_synthesis,proof_unfamiliar_context]
2026-04-19T15:40:40Z	0.805622	0.803073	-0.002549	discard	mutate [26] skill:FUNC_TRANSFORMâ†’FUNC_SUM_PRODUCT_ROOTS; arch:spatial_coordinate_bridgeâ†’constraint_optimization_chain; style:applied_real_worldâ†’modelling; mechs:[constraint_reasoning,cross_topic_synthesis,hidden_structure]
2026-04-19T16:20:48Z	0.805622	0.803661	-0.001961	discard	mutate [26] skill:FUNC_TRANSFORMâ†’FUNC_QUADRATIC; arch:spatial_coordinate_bridgeâ†’constraint_optimization_chain; style:applied_real_worldâ†’modelling; mechs:[constraint_reasoning,cross_topic_synthesis,hence_chains]
2026-04-19T17:01:43Z	0.805622	0.803682	-0.001940	discard	mutate [26] skill:FUNC_TRANSFORMâ†’FUNC_QUADRATIC; arch:spatial_coordinate_bridgeâ†’constraint_optimization_chain; style:applied_real_worldâ†’modelling; mechs:[constraint_reasoning,cross_topic_synthesis,hence_chains]
2026-04-19T17:51:43Z	0.805622	0.803184	-0.002438	discard	mutate [26] skill:FUNC_TRANSFORMâ†’FUNC_SUM_PRODUCT_ROOTS; arch:spatial_coordinate_bridgeâ†’reverse_engineering; style:applied_real_worldâ†’modelling; mechs:[cross_topic_synthesis,constraint_reasoning,hence_chains]
2026-04-19T18:45:41Z	0.805622	0.803726	-0.001896	discard	mutate [26] skill:FUNC_TRANSFORMâ†’FUNC_SUM_PRODUCT_ROOTS; arch:spatial_coordinate_bridgeâ†’constraint_optimization_chain; style:applied_real_worldâ†’modelling; mechs:[constraint_reasoning,cross_topic_synthesis,hence_chains]
2026-04-19T19:32:41Z	0.805622	0.802875	-0.002747	discard	mutate [26] skill:FUNC_TRANSFORMâ†’FUNC_QUADRATIC; arch:spatial_coordinate_bridgeâ†’constraint_optimization_chain; style:applied_real_worldâ†’modelling; mechs:[cross_topic_synthesis,proof_unfamiliar_context,constraint_reasoning]
2026-04-19T20:05:35Z	0.805622	0.803697	-0.001925	discard	mutate [26] skill:FUNC_TRANSFORMâ†’FUNC_QUADRATIC; arch:spatial_coordinate_bridgeâ†’constraint_optimization_chain; style:applied_real_worldâ†’modelling; mechs:[constraint_reasoning,cross_topic_synthesis,hence_chains]
2026-04-19T20:53:45Z	0.805622	0.802620	-0.003002	discard	mutate [26] skill:FUNC_TRANSFORMâ†’FUNC_QUADRATIC; arch:spatial_coordinate_bridgeâ†’constraint_optimization_chain; style:applied_real_worldâ†’modelling; mechs:[constraint_reasoning,hence_chains,cross_topic_synthesis]
2026-04-19T21:34:52Z	0.805622	0.802899	-0.002723	discard	mutate [26] skill:FUNC_TRANSFORMâ†’FUNC_QUADRATIC; arch:spatial_coordinate_bridgeâ†’constraint_optimization_chain; mechs:[constraint_reasoning,cross_topic_synthesis,hence_chains]
2026-04-19T22:04:35Z	0.805622	0.803690	-0.001932	discard	mutate [26] skill:FUNC_TRANSFORMâ†’FUNC_QUADRATIC; arch:spatial_coordinate_bridgeâ†’constraint_optimization_chain; style:applied_real_worldâ†’modelling; mechs:[constraint_reasoning,cross_topic_synthesis,hence_chains]
2026-04-19T22:54:02Z	0.805622	0.803608	-0.002014	discard	mutate [26] skill:FUNC_TRANSFORMâ†’FUNC_RATIONAL; arch:spatial_coordinate_bridgeâ†’constraint_optimization_chain; mechs:[constraint_reasoning,hence_chains,cross_topic_synthesis,hidden_structure]
2026-04-19T23:34:38Z	0.805622	0.802949	-0.002673	discard	mutate [26] skill:FUNC_TRANSFORMâ†’FUNC_QUADRATIC; arch:spatial_coordinate_bridgeâ†’constraint_optimization_chain; mechs:[constraint_reasoning,cross_topic_synthesis,hence_chains]
2026-04-20T00:06:49Z	0.805622	0.802630	-0.002992	discard	mutate [26] skill:FUNC_TRANSFORMâ†’FUNC_QUADRATIC; arch:spatial_coordinate_bridgeâ†’constraint_optimization_chain; style:applied_real_worldâ†’modelling; mechs:[constraint_reasoning,cross_topic_synthesis,hence_chains]
2026-04-20T03:49:51Z	0.805622	0.803757	-0.001865	discard	mutate [26] skill:FUNC_TRANSFORMâ†’FUNC_QUADRATIC; arch:spatial_coordinate_bridgeâ†’constraint_optimization_chain; style:applied_real_worldâ†’modelling; mechs:[constraint_reasoning,cross_topic_synthesis,hence_chains]
2026-04-20T06:07:49Z	0.805622	0.802591	-0.003031	discard	mutate [26] skill:FUNC_TRANSFORMâ†’FUNC_QUADRATIC; arch:spatial_coordinate_bridgeâ†’constraint_optimization_chain; style:applied_real_worldâ†’modelling; mechs:[constraint_reasoning,cross_topic_synthesis,hence_chains]
2026-04-20T08:26:24Z	0.805622	0.803813	-0.001809	discard	mutate [26] skill:FUNC_TRANSFORMâ†’FUNC_QUADRATIC; arch:spatial_coordinate_bridgeâ†’constraint_optimization_chain; style:applied_real_worldâ†’modelling; mechs:[constraint_reasoning,cross_topic_synthesis]
2026-04-20T10:16:38Z	0.805622	0.803649	-0.001973	discard	mutate [26] skill:FUNC_TRANSFORMâ†’FUNC_QUADRATIC; arch:spatial_coordinate_bridgeâ†’constraint_optimization_chain; style:applied_real_worldâ†’modelling; mechs:[constraint_reasoning,cross_topic_synthesis,hidden_structure,hence_chains]
2026-04-20T11:45:55Z	0.805622	0.802588	-0.003034	discard	mutate [26] skill:FUNC_TRANSFORMâ†’FUNC_QUADRATIC; arch:spatial_coordinate_bridgeâ†’constraint_optimization_chain; style:applied_real_worldâ†’modelling; mechs:[constraint_reasoning,cross_topic_synthesis]
2026-04-20T12:54:54Z	0.805622	0.802846	-0.002776	discard	mutate [26] skill:FUNC_TRANSFORMâ†’FUNC_RATIONAL; arch:spatial_coordinate_bridgeâ†’constraint_optimization_chain; style:applied_real_worldâ†’modelling; mechs:[constraint_reasoning,cross_topic_synthesis]
2026-04-20T14:49:26Z	0.805622	0.802407	-0.003215	discard	mutate [26] skill:FUNC_TRANSFORMâ†’FUNC_LOG; arch:spatial_coordinate_bridgeâ†’constraint_optimization_chain; style:applied_real_worldâ†’modelling; mechs:[constraint_reasoning,cross_topic_synthesis,hidden_structure]
2026-04-20T15:59:58Z	0.805622	0.802986	-0.002636	discard	mutate [26] skill:FUNC_TRANSFORMâ†’FUNC_RATIONAL; arch:spatial_coordinate_bridgeâ†’constraint_optimization_chain; style:applied_real_worldâ†’modelling; mechs:[constraint_reasoning,cross_topic_synthesis,hence_chains]
2026-04-20T17:15:35Z	0.805622	0.802690	-0.002932	discard	mutate [26] skill:FUNC_TRANSFORMâ†’FUNC_QUADRATIC; arch:spatial_coordinate_bridgeâ†’constraint_optimization_chain; style:applied_real_worldâ†’modelling; mechs:[constraint_reasoning,cross_topic_synthesis,hidden_structure]
2026-04-20T18:12:02Z	0.805622	0.802959	-0.002663	discard	mutate [26] skill:FUNC_TRANSFORMâ†’FUNC_RATIONAL; arch:spatial_coordinate_bridgeâ†’constraint_optimization_chain; style:applied_real_worldâ†’modelling; mechs:[cross_topic_synthesis,constraint_reasoning,hence_chains]
2026-04-20T19:36:37Z	0.805622	0.802853	-0.002769	discard	mutate [26] skill:FUNC_TRANSFORMâ†’FUNC_QUADRATIC; arch:spatial_coordinate_bridgeâ†’constraint_optimization_chain; style:applied_real_worldâ†’modelling; mechs:[constraint_reasoning,cross_topic_synthesis,hence_chains]
2026-04-20T20:24:52Z	0.805622	0.803029	-0.002593	discard	mutate [26] skill:FUNC_TRANSFORMâ†’FUNC_QUADRATIC; arch:spatial_coordinate_bridgeâ†’constraint_optimization_chain; style:applied_real_worldâ†’modelling; mechs:[cross_topic_synthesis,constraint_reasoning,hence_chains]
2026-04-20T21:11:05Z	0.805622	0.802255	-0.003367	discard	mutate [26] skill:FUNC_TRANSFORMâ†’FUNC_LOG; arch:spatial_coordinate_bridgeâ†’constraint_optimization_chain; style:applied_real_worldâ†’modelling; mechs:[constraint_reasoning,cross_topic_synthesis,proof_unfamiliar_context]
2026-04-20T22:02:59Z	0.805622	0.802354	-0.003268	discard	mutate [26] skill:FUNC_TRANSFORMâ†’FUNC_QUADRATIC; arch:spatial_coordinate_bridgeâ†’constraint_optimization_chain; style:applied_real_worldâ†’modelling; mechs:[constraint_reasoning,cross_topic_synthesis,hence_chains]
2026-04-20T23:01:27Z	0.805622	0.803683	-0.001939	discard	mutate [26] skill:FUNC_TRANSFORMâ†’FUNC_QUADRATIC; arch:spatial_coordinate_bridgeâ†’constraint_optimization_chain; style:applied_real_worldâ†’modelling; mechs:[constraint_reasoning,cross_topic_synthesis,hidden_structure]
2026-04-20T23:54:52Z	0.805622	0.802907	-0.002715	discard	mutate [26] skill:FUNC_TRANSFORMâ†’FUNC_QUADRATIC; arch:spatial_coordinate_bridgeâ†’constraint_optimization_chain; style:applied_real_worldâ†’modelling; mechs:[constraint_reasoning,cross_topic_synthesis,hence_chains]
2026-04-21T02:26:55Z	0.805622	0.802134	-0.003488	discard	mutate [26] skill:FUNC_TRANSFORMâ†’FUNC_QUADRATIC; arch:spatial_coordinate_bridgeâ†’constraint_optimization_chain; style:applied_real_worldâ†’modelling; mechs:[constraint_reasoning,cross_topic_synthesis,hence_chains]
2026-04-21T05:15:09Z	0.805622	0.802798	-0.002824	discard	mutate [26] skill:FUNC_TRANSFORMâ†’FUNC_QUADRATIC; arch:spatial_coordinate_bridgeâ†’constraint_optimization_chain; style:applied_real_worldâ†’modelling; mechs:[constraint_reasoning,cross_topic_synthesis]
2026-04-21T07:08:20Z	0.805622	0.802922	-0.002700	discard	mutate [26] skill:FUNC_TRANSFORMâ†’FUNC_RATIONAL; arch:spatial_coordinate_bridgeâ†’constraint_optimization_chain; style:applied_real_worldâ†’modelling; mechs:[constraint_reasoning,cross_topic_synthesis]
2026-04-21T09:00:44Z	0.805622	0.802702	-0.002920	discard	mutate [26] skill:FUNC_TRANSFORMâ†’FUNC_QUADRATIC; arch:spatial_coordinate_bridgeâ†’constraint_optimization_chain; style:applied_real_worldâ†’modelling; mechs:[cross_topic_synthesis,constraint_reasoning,hence_chains]
2026-04-21T10:25:11Z	0.805622	0.802619	-0.003003	discard	mutate [26] skill:FUNC_TRANSFORMâ†’FUNC_QUADRATIC; arch:spatial_coordinate_bridgeâ†’constraint_optimization_chain; style:applied_real_worldâ†’modelling; mechs:[cross_topic_synthesis,constraint_reasoning]
2026-04-21T11:38:53Z	0.805622	0.802927	-0.002695	discard	mutate [26] skill:FUNC_TRANSFORMâ†’FUNC_QUADRATIC; arch:spatial_coordinate_bridgeâ†’constraint_optimization_chain; style:applied_real_worldâ†’modelling; mechs:[constraint_reasoning,cross_topic_synthesis,hence_chains]
2026-04-21T12:45:25Z	0.805622	0.802409	-0.003213	discard	mutate [26] skill:FUNC_TRANSFORMâ†’FUNC_QUADRATIC; arch:spatial_coordinate_bridgeâ†’constraint_optimization_chain; style:applied_real_worldâ†’modelling; mechs:[constraint_reasoning,hence_chains,cross_topic_synthesis]
2026-04-21T14:24:26Z	0.805622	0.803608	-0.002014	discard	mutate [26] skill:FUNC_TRANSFORMâ†’FUNC_QUADRATIC; arch:spatial_coordinate_bridgeâ†’constraint_optimization_chain; style:applied_real_worldâ†’modelling; mechs:[constraint_reasoning,cross_topic_synthesis,hence_chains]
2026-04-21T15:52:06Z	0.805622	0.802316	-0.003306	discard	mutate [26] skill:FUNC_TRANSFORMâ†’FUNC_LOG; arch:spatial_coordinate_bridgeâ†’constraint_optimization_chain; style:applied_real_worldâ†’modelling; mechs:[constraint_reasoning,cross_topic_synthesis,hence_chains]
2026-04-21T16:59:48Z	0.805622	0.803001	-0.002621	discard	mutate [26] skill:FUNC_TRANSFORMâ†’FUNC_RATIONAL; arch:spatial_coordinate_bridgeâ†’constraint_optimization_chain; style:applied_real_worldâ†’modelling; mechs:[constraint_reasoning,cross_topic_synthesis,hence_chains]
2026-04-21T18:02:40Z	0.805622	0.803423	-0.002199	discard	mutate [26] skill:FUNC_TRANSFORMâ†’FUNC_QUADRATIC; arch:spatial_coordinate_bridgeâ†’constraint_optimization_chain; mechs:[constraint_reasoning,cross_topic_synthesis,hence_chains]
2026-04-21T19:36:13Z	0.805622	0.803640	-0.001982	discard	mutate [26] skill:FUNC_TRANSFORMâ†’FUNC_QUADRATIC; arch:spatial_coordinate_bridgeâ†’constraint_optimization_chain; style:applied_real_worldâ†’modelling; mechs:[constraint_reasoning,cross_topic_synthesis,hence_chains]
2026-04-21T20:30:40Z	0.805622	0.802846	-0.002776	discard	mutate [26] skill:FUNC_TRANSFORMâ†’FUNC_QUADRATIC; arch:spatial_coordinate_bridgeâ†’constraint_optimization_chain; style:applied_real_worldâ†’modelling; mechs:[constraint_reasoning,cross_topic_synthesis,hence_chains]
2026-04-21T21:24:26Z	0.805622	0.802875	-0.002747	discard	mutate [26] skill:FUNC_TRANSFORMâ†’FUNC_RATIONAL; arch:spatial_coordinate_bridgeâ†’constraint_optimization_chain; style:applied_real_worldâ†’modelling; mechs:[cross_topic_synthesis,constraint_reasoning,hence_chains]
2026-04-21T22:08:29Z	0.805622	0.803719	-0.001903	discard	mutate [26] skill:FUNC_TRANSFORMâ†’FUNC_QUADRATIC; arch:spatial_coordinate_bridgeâ†’constraint_optimization_chain; style:applied_real_worldâ†’modelling; mechs:[constraint_reasoning,hence_chains,cross_topic_synthesis]
2026-04-21T22:58:09Z	0.805622	0.802398	-0.003224	discard	mutate [26] skill:FUNC_TRANSFORMâ†’FUNC_QUADRATIC; arch:spatial_coordinate_bridgeâ†’constraint_optimization_chain; style:applied_real_worldâ†’modelling; mechs:[constraint_reasoning,cross_topic_synthesis,hence_chains]
2026-04-21T23:37:42Z	0.805622	0.803036	-0.002586	discard	mutate [26] skill:FUNC_TRANSFORMâ†’FUNC_QUADRATIC; arch:spatial_coordinate_bridgeâ†’constraint_optimization_chain; mechs:[constraint_reasoning,cross_topic_synthesis,hence_chains]
2026-04-22T00:07:07Z	0.805622	0.803592	-0.002030	discard	mutate [26] skill:FUNC_TRANSFORMâ†’FUNC_QUADRATIC; arch:spatial_coordinate_bridgeâ†’constraint_optimization_chain; style:applied_real_worldâ†’modelling; mechs:[constraint_reasoning,cross_topic_synthesis,hence_chains]
2026-04-22T03:38:48Z	0.805622	0.803673	-0.001949	discard	mutate [26] skill:FUNC_TRANSFORMâ†’FUNC_QUADRATIC; arch:spatial_coordinate_bridgeâ†’constraint_optimization_chain; style:applied_real_worldâ†’modelling; mechs:[constraint_reasoning,cross_topic_synthesis,hence_chains]
2026-04-22T05:52:12Z	0.805622	0.803097	-0.002525	discard	mutate [26] skill:FUNC_TRANSFORMâ†’FUNC_RATIONAL; arch:spatial_coordinate_bridgeâ†’constraint_optimization_chain; style:applied_real_worldâ†’modelling; mechs:[constraint_reasoning,cross_topic_synthesis,hence_chains]
2026-04-22T07:30:24Z	0.805622	0.802790	-0.002832	discard	mutate [26] skill:FUNC_TRANSFORMâ†’FUNC_QUADRATIC; arch:spatial_coordinate_bridgeâ†’constraint_optimization_chain; style:applied_real_worldâ†’modelling; mechs:[constraint_reasoning,cross_topic_synthesis,hence_chains]
2026-04-22T09:07:35Z	0.805622	0.802918	-0.002704	discard	mutate [26] skill:FUNC_TRANSFORMâ†’FUNC_RATIONAL; arch:spatial_coordinate_bridgeâ†’constraint_optimization_chain; style:applied_real_worldâ†’modelling; mechs:[cross_topic_synthesis,constraint_reasoning,hidden_structure]
2026-04-22T10:41:48Z	0.805622	0.802506	-0.003116	discard	mutate [26] skill:FUNC_TRANSFORMâ†’FUNC_QUADRATIC; arch:spatial_coordinate_bridgeâ†’constraint_optimization_chain; style:applied_real_worldâ†’modelling; mechs:[constraint_reasoning,cross_topic_synthesis,hence_chains]
2026-04-22T11:45:54Z	0.805622	0.802353	-0.003269	discard	mutate [26] skill:FUNC_TRANSFORMâ†’FUNC_QUADRATIC; arch:spatial_coordinate_bridgeâ†’constraint_optimization_chain; style:applied_real_worldâ†’modelling; mechs:[constraint_reasoning,cross_topic_synthesis,hence_chains]
2026-04-22T12:48:24Z	0.805622	0.803466	-0.002156	discard	mutate [26] skill:FUNC_TRANSFORMâ†’FUNC_QUADRATIC; arch:spatial_coordinate_bridgeâ†’constraint_optimization_chain; mechs:[constraint_reasoning,hence_chains,cross_topic_synthesis]
2026-04-22T14:26:08Z	0.805622	0.802937	-0.002685	discard	mutate [26] skill:FUNC_TRANSFORMâ†’FUNC_RATIONAL; arch:spatial_coordinate_bridgeâ†’constraint_optimization_chain; style:applied_real_worldâ†’modelling; mechs:[constraint_reasoning,cross_topic_synthesis]
2026-04-22T15:50:24Z	0.805622	0.803683	-0.001939	discard	mutate [26] skill:FUNC_TRANSFORMâ†’FUNC_QUADRATIC; arch:spatial_coordinate_bridgeâ†’constraint_optimization_chain; style:applied_real_worldâ†’modelling; mechs:[constraint_reasoning,cross_topic_synthesis,hence_chains]
2026-04-22T16:47:23Z	0.805622	0.803602	-0.002020	discard	mutate [26] skill:FUNC_TRANSFORMâ†’FUNC_QUADRATIC; arch:spatial_coordinate_bridgeâ†’reverse_engineering; style:applied_real_worldâ†’modelling; mechs:[constraint_reasoning,cross_topic_synthesis,proof_unfamiliar_context]
2026-04-22T17:46:08Z	0.805622	0.803580	-0.002042	discard	mutate [26] skill:FUNC_TRANSFORMâ†’FUNC_QUADRATIC; arch:spatial_coordinate_bridgeâ†’constraint_optimization_chain; style:applied_real_worldâ†’modelling; mechs:[constraint_reasoning,cross_topic_synthesis,hence_chains]
2026-04-22T18:49:40Z	0.805622	0.803141	-0.002481	discard	mutate [26] skill:FUNC_TRANSFORMâ†’FUNC_RATIONAL; arch:spatial_coordinate_bridgeâ†’constraint_optimization_chain; style:applied_real_worldâ†’modelling; mechs:[constraint_reasoning,cross_topic_synthesis,hence_chains]
2026-04-22T19:56:39Z	0.000000	0.000000	+0.000000	crash	error: Missing required field: question
2026-04-22T20:55:33Z	0.805622	0.803763	-0.001859	discard	mutate [26] skill:FUNC_TRANSFORMâ†’FUNC_QUADRATIC; arch:spatial_coordinate_bridgeâ†’constraint_optimization_chain; style:applied_real_worldâ†’modelling; mechs:[constraint_reasoning,cross_topic_synthesis,hence_chains]
2026-04-22T21:49:46Z	0.805622	0.803020	-0.002602	discard	mutate [26] skill:FUNC_TRANSFORMâ†’FUNC_RATIONAL; arch:spatial_coordinate_bridgeâ†’constraint_optimization_chain; style:applied_real_worldâ†’modelling; mechs:[cross_topic_synthesis,constraint_reasoning]
2026-04-22T22:35:49Z	0.805622	0.803782	-0.001840	discard	mutate [26] skill:FUNC_TRANSFORMâ†’FUNC_QUADRATIC; arch:spatial_coordinate_bridgeâ†’constraint_optimization_chain; style:applied_real_worldâ†’modelling; mechs:[constraint_reasoning,cross_topic_synthesis,hence_chains]
2026-04-22T23:31:08Z	0.805622	0.802908	-0.002714	discard	mutate [26] skill:FUNC_TRANSFORMâ†’FUNC_QUADRATIC; arch:spatial_coordinate_bridgeâ†’constraint_optimization_chain; style:applied_real_worldâ†’modelling; mechs:[constraint_reasoning,cross_topic_synthesis,hence_chains]
2026-04-23T01:10:48Z	0.805622	0.803789	-0.001833	discard	mutate [26] skill:FUNC_TRANSFORMâ†’FUNC_QUADRATIC; arch:spatial_coordinate_bridgeâ†’constraint_optimization_chain; style:applied_real_worldâ†’modelling; mechs:[constraint_reasoning,cross_topic_synthesis,hence_chains]
2026-04-23T04:22:23Z	0.805622	0.803032	-0.002590	discard	mutate [26] skill:FUNC_TRANSFORMâ†’FUNC_QUADRATIC; arch:spatial_coordinate_bridgeâ†’constraint_optimization_chain; style:applied_real_worldâ†’modelling; mechs:[constraint_reasoning,cross_topic_synthesis,hence_chains]
2026-04-23T06:23:47Z	0.805622	0.802926	-0.002696	discard	mutate [26] skill:FUNC_TRANSFORMâ†’FUNC_RATIONAL; arch:spatial_coordinate_bridgeâ†’constraint_optimization_chain; style:applied_real_worldâ†’modelling; mechs:[constraint_reasoning,hence_chains,proof_unfamiliar_context,cross_topic_synthesis]
2026-04-23T08:19:01Z	0.805622	0.802698	-0.002924	discard	mutate [26] skill:FUNC_TRANSFORMâ†’FUNC_QUADRATIC; arch:spatial_coordinate_bridgeâ†’constraint_optimization_chain; style:applied_real_worldâ†’modelling; mechs:[constraint_reasoning,cross_topic_synthesis,hence_chains]
2026-04-23T10:00:41Z	0.805622	0.803009	-0.002613	discard	mutate [26] skill:FUNC_TRANSFORMâ†’FUNC_QUADRATIC; arch:spatial_coordinate_bridgeâ†’constraint_optimization_chain; style:applied_real_worldâ†’modelling; mechs:[constraint_reasoning,cross_topic_synthesis,hidden_structure]
2026-04-23T11:17:35Z	0.805622	0.802999	-0.002623	discard	mutate [26] skill:FUNC_TRANSFORMâ†’FUNC_RATIONAL; arch:spatial_coordinate_bridgeâ†’constraint_optimization_chain; style:applied_real_worldâ†’modelling; mechs:[constraint_reasoning,hence_chains,cross_topic_synthesis]
2026-04-23T12:11:47Z	0.805622	0.803896	-0.001726	discard	mutate [26] skill:FUNC_TRANSFORMâ†’FUNC_QUADRATIC; arch:spatial_coordinate_bridgeâ†’constraint_optimization_chain; style:applied_real_worldâ†’modelling; mechs:[constraint_reasoning,cross_topic_synthesis,hence_chains]
2026-04-23T14:15:07Z	0.805622	0.803376	-0.002246	discard	mutate [26] skill:FUNC_TRANSFORMâ†’FUNC_QUADRATIC; arch:spatial_coordinate_bridgeâ†’constraint_optimization_chain; mechs:[constraint_reasoning,cross_topic_synthesis]
2026-04-23T16:12:15Z	0.805622	0.803302	-0.002320	discard	mutate [26] skill:FUNC_TRANSFORMâ†’FUNC_QUADRATIC; arch:spatial_coordinate_bridgeâ†’constraint_optimization_chain; mechs:[constraint_reasoning,cross_topic_synthesis,hence_chains]
2026-04-23T17:49:31Z	0.805622	0.802330	-0.003292	discard	mutate [26] skill:FUNC_TRANSFORMâ†’FUNC_QUADRATIC; arch:spatial_coordinate_bridgeâ†’constraint_optimization_chain; style:applied_real_worldâ†’modelling; mechs:[constraint_reasoning,cross_topic_synthesis,hence_chains]
2026-04-23T18:49:47Z	0.805622	0.804274	-0.001348	discard	mutate [26] skill:FUNC_TRANSFORMâ†’FUNC_RATIONAL; arch:spatial_coordinate_bridgeâ†’constraint_optimization_chain; style:applied_real_worldâ†’modelling; mechs:[constraint_reasoning,cross_topic_synthesis,hence_chains]
2026-04-23T19:59:05Z	0.805622	0.803767	-0.001855	discard	mutate [26] skill:FUNC_TRANSFORMâ†’FUNC_QUADRATIC; arch:spatial_coordinate_bridgeâ†’constraint_optimization_chain; style:applied_real_worldâ†’modelling; mechs:[cross_topic_synthesis,constraint_reasoning,hence_chains]
2026-04-23T20:57:56Z	0.805622	0.803643	-0.001979	discard	mutate [26] skill:FUNC_TRANSFORMâ†’FUNC_QUADRATIC; arch:spatial_coordinate_bridgeâ†’constraint_optimization_chain; style:applied_real_worldâ†’modelling; mechs:[constraint_reasoning,cross_topic_synthesis,hence_chains]
2026-04-23T21:48:27Z	0.805622	0.802805	-0.002817	discard	mutate [26] skill:FUNC_TRANSFORMâ†’FUNC_QUADRATIC; arch:spatial_coordinate_bridgeâ†’constraint_optimization_chain; style:applied_real_worldâ†’modelling; mechs:[constraint_reasoning,cross_topic_synthesis,hence_chains]
2026-04-23T22:30:54Z	0.805622	0.802688	-0.002934	discard	mutate [26] skill:FUNC_TRANSFORMâ†’FUNC_QUADRATIC; arch:spatial_coordinate_bridgeâ†’constraint_optimization_chain; style:applied_real_worldâ†’modelling; mechs:[constraint_reasoning,cross_topic_synthesis,hence_chains]
2026-04-23T23:28:10Z	0.805622	0.803327	-0.002295	discard	mutate [26] skill:FUNC_TRANSFORMâ†’FUNC_QUADRATIC; arch:spatial_coordinate_bridgeâ†’constraint_optimization_chain; mechs:[constraint_reasoning,cross_topic_synthesis,hence_chains]
