timestamp	old_score	new_score	delta	status	description
2026-03-20T05:42:25Z	0.000000	0.000000	+0.000000	crash	error: Missing required field: question
2026-03-20T06:38:15Z	0.803027	0.801242	-0.001785	discard	mutate [7] skill:FUNC_MODULUSâ†’FUNC_QUADRATIC; arch:spatial_coordinate_bridgeâ†’constraint_optimization_chain; style:applied_real_worldâ†’modelling; mechs:[constraint_reasoning,hence_chains,proof_unfamiliar_context]
2026-03-20T07:34:23Z	0.803027	0.801251	-0.001776	discard	mutate [7] skill:FUNC_MODULUSâ†’FUNC_TRANSFORM; arch:spatial_coordinate_bridgeâ†’reverse_engineering; style:applied_real_worldâ†’modelling; mechs:[hidden_structure,proof_unfamiliar_context,constraint_reasoning]
2026-03-20T08:07:03Z	0.803027	0.801453	-0.001574	discard	mutate [7] skill:FUNC_MODULUSâ†’FUNC_QUADRATIC; arch:spatial_coordinate_bridgeâ†’constraint_optimization_chain; style:applied_real_worldâ†’modelling; mechs:[constraint_reasoning,hence_chains,proof_unfamiliar_context]
2026-03-20T08:58:11Z	0.803027	0.804977	+0.001950	keep	mutate [7] skill:FUNC_MODULUSâ†’FUNC_TRANSFORM; arch:spatial_coordinate_bridgeâ†’generalization_from_special_case; style:applied_real_worldâ†’modelling; mechs:[proof_unfamiliar_context,hidden_structure,transfer_generalization]
2026-03-20T09:46:09Z	0.804977	0.800652	-0.004325	discard	mutate [7] skill:FUNC_TRANSFORMâ†’FUNC_QUADRATIC; arch:generalization_from_special_caseâ†’constraint_optimization_chain; style:modellingâ†’applied_real_world; mechs:[constraint_reasoning,hence_chains,cross_topic_synthesis]
2026-03-20T10:24:45Z	0.804977	0.801316	-0.003661	discard	mutate [7] skill:FUNC_TRANSFORMâ†’FUNC_QUADRATIC; arch:generalization_from_special_caseâ†’constraint_optimization_chain; style:modellingâ†’applied_real_world; mechs:[constraint_reasoning,cross_topic_synthesis,hence_chains]
2026-03-20T11:04:38Z	0.804977	0.801214	-0.003763	discard	mutate [7] skill:FUNC_TRANSFORMâ†’FUNC_QUADRATIC; arch:generalization_from_special_caseâ†’constraint_optimization_chain; style:modellingâ†’applied_real_world; mechs:[constraint_reasoning,cross_topic_synthesis,hence_chains]
2026-03-20T11:44:12Z	0.804977	0.800725	-0.004252	discard	mutate [7] skill:FUNC_TRANSFORMâ†’FUNC_QUADRATIC; arch:generalization_from_special_caseâ†’constraint_optimization_chain; style:modellingâ†’applied_real_world; mechs:[constraint_reasoning,hence_chains,cross_topic_synthesis]
2026-03-20T12:04:26Z	0.804977	0.800531	-0.004446	discard	mutate [7] skill:FUNC_TRANSFORMâ†’FUNC_QUADRATIC; arch:generalization_from_special_caseâ†’constraint_optimization_chain; style:modellingâ†’applied_real_world; mechs:[constraint_reasoning,cross_topic_synthesis,hence_chains]
2026-03-20T13:23:41Z	0.804977	0.801066	-0.003911	discard	mutate [7] skill:FUNC_TRANSFORMâ†’FUNC_QUADRATIC; arch:generalization_from_special_caseâ†’constraint_optimization_chain; style:modellingâ†’applied_real_world; mechs:[constraint_reasoning,hence_chains,cross_topic_synthesis]
2026-03-20T14:12:50Z	0.804977	0.800924	-0.004053	discard	mutate [7] skill:FUNC_TRANSFORMâ†’FUNC_RATIONAL; arch:generalization_from_special_caseâ†’constraint_optimization_chain; style:modellingâ†’applied_real_world; mechs:[constraint_reasoning,hence_chains,cross_topic_synthesis]
2026-03-20T15:09:22Z	0.804977	0.801288	-0.003689	discard	mutate [7] skill:FUNC_TRANSFORMâ†’FUNC_QUADRATIC; arch:generalization_from_special_caseâ†’constraint_optimization_chain; style:modellingâ†’applied_real_world; mechs:[constraint_reasoning,cross_topic_synthesis,hence_chains]
2026-03-20T15:57:10Z	0.804977	0.801381	-0.003596	discard	mutate [7] skill:FUNC_TRANSFORMâ†’FUNC_QUADRATIC; arch:generalization_from_special_caseâ†’constraint_optimization_chain; style:modellingâ†’applied_real_world; mechs:[constraint_reasoning,cross_topic_synthesis,hence_chains]
2026-03-20T16:43:59Z	0.804977	0.800702	-0.004275	discard	mutate [7] skill:FUNC_TRANSFORMâ†’FUNC_QUADRATIC; arch:generalization_from_special_caseâ†’constraint_optimization_chain; style:modellingâ†’applied_real_world; mechs:[constraint_reasoning,cross_topic_synthesis,hence_chains]
2026-03-20T17:26:53Z	0.804977	0.801282	-0.003695	discard	mutate [7] skill:FUNC_TRANSFORMâ†’FUNC_QUADRATIC; arch:generalization_from_special_caseâ†’constraint_optimization_chain; style:modellingâ†’applied_real_world; mechs:[constraint_reasoning,hence_chains]
2026-03-20T18:01:24Z	0.804977	0.800635	-0.004342	discard	mutate [7] skill:FUNC_TRANSFORMâ†’FUNC_QUADRATIC; arch:generalization_from_special_caseâ†’constraint_optimization_chain; style:modellingâ†’applied_real_world; mechs:[constraint_reasoning,cross_topic_synthesis,hence_chains]
2026-03-20T19:03:42Z	0.804977	0.800432	-0.004545	discard	mutate [7] skill:FUNC_TRANSFORMâ†’FUNC_QUADRATIC; arch:generalization_from_special_caseâ†’constraint_optimization_chain; style:modellingâ†’applied_real_world; mechs:[constraint_reasoning,cross_topic_synthesis,hence_chains]
2026-03-20T19:47:41Z	0.804977	0.800114	-0.004863	discard	mutate [7] skill:FUNC_TRANSFORMâ†’FUNC_QUADRATIC; arch:generalization_from_special_caseâ†’constraint_optimization_chain; style:modellingâ†’applied_real_world; mechs:[constraint_reasoning,cross_topic_synthesis,hence_chains]
2026-03-20T20:17:30Z	0.804977	0.800837	-0.004140	discard	mutate [7] skill:FUNC_TRANSFORMâ†’FUNC_QUADRATIC; arch:generalization_from_special_caseâ†’constraint_optimization_chain; style:modellingâ†’applied_real_world; mechs:[constraint_reasoning,cross_topic_synthesis,hence_chains]
2026-03-20T20:53:09Z	0.804977	0.801256	-0.003721	discard	mutate [7] skill:FUNC_TRANSFORMâ†’FUNC_QUADRATIC; arch:generalization_from_special_caseâ†’constraint_optimization_chain; style:modellingâ†’applied_real_world; mechs:[constraint_reasoning,cross_topic_synthesis]
2026-03-20T21:28:56Z	0.804977	0.800987	-0.003990	discard	mutate [7] skill:FUNC_TRANSFORMâ†’FUNC_RATIONAL; arch:generalization_from_special_caseâ†’constraint_optimization_chain; style:modellingâ†’applied_real_world; mechs:[constraint_reasoning,hence_chains,cross_topic_synthesis]
2026-03-20T21:55:13Z	0.804977	0.800667	-0.004310	discard	mutate [7] skill:FUNC_TRANSFORMâ†’FUNC_QUADRATIC; arch:generalization_from_special_caseâ†’constraint_optimization_chain; style:modellingâ†’applied_real_world; mechs:[constraint_reasoning,cross_topic_synthesis,hence_chains]
2026-03-20T22:27:29Z	0.000000	0.000000	+0.000000	crash	error: Missing required field: question
2026-03-20T22:57:15Z	0.804977	0.801439	-0.003538	discard	mutate [7] skill:FUNC_TRANSFORMâ†’FUNC_QUADRATIC; arch:generalization_from_special_caseâ†’constraint_optimization_chain; style:modellingâ†’applied_real_world; mechs:[constraint_reasoning,hence_chains,cross_topic_synthesis]
2026-03-20T23:29:26Z	0.804977	0.801493	-0.003484	discard	mutate [7] skill:FUNC_TRANSFORMâ†’FUNC_QUADRATIC; arch:generalization_from_special_caseâ†’constraint_optimization_chain; style:modellingâ†’applied_real_world; mechs:[constraint_reasoning,cross_topic_synthesis,hence_chains]
2026-03-20T23:53:57Z	0.804977	0.800076	-0.004901	discard	mutate [7] skill:FUNC_TRANSFORMâ†’FUNC_QUADRATIC; arch:generalization_from_special_caseâ†’constraint_optimization_chain; style:modellingâ†’applied_real_world; mechs:[constraint_reasoning,cross_topic_synthesis]
2026-03-21T01:50:35Z	0.804977	0.800620	-0.004357	discard	mutate [7] skill:FUNC_TRANSFORMâ†’FUNC_QUADRATIC; arch:generalization_from_special_caseâ†’constraint_optimization_chain; style:modellingâ†’applied_real_world; mechs:[constraint_reasoning,hence_chains,cross_topic_synthesis]
2026-03-21T03:53:38Z	0.804977	0.800664	-0.004313	discard	mutate [7] skill:FUNC_TRANSFORMâ†’FUNC_QUADRATIC; arch:generalization_from_special_caseâ†’constraint_optimization_chain; style:modellingâ†’applied_real_world; mechs:[constraint_reasoning,hence_chains,cross_topic_synthesis]
2026-03-21T05:06:30Z	0.804977	0.800441	-0.004536	discard	mutate [7] skill:FUNC_TRANSFORMâ†’FUNC_QUADRATIC; arch:generalization_from_special_caseâ†’constraint_optimization_chain; style:modellingâ†’applied_real_world; mechs:[constraint_reasoning,cross_topic_synthesis,hence_chains]
2026-03-21T05:54:47Z	0.804977	0.800629	-0.004348	discard	mutate [7] skill:FUNC_TRANSFORMâ†’FUNC_QUADRATIC; arch:generalization_from_special_caseâ†’constraint_optimization_chain; style:modellingâ†’applied_real_world; mechs:[cross_topic_synthesis,constraint_reasoning,hence_chains]
2026-03-21T06:40:30Z	0.804977	0.800609	-0.004368	discard	mutate [7] skill:FUNC_TRANSFORMâ†’FUNC_QUADRATIC; arch:generalization_from_special_caseâ†’constraint_optimization_chain; style:modellingâ†’applied_real_world; mechs:[constraint_reasoning,cross_topic_synthesis,hence_chains]
2026-03-21T07:22:55Z	0.804977	0.800937	-0.004040	discard	mutate [7] skill:FUNC_TRANSFORMâ†’FUNC_QUADRATIC; arch:generalization_from_special_caseâ†’constraint_optimization_chain; style:modellingâ†’applied_real_world; mechs:[constraint_reasoning,cross_topic_synthesis]
2026-03-21T07:52:22Z	0.804977	0.800703	-0.004274	discard	mutate [7] skill:FUNC_TRANSFORMâ†’FUNC_QUADRATIC; arch:generalization_from_special_caseâ†’constraint_optimization_chain; style:modellingâ†’applied_real_world; mechs:[constraint_reasoning,cross_topic_synthesis,hence_chains]
2026-03-21T08:31:54Z	0.804977	0.800654	-0.004323	discard	mutate [7] skill:FUNC_TRANSFORMâ†’FUNC_QUADRATIC; arch:generalization_from_special_caseâ†’constraint_optimization_chain; style:modellingâ†’applied_real_world; mechs:[constraint_reasoning,hence_chains,cross_topic_synthesis]
2026-03-21T09:01:17Z	0.804977	0.800080	-0.004897	discard	mutate [7] skill:FUNC_TRANSFORMâ†’FUNC_RATIONAL; arch:generalization_from_special_caseâ†’constraint_optimization_chain; style:modellingâ†’applied_real_world; mechs:[cross_topic_synthesis,hidden_structure,hence_chains,constraint_reasoning]
2026-03-21T09:42:11Z	0.804977	0.800669	-0.004308	discard	mutate [7] skill:FUNC_TRANSFORMâ†’FUNC_QUADRATIC; arch:generalization_from_special_caseâ†’constraint_optimization_chain; style:modellingâ†’applied_real_world; mechs:[constraint_reasoning,cross_topic_synthesis,hidden_structure,hence_chains]
2026-03-21T10:01:44Z	0.804977	0.800728	-0.004249	discard	mutate [7] skill:FUNC_TRANSFORMâ†’FUNC_RATIONAL; arch:generalization_from_special_caseâ†’constraint_optimization_chain; style:modellingâ†’applied_real_world; mechs:[constraint_reasoning,hence_chains,cross_topic_synthesis]
2026-03-21T10:44:05Z	0.804977	0.800141	-0.004836	discard	mutate [7] skill:FUNC_TRANSFORMâ†’FUNC_RATIONAL; arch:generalization_from_special_caseâ†’constraint_optimization_chain; style:modellingâ†’applied_real_world; mechs:[constraint_reasoning,cross_topic_synthesis,hence_chains,hidden_structure]
2026-03-21T11:03:00Z	0.804977	0.801029	-0.003948	discard	mutate [7] skill:FUNC_TRANSFORMâ†’FUNC_QUADRATIC; arch:generalization_from_special_caseâ†’constraint_optimization_chain; style:modellingâ†’applied_real_world; mechs:[constraint_reasoning,hence_chains,cross_topic_synthesis]
2026-03-21T11:35:16Z	0.804977	0.801260	-0.003717	discard	mutate [7] skill:FUNC_TRANSFORMâ†’FUNC_QUADRATIC; arch:generalization_from_special_caseâ†’constraint_optimization_chain; style:modellingâ†’applied_real_world; mechs:[constraint_reasoning,hence_chains,hidden_structure]
2026-03-21T11:53:46Z	0.804977	0.800819	-0.004158	discard	mutate [7] skill:FUNC_TRANSFORMâ†’FUNC_QUADRATIC; arch:generalization_from_special_caseâ†’constraint_optimization_chain; style:modellingâ†’applied_real_world; mechs:[constraint_reasoning,hence_chains,cross_topic_synthesis]
2026-03-21T12:43:51Z	0.804977	0.801404	-0.003573	discard	mutate [7] skill:FUNC_TRANSFORMâ†’FUNC_QUADRATIC; arch:generalization_from_special_caseâ†’constraint_optimization_chain; style:modellingâ†’applied_real_world; mechs:[constraint_reasoning,cross_topic_synthesis]
2026-03-21T13:34:06Z	0.804977	0.800581	-0.004396	discard	mutate [7] skill:FUNC_TRANSFORMâ†’FUNC_QUADRATIC; arch:generalization_from_special_caseâ†’constraint_optimization_chain; style:modellingâ†’applied_real_world; mechs:[constraint_reasoning,hence_chains,cross_topic_synthesis]
2026-03-21T14:02:45Z	0.804977	0.800692	-0.004285	discard	mutate [7] skill:FUNC_TRANSFORMâ†’FUNC_QUADRATIC; arch:generalization_from_special_caseâ†’constraint_optimization_chain; style:modellingâ†’applied_real_world; mechs:[constraint_reasoning,hence_chains,cross_topic_synthesis,hidden_structure]
2026-03-21T14:42:29Z	0.804977	0.800738	-0.004239	discard	mutate [7] skill:FUNC_TRANSFORMâ†’FUNC_QUADRATIC; arch:generalization_from_special_caseâ†’constraint_optimization_chain; style:modellingâ†’applied_real_world; mechs:[constraint_reasoning,cross_topic_synthesis,hence_chains]
2026-03-21T15:03:11Z	0.804977	0.800606	-0.004371	discard	mutate [7] skill:FUNC_TRANSFORMâ†’FUNC_QUADRATIC; arch:generalization_from_special_caseâ†’constraint_optimization_chain; style:modellingâ†’applied_real_world; mechs:[constraint_reasoning,hence_chains,cross_topic_synthesis]
2026-03-21T15:39:19Z	0.804977	0.800784	-0.004193	discard	mutate [7] skill:FUNC_TRANSFORMâ†’FUNC_QUADRATIC; arch:generalization_from_special_caseâ†’constraint_optimization_chain; style:modellingâ†’applied_real_world; mechs:[constraint_reasoning,cross_topic_synthesis,hence_chains]
2026-03-21T15:56:31Z	0.804977	0.801525	-0.003452	discard	mutate [7] skill:FUNC_TRANSFORMâ†’FUNC_QUADRATIC; arch:generalization_from_special_caseâ†’constraint_optimization_chain; style:modellingâ†’applied_real_world; mechs:[constraint_reasoning,hence_chains,cross_topic_synthesis]
2026-03-21T16:28:05Z	0.804977	0.801423	-0.003554	discard	mutate [7] skill:FUNC_TRANSFORMâ†’FUNC_QUADRATIC; arch:generalization_from_special_caseâ†’constraint_optimization_chain; style:modellingâ†’applied_real_world; mechs:[constraint_reasoning,hence_chains,cross_topic_synthesis]
2026-03-21T16:56:24Z	0.804977	0.802047	-0.002930	discard	mutate [7] skill:FUNC_TRANSFORMâ†’FUNC_QUADRATIC; arch:generalization_from_special_caseâ†’constraint_optimization_chain; style:modellingâ†’applied_real_world; mechs:[constraint_reasoning,hence_chains,cross_topic_synthesis]
2026-03-21T17:24:50Z	0.804977	0.800546	-0.004431	discard	mutate [7] skill:FUNC_TRANSFORMâ†’FUNC_QUADRATIC; arch:generalization_from_special_caseâ†’constraint_optimization_chain; style:modellingâ†’applied_real_world; mechs:[constraint_reasoning,hence_chains,cross_topic_synthesis]
2026-03-21T17:51:44Z	0.000000	0.000000	+0.000000	crash	error: Missing required field: question
2026-03-21T18:33:55Z	0.804977	0.800621	-0.004356	discard	mutate [7] skill:FUNC_TRANSFORMâ†’FUNC_QUADRATIC; arch:generalization_from_special_caseâ†’constraint_optimization_chain; style:modellingâ†’applied_real_world; mechs:[constraint_reasoning,hence_chains,cross_topic_synthesis]
2026-03-21T19:04:21Z	0.804977	0.800106	-0.004871	discard	mutate [7] skill:FUNC_TRANSFORMâ†’FUNC_QUADRATIC; arch:generalization_from_special_caseâ†’constraint_optimization_chain; style:modellingâ†’applied_real_world; mechs:[constraint_reasoning,cross_topic_synthesis,hence_chains]
2026-03-21T19:35:52Z	0.804977	0.800179	-0.004798	discard	mutate [7] skill:FUNC_TRANSFORMâ†’FUNC_RATIONAL; arch:generalization_from_special_caseâ†’constraint_optimization_chain; style:modellingâ†’applied_real_world; mechs:[constraint_reasoning,cross_topic_synthesis,hence_chains]
2026-03-21T19:53:00Z	0.804977	0.800415	-0.004562	discard	mutate [7] skill:FUNC_TRANSFORMâ†’FUNC_QUADRATIC; arch:generalization_from_special_caseâ†’constraint_optimization_chain; style:modellingâ†’applied_real_world; mechs:[constraint_reasoning,cross_topic_synthesis,hence_chains]
2026-03-21T20:24:53Z	0.804977	0.800264	-0.004713	discard	mutate [7] skill:FUNC_TRANSFORMâ†’FUNC_RATIONAL; arch:generalization_from_special_caseâ†’constraint_optimization_chain; style:modellingâ†’applied_real_world; mechs:[constraint_reasoning,cross_topic_synthesis,hence_chains]
2026-03-21T20:51:19Z	0.804977	0.801494	-0.003483	discard	mutate [7] skill:FUNC_TRANSFORMâ†’FUNC_QUADRATIC; arch:generalization_from_special_caseâ†’constraint_optimization_chain; style:modellingâ†’applied_real_world; mechs:[constraint_reasoning,hence_chains,cross_topic_synthesis]
2026-03-21T21:23:52Z	0.804977	0.800139	-0.004838	discard	mutate [7] skill:FUNC_TRANSFORMâ†’FUNC_QUADRATIC; arch:generalization_from_special_caseâ†’constraint_optimization_chain; style:modellingâ†’applied_real_world; mechs:[constraint_reasoning,hence_chains,cross_topic_synthesis,hidden_structure]
2026-03-21T21:48:51Z	0.804977	0.800205	-0.004772	discard	mutate [7] skill:FUNC_TRANSFORMâ†’FUNC_QUADRATIC; arch:generalization_from_special_caseâ†’constraint_optimization_chain; style:modellingâ†’applied_real_world; mechs:[constraint_reasoning,hence_chains,cross_topic_synthesis]
2026-03-21T22:01:09Z	0.804977	0.800981	-0.003996	discard	mutate [7] skill:FUNC_TRANSFORMâ†’FUNC_QUADRATIC; arch:generalization_from_special_caseâ†’constraint_optimization_chain; style:modellingâ†’applied_real_world; mechs:[constraint_reasoning,hence_chains,cross_topic_synthesis]
2026-03-21T22:36:25Z	0.804977	0.800679	-0.004298	discard	mutate [7] skill:FUNC_TRANSFORMâ†’FUNC_QUADRATIC; arch:generalization_from_special_caseâ†’constraint_optimization_chain; style:modellingâ†’applied_real_world; mechs:[constraint_reasoning,cross_topic_synthesis,hence_chains]
2026-03-21T22:57:26Z	0.804977	0.801154	-0.003823	discard	mutate [7] skill:FUNC_TRANSFORMâ†’FUNC_QUADRATIC; arch:generalization_from_special_caseâ†’constraint_optimization_chain; style:modellingâ†’applied_real_world; mechs:[constraint_reasoning,hence_chains,cross_topic_synthesis]
2026-03-21T23:27:02Z	0.804977	0.800570	-0.004407	discard	mutate [7] skill:FUNC_TRANSFORMâ†’FUNC_QUADRATIC; arch:generalization_from_special_caseâ†’constraint_optimization_chain; style:modellingâ†’applied_real_world; mechs:[constraint_reasoning,hence_chains,cross_topic_synthesis]
2026-03-21T23:49:40Z	0.804977	0.800773	-0.004204	discard	mutate [7] skill:FUNC_TRANSFORMâ†’FUNC_QUADRATIC; arch:generalization_from_special_caseâ†’constraint_optimization_chain; style:modellingâ†’applied_real_world; mechs:[cross_topic_synthesis,constraint_reasoning,hence_chains,hidden_structure]
2026-03-22T00:02:26Z	0.804977	0.800746	-0.004231	discard	mutate [7] skill:FUNC_TRANSFORMâ†’FUNC_QUADRATIC; arch:generalization_from_special_caseâ†’constraint_optimization_chain; style:modellingâ†’applied_real_world; mechs:[constraint_reasoning,hence_chains,cross_topic_synthesis]
2026-03-22T03:20:05Z	0.804977	0.800056	-0.004921	discard	mutate [7] skill:FUNC_TRANSFORMâ†’FUNC_RATIONAL; arch:generalization_from_special_caseâ†’constraint_optimization_chain; style:modellingâ†’applied_real_world; mechs:[constraint_reasoning,cross_topic_synthesis,hence_chains]
2026-03-22T05:05:28Z	0.804977	0.800674	-0.004303	discard	mutate [7] skill:FUNC_TRANSFORMâ†’FUNC_QUADRATIC; arch:generalization_from_special_caseâ†’constraint_optimization_chain; style:modellingâ†’applied_real_world; mechs:[constraint_reasoning,cross_topic_synthesis,hence_chains]
2026-03-22T06:04:49Z	0.804977	0.800623	-0.004354	discard	mutate [7] skill:FUNC_TRANSFORMâ†’FUNC_QUADRATIC; arch:generalization_from_special_caseâ†’constraint_optimization_chain; style:modellingâ†’applied_real_world; mechs:[constraint_reasoning,cross_topic_synthesis,hence_chains]
2026-03-22T07:06:28Z	0.804977	0.800711	-0.004266	discard	mutate [7] skill:FUNC_TRANSFORMâ†’FUNC_QUADRATIC; arch:generalization_from_special_caseâ†’constraint_optimization_chain; style:modellingâ†’applied_real_world; mechs:[constraint_reasoning,cross_topic_synthesis,hence_chains]
2026-03-22T07:48:23Z	0.804977	0.801293	-0.003684	discard	mutate [7] skill:FUNC_TRANSFORMâ†’FUNC_QUADRATIC; arch:generalization_from_special_caseâ†’constraint_optimization_chain; style:modellingâ†’applied_real_world; mechs:[constraint_reasoning,hence_chains,cross_topic_synthesis]
2026-03-22T08:03:53Z	0.804977	0.801367	-0.003610	discard	mutate [7] skill:FUNC_TRANSFORMâ†’FUNC_QUADRATIC; arch:generalization_from_special_caseâ†’constraint_optimization_chain; style:modellingâ†’applied_real_world; mechs:[constraint_reasoning,cross_topic_synthesis,hence_chains]
2026-03-22T08:52:06Z	0.804977	0.800586	-0.004391	discard	mutate [7] skill:FUNC_TRANSFORMâ†’FUNC_QUADRATIC; arch:generalization_from_special_caseâ†’constraint_optimization_chain; style:modellingâ†’applied_real_world; mechs:[constraint_reasoning,cross_topic_synthesis]
2026-03-22T09:31:08Z	0.804977	0.800529	-0.004448	discard	mutate [7] skill:FUNC_TRANSFORMâ†’FUNC_QUADRATIC; arch:generalization_from_special_caseâ†’constraint_optimization_chain; style:modellingâ†’applied_real_world; mechs:[constraint_reasoning,hence_chains,cross_topic_synthesis]
2026-03-22T09:58:24Z	0.804977	0.800069	-0.004908	discard	mutate [7] skill:FUNC_TRANSFORMâ†’FUNC_QUADRATIC; arch:generalization_from_special_caseâ†’constraint_optimization_chain; style:modellingâ†’applied_real_world; mechs:[constraint_reasoning,hence_chains,cross_topic_synthesis]
2026-03-22T10:31:25Z	0.804977	0.800234	-0.004743	discard	mutate [7] skill:FUNC_TRANSFORMâ†’FUNC_QUADRATIC; arch:generalization_from_special_caseâ†’constraint_optimization_chain; style:modellingâ†’applied_real_world; mechs:[constraint_reasoning,cross_topic_synthesis,hence_chains]
2026-03-22T10:58:52Z	0.804977	0.801395	-0.003582	discard	mutate [7] skill:FUNC_TRANSFORMâ†’FUNC_QUADRATIC; arch:generalization_from_special_caseâ†’constraint_optimization_chain; style:modellingâ†’applied_real_world; mechs:[constraint_reasoning,cross_topic_synthesis,hence_chains,hidden_structure]
2026-03-22T11:28:57Z	0.804977	0.800172	-0.004805	discard	mutate [7] skill:FUNC_TRANSFORMâ†’FUNC_RATIONAL; arch:generalization_from_special_caseâ†’constraint_optimization_chain; style:modellingâ†’applied_real_world; mechs:[constraint_reasoning,cross_topic_synthesis,hence_chains]
2026-03-22T11:48:53Z	0.804977	0.801477	-0.003500	discard	mutate [7] skill:FUNC_TRANSFORMâ†’FUNC_QUADRATIC; arch:generalization_from_special_caseâ†’constraint_optimization_chain; style:modellingâ†’applied_real_world; mechs:[constraint_reasoning,cross_topic_synthesis,hence_chains]
