timestamp	old_score	new_score	delta	status	description
2026-03-16T22:06:44Z	0.803027	0.800655	-0.002372	discard	mutate [7] skill:FUNC_MODULUSâ†’FUNC_QUADRATIC; arch:spatial_coordinate_bridgeâ†’constraint_optimization_chain; style:applied_real_worldâ†’modelling; mechs:[cross_topic_synthesis,constraint_reasoning,hence_chains,proof_unfamiliar_context]
2026-03-16T22:50:24Z	0.803027	0.800247	-0.002780	discard	mutate [7] skill:FUNC_MODULUSâ†’FUNC_RATIONAL; arch:spatial_coordinate_bridgeâ†’constraint_optimization_chain; style:applied_real_worldâ†’modelling; mechs:[cross_topic_synthesis,constraint_reasoning,proof_unfamiliar_context]
2026-03-16T23:19:41Z	0.803027	0.801398	-0.001629	discard	mutate [7] skill:FUNC_MODULUSâ†’FUNC_TRANSFORM; arch:spatial_coordinate_bridgeâ†’reverse_engineering; style:applied_real_worldâ†’modelling; mechs:[cross_topic_synthesis,hidden_structure,proof_unfamiliar_context]
2026-03-16T23:49:07Z	0.803027	0.800282	-0.002745	discard	mutate [7] skill:FUNC_MODULUSâ†’FUNC_RATIONAL; arch:spatial_coordinate_bridgeâ†’constraint_optimization_chain; style:applied_real_worldâ†’modelling; mechs:[constraint_reasoning,cross_topic_synthesis,proof_unfamiliar_context]
2026-03-17T00:04:26Z	0.803027	0.800373	-0.002654	discard	mutate [7] skill:FUNC_MODULUSâ†’FUNC_RATIONAL; arch:spatial_coordinate_bridgeâ†’constraint_optimization_chain; style:applied_real_worldâ†’modelling; mechs:[constraint_reasoning,proof_unfamiliar_context,cross_topic_synthesis]
2026-03-17T02:54:33Z	0.803027	0.800170	-0.002857	discard	mutate [7] skill:FUNC_MODULUSâ†’FUNC_RATIONAL; arch:spatial_coordinate_bridgeâ†’constraint_optimization_chain; style:applied_real_worldâ†’modelling; mechs:[cross_topic_synthesis,constraint_reasoning,hence_chains,proof_unfamiliar_context]
2026-03-17T04:50:57Z	0.803027	0.801342	-0.001685	discard	mutate [7] skill:FUNC_MODULUSâ†’FUNC_RATIONAL; arch:spatial_coordinate_bridgeâ†’constraint_optimization_chain; style:applied_real_worldâ†’modelling; mechs:[cross_topic_synthesis,constraint_reasoning,proof_unfamiliar_context]
2026-03-17T05:49:54Z	0.803027	0.800680	-0.002347	discard	mutate [7] skill:FUNC_MODULUSâ†’FUNC_QUADRATIC; arch:spatial_coordinate_bridgeâ†’constraint_optimization_chain; style:applied_real_worldâ†’modelling; mechs:[constraint_reasoning,hence_chains,cross_topic_synthesis]
2026-03-17T06:47:38Z	0.803027	0.800164	-0.002863	discard	mutate [7] skill:FUNC_MODULUSâ†’FUNC_RATIONAL; arch:spatial_coordinate_bridgeâ†’constraint_optimization_chain; style:applied_real_worldâ†’modelling; mechs:[cross_topic_synthesis,constraint_reasoning,hence_chains,proof_unfamiliar_context]
2026-03-17T07:45:27Z	0.803027	0.802573	-0.000454	discard	mutate [7] skill:FUNC_MODULUSâ†’FUNC_SUM_PRODUCT_ROOTS; arch:spatial_coordinate_bridgeâ†’reverse_engineering; style:applied_real_worldâ†’modelling; mechs:[cross_topic_synthesis,hidden_structure,proof_unfamiliar_context]
2026-03-17T08:36:19Z	0.803027	0.800115	-0.002912	discard	mutate [7] skill:FUNC_MODULUSâ†’FUNC_RATIONAL; arch:spatial_coordinate_bridgeâ†’constraint_optimization_chain; style:applied_real_worldâ†’modelling; mechs:[constraint_reasoning,proof_unfamiliar_context,cross_topic_synthesis,hidden_structure]
2026-03-17T09:36:42Z	0.803027	0.800851	-0.002176	discard	mutate [7] skill:FUNC_MODULUSâ†’FUNC_QUADRATIC; arch:spatial_coordinate_bridgeâ†’constraint_optimization_chain; style:applied_real_worldâ†’modelling; mechs:[constraint_reasoning,proof_unfamiliar_context,hence_chains]
2026-03-17T10:32:42Z	0.803027	0.800037	-0.002990	discard	mutate [7] skill:FUNC_MODULUSâ†’FUNC_RATIONAL; arch:spatial_coordinate_bridgeâ†’constraint_optimization_chain; style:applied_real_worldâ†’modelling; mechs:[cross_topic_synthesis,constraint_reasoning,hence_chains]
2026-03-17T11:28:52Z	0.803027	0.802522	-0.000505	discard	mutate [7] skill:FUNC_MODULUSâ†’FUNC_SUM_PRODUCT_ROOTS; arch:spatial_coordinate_bridgeâ†’reverse_engineering; style:applied_real_worldâ†’modelling; mechs:[cross_topic_synthesis,hidden_structure,proof_unfamiliar_context]
2026-03-17T12:05:16Z	0.803027	0.800157	-0.002870	discard	mutate [7] skill:FUNC_MODULUSâ†’FUNC_RATIONAL; arch:spatial_coordinate_bridgeâ†’constraint_optimization_chain; style:applied_real_worldâ†’modelling; mechs:[cross_topic_synthesis,constraint_reasoning,proof_unfamiliar_context]
2026-03-17T13:49:40Z	0.803027	0.802502	-0.000525	discard	mutate [7] skill:FUNC_MODULUSâ†’FUNC_SUM_PRODUCT_ROOTS; arch:spatial_coordinate_bridgeâ†’representation_bridge; style:applied_real_worldâ†’modelling; mechs:[cross_topic_synthesis,hidden_structure,proof_unfamiliar_context]
2026-03-17T14:47:11Z	0.803027	0.800683	-0.002344	discard	mutate [7] skill:FUNC_MODULUSâ†’FUNC_RATIONAL; arch:spatial_coordinate_bridgeâ†’constraint_optimization_chain; style:applied_real_worldâ†’modelling; mechs:[constraint_reasoning,hence_chains,proof_unfamiliar_context]
2026-03-17T15:49:04Z	0.803027	0.800724	-0.002303	discard	mutate [7] skill:FUNC_MODULUSâ†’FUNC_QUADRATIC; arch:spatial_coordinate_bridgeâ†’constraint_optimization_chain; style:applied_real_worldâ†’modelling; mechs:[constraint_reasoning,proof_unfamiliar_context,hence_chains]
2026-03-17T16:49:41Z	0.803027	0.801275	-0.001752	discard	mutate [7] skill:FUNC_MODULUSâ†’FUNC_QUADRATIC; arch:spatial_coordinate_bridgeâ†’constraint_optimization_chain; style:applied_real_worldâ†’modelling; mechs:[constraint_reasoning,hence_chains,proof_unfamiliar_context]
2026-03-17T17:48:11Z	0.803027	0.800253	-0.002774	discard	mutate [7] skill:FUNC_MODULUSâ†’FUNC_RATIONAL; arch:spatial_coordinate_bridgeâ†’constraint_optimization_chain; style:applied_real_worldâ†’modelling; mechs:[constraint_reasoning,cross_topic_synthesis,proof_unfamiliar_context]
2026-03-17T18:41:41Z	0.803027	0.800339	-0.002688	discard	mutate [7] skill:FUNC_MODULUSâ†’FUNC_RATIONAL; arch:spatial_coordinate_bridgeâ†’constraint_optimization_chain; style:applied_real_worldâ†’modelling; mechs:[constraint_reasoning,proof_unfamiliar_context,cross_topic_synthesis]
2026-03-17T19:43:17Z	0.803027	0.802421	-0.000606	discard	mutate [7] skill:FUNC_MODULUSâ†’FUNC_SUM_PRODUCT_ROOTS; arch:spatial_coordinate_bridgeâ†’reverse_engineering; style:applied_real_worldâ†’modelling; mechs:[hidden_structure,proof_unfamiliar_context]
2026-03-17T20:24:51Z	0.803027	0.800565	-0.002462	discard	mutate [7] skill:FUNC_MODULUSâ†’FUNC_RATIONAL; arch:spatial_coordinate_bridgeâ†’constraint_optimization_chain; style:applied_real_worldâ†’modelling; mechs:[cross_topic_synthesis,constraint_reasoning,proof_unfamiliar_context]
2026-03-17T21:05:46Z	0.803027	0.800088	-0.002939	discard	mutate [7] skill:FUNC_MODULUSâ†’FUNC_RATIONAL; arch:spatial_coordinate_bridgeâ†’representation_bridge; style:applied_real_worldâ†’modelling; mechs:[multi_representation,hidden_structure,proof_unfamiliar_context]
2026-03-17T21:53:29Z	0.803027	0.800649	-0.002378	discard	mutate [7] skill:FUNC_MODULUSâ†’FUNC_QUADRATIC; arch:spatial_coordinate_bridgeâ†’constraint_optimization_chain; style:applied_real_worldâ†’modelling; mechs:[constraint_reasoning,proof_unfamiliar_context,hence_chains,cross_topic_synthesis]
2026-03-17T22:32:31Z	0.803027	0.800687	-0.002340	discard	mutate [7] skill:FUNC_MODULUSâ†’FUNC_QUADRATIC; arch:spatial_coordinate_bridgeâ†’constraint_optimization_chain; style:applied_real_worldâ†’modelling; mechs:[cross_topic_synthesis,constraint_reasoning,hence_chains,proof_unfamiliar_context]
2026-03-17T23:05:52Z	0.803027	0.801700	-0.001327	discard	mutate [7] skill:FUNC_MODULUSâ†’FUNC_TRANSFORM; arch:spatial_coordinate_bridgeâ†’reverse_engineering; style:applied_real_worldâ†’modelling; mechs:[cross_topic_synthesis,hidden_structure,proof_unfamiliar_context]
2026-03-17T23:46:36Z	0.803027	0.801462	-0.001565	discard	mutate [7] skill:FUNC_MODULUSâ†’FUNC_QUADRATIC; arch:spatial_coordinate_bridgeâ†’constraint_optimization_chain; style:applied_real_worldâ†’modelling; mechs:[constraint_reasoning,proof_unfamiliar_context,cross_topic_synthesis]
2026-03-18T00:59:19Z	0.803027	0.800588	-0.002439	discard	mutate [7] skill:FUNC_MODULUSâ†’FUNC_RATIONAL; arch:spatial_coordinate_bridgeâ†’constraint_optimization_chain; style:applied_real_worldâ†’modelling; mechs:[cross_topic_synthesis,proof_unfamiliar_context,constraint_reasoning]
2026-03-18T03:44:07Z	0.803027	0.800165	-0.002862	discard	mutate [7] skill:FUNC_MODULUSâ†’FUNC_QUADRATIC; arch:spatial_coordinate_bridgeâ†’constraint_optimization_chain; style:applied_real_worldâ†’modelling; mechs:[constraint_reasoning,proof_unfamiliar_context,cross_topic_synthesis]
2026-03-18T05:20:10Z	0.803027	0.802558	-0.000469	discard	mutate [7] skill:FUNC_MODULUSâ†’FUNC_SUM_PRODUCT_ROOTS; arch:spatial_coordinate_bridgeâ†’reverse_engineering; style:applied_real_worldâ†’modelling; mechs:[cross_topic_synthesis,hidden_structure,proof_unfamiliar_context]
2026-03-18T06:36:51Z	0.803027	0.801308	-0.001719	discard	mutate [7] skill:FUNC_MODULUSâ†’FUNC_TRANSFORM; arch:spatial_coordinate_bridgeâ†’reverse_engineering; style:applied_real_worldâ†’modelling; mechs:[cross_topic_synthesis,hidden_structure,proof_unfamiliar_context]
2026-03-18T07:39:23Z	0.803027	0.801661	-0.001366	discard	mutate [7] skill:FUNC_MODULUSâ†’FUNC_TRANSFORM; arch:spatial_coordinate_bridgeâ†’reverse_engineering; style:applied_real_worldâ†’modelling; mechs:[cross_topic_synthesis,hidden_structure,proof_unfamiliar_context]
2026-03-18T08:29:13Z	0.803027	0.800092	-0.002935	discard	mutate [7] skill:FUNC_MODULUSâ†’FUNC_RATIONAL; arch:spatial_coordinate_bridgeâ†’constraint_optimization_chain; style:applied_real_worldâ†’modelling; mechs:[cross_topic_synthesis,constraint_reasoning,hence_chains]
2026-03-18T09:30:44Z	0.803027	0.802392	-0.000635	discard	mutate [7] skill:FUNC_MODULUSâ†’FUNC_SUM_PRODUCT_ROOTS; arch:spatial_coordinate_bridgeâ†’reverse_engineering; style:applied_real_worldâ†’modelling; mechs:[hidden_structure,hence_chains,proof_unfamiliar_context]
2026-03-18T10:32:27Z	0.803027	0.800239	-0.002788	discard	mutate [7] skill:FUNC_MODULUSâ†’FUNC_RATIONAL; arch:spatial_coordinate_bridgeâ†’constraint_optimization_chain; style:applied_real_worldâ†’modelling; mechs:[constraint_reasoning,hence_chains,proof_unfamiliar_context]
2026-03-18T11:30:41Z	0.000000	0.000000	+0.000000	crash	error: Missing required field: question
2026-03-18T12:07:40Z	0.803027	0.800051	-0.002976	discard	mutate [7] skill:FUNC_MODULUSâ†’FUNC_RATIONAL; arch:spatial_coordinate_bridgeâ†’constraint_optimization_chain; style:applied_real_worldâ†’modelling; mechs:[constraint_reasoning,proof_unfamiliar_context,cross_topic_synthesis,hence_chains]
2026-03-18T13:52:33Z	0.803027	0.800596	-0.002431	discard	mutate [7] skill:FUNC_MODULUSâ†’FUNC_RATIONAL; arch:spatial_coordinate_bridgeâ†’representation_bridge; style:applied_real_worldâ†’modelling; mechs:[hidden_structure,cross_topic_synthesis,multi_representation]
2026-03-18T15:01:51Z	0.803027	0.800135	-0.002892	discard	mutate [7] skill:FUNC_MODULUSâ†’FUNC_RATIONAL; arch:spatial_coordinate_bridgeâ†’constraint_optimization_chain; style:applied_real_worldâ†’modelling; mechs:[cross_topic_synthesis,constraint_reasoning,hence_chains,proof_unfamiliar_context]
2026-03-18T16:18:10Z	0.803027	0.801954	-0.001073	discard	mutate [7] skill:FUNC_MODULUSâ†’FUNC_DOMAIN; arch:spatial_coordinate_bridgeâ†’constraint_optimization_chain; style:applied_real_worldâ†’modelling; mechs:[constraint_reasoning,proof_unfamiliar_context,cross_topic_synthesis]
2026-03-18T17:32:54Z	0.803027	0.802391	-0.000636	discard	mutate [7] skill:FUNC_MODULUSâ†’FUNC_SUM_PRODUCT_ROOTS; arch:spatial_coordinate_bridgeâ†’reverse_engineering; style:applied_real_worldâ†’modelling; mechs:[hidden_structure,cross_topic_synthesis,proof_unfamiliar_context]
2026-03-18T18:34:25Z	0.803027	0.800185	-0.002842	discard	mutate [7] skill:FUNC_MODULUSâ†’FUNC_RATIONAL; arch:spatial_coordinate_bridgeâ†’constraint_optimization_chain; style:applied_real_worldâ†’modelling; mechs:[cross_topic_synthesis,constraint_reasoning,hence_chains,proof_unfamiliar_context]
2026-03-18T19:34:31Z	0.803027	0.800158	-0.002869	discard	mutate [7] skill:FUNC_MODULUSâ†’FUNC_RATIONAL; arch:spatial_coordinate_bridgeâ†’constraint_optimization_chain; style:applied_real_worldâ†’modelling; mechs:[proof_unfamiliar_context,constraint_reasoning,cross_topic_synthesis]
2026-03-18T20:06:06Z	0.803027	0.800770	-0.002257	discard	mutate [7] skill:FUNC_MODULUSâ†’FUNC_RATIONAL; arch:spatial_coordinate_bridgeâ†’constraint_optimization_chain; style:applied_real_worldâ†’modelling; mechs:[cross_topic_synthesis,hence_chains,constraint_reasoning]
2026-03-18T20:55:14Z	0.803027	0.801687	-0.001340	discard	mutate [7] skill:FUNC_MODULUSâ†’FUNC_TRANSFORM; arch:spatial_coordinate_bridgeâ†’reverse_engineering; style:applied_real_worldâ†’modelling; mechs:[hidden_structure,proof_unfamiliar_context]
2026-03-18T21:36:49Z	0.803027	0.802348	-0.000679	discard	mutate [7] skill:FUNC_MODULUSâ†’FUNC_SUM_PRODUCT_ROOTS; arch:spatial_coordinate_bridgeâ†’reverse_engineering; style:applied_real_worldâ†’modelling; mechs:[proof_unfamiliar_context,hidden_structure,cross_topic_synthesis,constraint_reasoning]
2026-03-18T22:03:15Z	0.803027	0.801118	-0.001909	discard	mutate [7] skill:FUNC_MODULUSâ†’FUNC_QUADRATIC; arch:spatial_coordinate_bridgeâ†’constraint_optimization_chain; style:applied_real_worldâ†’modelling; mechs:[cross_topic_synthesis,constraint_reasoning,proof_unfamiliar_context]
2026-03-18T22:48:07Z	0.803027	0.800142	-0.002885	discard	mutate [7] skill:FUNC_MODULUSâ†’FUNC_RATIONAL; arch:spatial_coordinate_bridgeâ†’constraint_optimization_chain; style:applied_real_worldâ†’modelling; mechs:[cross_topic_synthesis,constraint_reasoning,hence_chains]
2026-03-18T23:18:22Z	0.803027	0.800165	-0.002862	discard	mutate [7] skill:FUNC_MODULUSâ†’FUNC_RATIONAL; arch:spatial_coordinate_bridgeâ†’constraint_optimization_chain; style:applied_real_worldâ†’modelling; mechs:[cross_topic_synthesis,hence_chains,proof_unfamiliar_context,constraint_reasoning]
2026-03-18T23:47:23Z	0.803027	0.800065	-0.002962	discard	mutate [7] skill:FUNC_MODULUSâ†’FUNC_RATIONAL; arch:spatial_coordinate_bridgeâ†’constraint_optimization_chain; style:applied_real_worldâ†’modelling; mechs:[cross_topic_synthesis,constraint_reasoning,hence_chains]
2026-03-19T00:04:31Z	0.803027	0.800137	-0.002890	discard	mutate [7] skill:FUNC_MODULUSâ†’FUNC_RATIONAL; arch:spatial_coordinate_bridgeâ†’constraint_optimization_chain; style:applied_real_worldâ†’modelling; mechs:[constraint_reasoning,proof_unfamiliar_context,hence_chains,cross_topic_synthesis]
2026-03-19T03:19:46Z	0.803027	0.800598	-0.002429	discard	mutate [7] skill:FUNC_MODULUSâ†’FUNC_QUADRATIC; arch:spatial_coordinate_bridgeâ†’constraint_optimization_chain; style:applied_real_worldâ†’modelling; mechs:[constraint_reasoning,cross_topic_synthesis,hence_chains]
2026-03-19T05:08:36Z	0.803027	0.800100	-0.002927	discard	mutate [7] skill:FUNC_MODULUSâ†’FUNC_RATIONAL; arch:spatial_coordinate_bridgeâ†’constraint_optimization_chain; style:applied_real_worldâ†’modelling; mechs:[cross_topic_synthesis,constraint_reasoning,hence_chains,proof_unfamiliar_context]
2026-03-19T06:11:37Z	0.803027	0.800072	-0.002955	discard	mutate [7] skill:FUNC_MODULUSâ†’FUNC_RATIONAL; arch:spatial_coordinate_bridgeâ†’constraint_optimization_chain; style:applied_real_worldâ†’modelling; mechs:[cross_topic_synthesis,constraint_reasoning,hence_chains]
2026-03-19T07:15:31Z	0.803027	0.801206	-0.001821	discard	mutate [7] skill:FUNC_MODULUSâ†’FUNC_TRANSFORM; arch:spatial_coordinate_bridgeâ†’reverse_engineering; style:applied_real_worldâ†’modelling; mechs:[cross_topic_synthesis,hidden_structure,proof_unfamiliar_context]
2026-03-19T07:59:23Z	0.803027	0.801432	-0.001595	discard	mutate [7] skill:FUNC_MODULUSâ†’FUNC_QUADRATIC; arch:spatial_coordinate_bridgeâ†’constraint_optimization_chain; style:applied_real_worldâ†’modelling; mechs:[cross_topic_synthesis,constraint_reasoning,proof_unfamiliar_context]
2026-03-19T08:51:35Z	0.803027	0.800134	-0.002893	discard	mutate [7] skill:FUNC_MODULUSâ†’FUNC_RATIONAL; arch:spatial_coordinate_bridgeâ†’constraint_optimization_chain; style:applied_real_worldâ†’modelling; mechs:[constraint_reasoning,hence_chains,proof_unfamiliar_context]
2026-03-19T09:32:27Z	0.000000	0.000000	+0.000000	crash	error: Missing required field: question
2026-03-19T10:24:22Z	0.803027	0.800240	-0.002787	discard	mutate [7] skill:FUNC_MODULUSâ†’FUNC_RATIONAL; arch:spatial_coordinate_bridgeâ†’constraint_optimization_chain; style:applied_real_worldâ†’modelling; mechs:[cross_topic_synthesis,constraint_reasoning,proof_unfamiliar_context]
2026-03-19T11:08:21Z	0.803027	0.802210	-0.000817	discard	mutate [7] skill:FUNC_MODULUSâ†’FUNC_TRANSFORM; arch:spatial_coordinate_bridgeâ†’reverse_engineering; style:applied_real_worldâ†’modelling; mechs:[cross_topic_synthesis,hidden_structure,proof_unfamiliar_context]
2026-03-19T11:50:38Z	0.803027	0.800205	-0.002822	discard	mutate [7] skill:FUNC_MODULUSâ†’FUNC_RATIONAL; arch:spatial_coordinate_bridgeâ†’constraint_optimization_chain; style:applied_real_worldâ†’modelling; mechs:[cross_topic_synthesis,constraint_reasoning,proof_unfamiliar_context]
2026-03-19T12:31:10Z	0.803027	0.800585	-0.002442	discard	mutate [7] skill:FUNC_MODULUSâ†’FUNC_QUADRATIC; arch:spatial_coordinate_bridgeâ†’constraint_optimization_chain; style:applied_real_worldâ†’modelling; mechs:[constraint_reasoning,cross_topic_synthesis,proof_unfamiliar_context]
2026-03-19T13:51:23Z	0.803027	0.801040	-0.001987	discard	mutate [7] skill:FUNC_MODULUSâ†’FUNC_RATIONAL; arch:spatial_coordinate_bridgeâ†’representation_bridge; style:applied_real_worldâ†’modelling; mechs:[multi_representation,hidden_structure,constraint_reasoning]
2026-03-19T14:45:07Z	0.803027	0.800180	-0.002847	discard	mutate [7] skill:FUNC_MODULUSâ†’FUNC_RATIONAL; arch:spatial_coordinate_bridgeâ†’constraint_optimization_chain; style:applied_real_worldâ†’modelling; mechs:[cross_topic_synthesis,constraint_reasoning,proof_unfamiliar_context]
2026-03-19T15:40:01Z	0.803027	0.801097	-0.001930	discard	mutate [7] skill:FUNC_MODULUSâ†’FUNC_TRANSFORM; arch:spatial_coordinate_bridgeâ†’reverse_engineering; style:applied_real_worldâ†’modelling; mechs:[cross_topic_synthesis,hidden_structure,proof_unfamiliar_context]
2026-03-19T16:41:00Z	0.803027	0.800553	-0.002474	discard	mutate [7] skill:FUNC_MODULUSâ†’FUNC_QUADRATIC; arch:spatial_coordinate_bridgeâ†’constraint_optimization_chain; style:applied_real_worldâ†’modelling; mechs:[constraint_reasoning,hence_chains,cross_topic_synthesis,proof_unfamiliar_context]
2026-03-19T17:42:22Z	0.803027	0.800056	-0.002971	discard	mutate [7] skill:FUNC_MODULUSâ†’FUNC_RATIONAL; arch:spatial_coordinate_bridgeâ†’constraint_optimization_chain; style:applied_real_worldâ†’modelling; mechs:[cross_topic_synthesis,constraint_reasoning,proof_unfamiliar_context]
2026-03-19T18:36:36Z	0.803027	0.802155	-0.000872	discard	mutate [7] skill:FUNC_MODULUSâ†’FUNC_TRANSFORM; arch:spatial_coordinate_bridgeâ†’representation_bridge; style:applied_real_worldâ†’modelling; mechs:[cross_topic_synthesis,hidden_structure,proof_unfamiliar_context]
2026-03-19T19:33:19Z	0.803027	0.800571	-0.002456	discard	mutate [7] skill:FUNC_MODULUSâ†’FUNC_QUADRATIC; arch:spatial_coordinate_bridgeâ†’constraint_optimization_chain; style:applied_real_worldâ†’modelling; mechs:[cross_topic_synthesis,constraint_reasoning,proof_unfamiliar_context]
2026-03-19T20:06:01Z	0.803027	0.802511	-0.000516	discard	mutate [7] skill:FUNC_MODULUSâ†’FUNC_SUM_PRODUCT_ROOTS; arch:spatial_coordinate_bridgeâ†’representation_bridge; style:applied_real_worldâ†’modelling; mechs:[cross_topic_synthesis,hidden_structure,proof_unfamiliar_context]
2026-03-19T20:54:47Z	0.803027	0.801328	-0.001699	discard	mutate [7] skill:FUNC_MODULUSâ†’FUNC_TRANSFORM; arch:spatial_coordinate_bridgeâ†’reverse_engineering; style:applied_real_worldâ†’modelling; mechs:[hidden_structure,cross_topic_synthesis,proof_unfamiliar_context]
2026-03-19T21:34:49Z	0.803027	0.800129	-0.002898	discard	mutate [7] skill:FUNC_MODULUSâ†’FUNC_QUADRATIC; arch:spatial_coordinate_bridgeâ†’representation_bridge; style:applied_real_worldâ†’modelling; mechs:[multi_representation,cross_topic_synthesis,constraint_reasoning]
2026-03-19T22:00:10Z	0.803027	0.800017	-0.003010	discard	mutate [7] skill:FUNC_MODULUSâ†’FUNC_RATIONAL; arch:spatial_coordinate_bridgeâ†’constraint_optimization_chain; style:applied_real_worldâ†’modelling; mechs:[constraint_reasoning,proof_unfamiliar_context,cross_topic_synthesis]
2026-03-19T22:37:40Z	0.803027	0.800082	-0.002945	discard	mutate [7] skill:FUNC_MODULUSâ†’FUNC_RATIONAL; arch:spatial_coordinate_bridgeâ†’constraint_optimization_chain; style:applied_real_worldâ†’modelling; mechs:[cross_topic_synthesis,constraint_reasoning,hence_chains]
2026-03-19T23:02:12Z	0.803027	0.801245	-0.001782	discard	mutate [7] skill:FUNC_MODULUSâ†’FUNC_TRANSFORM; arch:spatial_coordinate_bridgeâ†’reverse_engineering; style:applied_real_worldâ†’modelling; mechs:[cross_topic_synthesis,hidden_structure,proof_unfamiliar_context]
2026-03-19T23:42:34Z	0.803027	0.801009	-0.002018	discard	mutate [7] skill:FUNC_MODULUSâ†’FUNC_QUADRATIC; arch:spatial_coordinate_bridgeâ†’constraint_optimization_chain; style:applied_real_worldâ†’modelling; mechs:[constraint_reasoning,cross_topic_synthesis,proof_unfamiliar_context]
2026-03-20T00:03:45Z	0.803027	0.801383	-0.001644	discard	mutate [7] skill:FUNC_MODULUSâ†’FUNC_TRANSFORM; arch:spatial_coordinate_bridgeâ†’reverse_engineering; style:applied_real_worldâ†’modelling; mechs:[hidden_structure,proof_unfamiliar_context,constraint_reasoning]
2026-03-20T02:53:56Z	0.803027	0.801211	-0.001816	discard	mutate [7] skill:FUNC_MODULUSâ†’FUNC_TRANSFORM; arch:spatial_coordinate_bridgeâ†’reverse_engineering; style:applied_real_worldâ†’modelling; mechs:[hidden_structure,constraint_reasoning,proof_unfamiliar_context]
2026-03-20T04:46:03Z	0.803027	0.800110	-0.002917	discard	mutate [7] skill:FUNC_MODULUSâ†’FUNC_RATIONAL; arch:spatial_coordinate_bridgeâ†’constraint_optimization_chain; style:applied_real_worldâ†’modelling; mechs:[constraint_reasoning,proof_unfamiliar_context,cross_topic_synthesis]
