timestamp	old_score	new_score	delta	status	description
2026-04-04T16:57:16Z	0.805718	0.802041	-0.003677	discard	mutate [7] skill:FUNC_QUADRATICâ†’FUNC_TRANSFORM; arch:constraint_optimization_chainâ†’representation_bridge; style:applied_real_worldâ†’modelling; mechs:[cross_topic_synthesis,proof_unfamiliar_context,hidden_structure]
2026-04-04T17:29:47Z	0.805718	0.802833	-0.002885	discard	mutate [7] skill:FUNC_QUADRATICâ†’FUNC_TRANSFORM; arch:constraint_optimization_chainâ†’spatial_coordinate_bridge; style:applied_real_worldâ†’modelling; mechs:[cross_topic_synthesis,hidden_structure,proof_unfamiliar_context]
2026-04-04T17:58:59Z	0.805718	0.802496	-0.003222	discard	mutate [7] skill:FUNC_QUADRATICâ†’FUNC_GRAPH_SKETCH; arch:constraint_optimization_chainâ†’representation_bridge; style:applied_real_worldâ†’modelling; mechs:[multi_representation,proof_unfamiliar_context,hidden_structure]
2026-04-04T18:52:53Z	0.805718	0.802512	-0.003206	discard	mutate [7] skill:FUNC_QUADRATICâ†’FUNC_TRANSFORM; arch:constraint_optimization_chainâ†’spatial_coordinate_bridge; style:applied_real_worldâ†’modelling; mechs:[multi_representation,cross_topic_synthesis,hence_chains]
2026-04-04T19:30:48Z	0.805718	0.804113	-0.001605	discard	mutate [7] skill:FUNC_QUADRATICâ†’FUNC_TRANSFORM; arch:constraint_optimization_chainâ†’spatial_coordinate_bridge; style:applied_real_worldâ†’modelling; mechs:[multi_representation,cross_topic_synthesis,hidden_structure]
2026-04-04T19:56:21Z	0.805718	0.802609	-0.003109	discard	mutate [7] skill:FUNC_QUADRATICâ†’FUNC_GRAPH_SKETCH; arch:constraint_optimization_chainâ†’representation_bridge; style:applied_real_worldâ†’modelling; mechs:[cross_topic_synthesis,multi_representation,hidden_structure]
2026-04-04T20:29:26Z	0.805718	0.803355	-0.002363	discard	mutate [7] skill:FUNC_QUADRATICâ†’FUNC_SUM_PRODUCT_ROOTS; arch:constraint_optimization_chainâ†’representation_bridge; style:applied_real_worldâ†’modelling; mechs:[cross_topic_synthesis,hence_chains,proof_unfamiliar_context]
2026-04-04T20:59:22Z	0.805718	0.802918	-0.002800	discard	mutate [7] skill:FUNC_QUADRATICâ†’FUNC_TRANSFORM; arch:constraint_optimization_chainâ†’spatial_coordinate_bridge; style:applied_real_worldâ†’modelling; mechs:[multi_representation,cross_topic_synthesis,hidden_structure]
2026-04-04T21:38:15Z	0.805718	0.802810	-0.002908	discard	mutate [7] skill:FUNC_QUADRATICâ†’FUNC_TRANSFORM; arch:constraint_optimization_chainâ†’spatial_coordinate_bridge; style:applied_real_worldâ†’modelling; mechs:[multi_representation,cross_topic_synthesis,hidden_structure,proof_unfamiliar_context]
2026-04-04T22:00:21Z	0.805718	0.802445	-0.003273	discard	mutate [7] skill:FUNC_QUADRATICâ†’FUNC_TRANSFORM; arch:constraint_optimization_chainâ†’spatial_coordinate_bridge; style:applied_real_worldâ†’modelling; mechs:[hidden_structure,proof_unfamiliar_context,cross_topic_synthesis]
2026-04-04T22:39:19Z	0.805718	0.802394	-0.003324	discard	mutate [7] skill:FUNC_QUADRATICâ†’FUNC_TRANSFORM; arch:constraint_optimization_chainâ†’spatial_coordinate_bridge; style:applied_real_worldâ†’modelling; mechs:[multi_representation,cross_topic_synthesis,proof_unfamiliar_context]
2026-04-04T23:03:05Z	0.805718	0.803183	-0.002535	discard	mutate [7] skill:FUNC_QUADRATICâ†’FUNC_TRANSFORM; arch:constraint_optimization_chainâ†’spatial_coordinate_bridge; style:applied_real_worldâ†’modelling; mechs:[multi_representation,proof_unfamiliar_context,cross_topic_synthesis]
2026-04-04T23:44:48Z	0.000000	0.000000	+0.000000	crash	JSON parse error: Extra data: line 28 column 1 (char 3548)
2026-04-05T00:04:30Z	0.805718	0.802069	-0.003649	discard	mutate [7] skill:FUNC_QUADRATICâ†’FUNC_GRAPH_SKETCH; arch:constraint_optimization_chainâ†’representation_bridge; style:applied_real_worldâ†’modelling; mechs:[multi_representation,hidden_structure,proof_unfamiliar_context]
2026-04-05T03:36:27Z	0.805718	0.803019	-0.002699	discard	mutate [7] skill:FUNC_QUADRATICâ†’FUNC_TRANSFORM; arch:constraint_optimization_chainâ†’spatial_coordinate_bridge; style:applied_real_worldâ†’modelling; mechs:[multi_representation,cross_topic_synthesis,proof_unfamiliar_context]
2026-04-05T05:33:18Z	0.000000	0.000000	+0.000000	crash	error: Server disconnected without sending a response.
2026-04-05T06:45:20Z	0.805718	0.803752	-0.001966	discard	mutate [7] skill:FUNC_QUADRATICâ†’FUNC_TRANSFORM; arch:constraint_optimization_chainâ†’spatial_coordinate_bridge; style:applied_real_worldâ†’modelling; mechs:[multi_representation,hidden_structure,proof_unfamiliar_context]
2026-04-05T07:43:36Z	0.805718	0.803563	-0.002155	discard	mutate [7] skill:FUNC_QUADRATICâ†’FUNC_TRANSFORM; arch:constraint_optimization_chainâ†’spatial_coordinate_bridge; style:applied_real_worldâ†’modelling; mechs:[multi_representation,cross_topic_synthesis,hidden_structure,proof_unfamiliar_context]
2026-04-05T08:27:10Z	0.805718	0.803538	-0.002180	discard	mutate [7] skill:FUNC_QUADRATICâ†’FUNC_TRANSFORM; arch:constraint_optimization_chainâ†’spatial_coordinate_bridge; style:applied_real_worldâ†’modelling; mechs:[cross_topic_synthesis,multi_representation,proof_unfamiliar_context]
2026-04-05T09:07:50Z	0.805718	0.801869	-0.003849	discard	mutate [7] skill:FUNC_QUADRATICâ†’FUNC_TRANSFORM; arch:constraint_optimization_chainâ†’spatial_coordinate_bridge; style:applied_real_worldâ†’modelling; mechs:[cross_topic_synthesis,proof_unfamiliar_context,hidden_structure]
2026-04-05T09:55:24Z	0.805718	0.802191	-0.003527	discard	mutate [7] skill:FUNC_QUADRATICâ†’FUNC_TRANSFORM; arch:constraint_optimization_chainâ†’spatial_coordinate_bridge; style:applied_real_worldâ†’modelling; mechs:[multi_representation,hidden_structure,cross_topic_synthesis]
2026-04-05T10:32:08Z	0.805718	0.802251	-0.003467	discard	mutate [7] skill:FUNC_QUADRATICâ†’FUNC_TRANSFORM; arch:constraint_optimization_chainâ†’spatial_coordinate_bridge; style:applied_real_worldâ†’modelling; mechs:[cross_topic_synthesis,hidden_structure,proof_unfamiliar_context]
2026-04-05T11:05:30Z	0.805718	0.804080	-0.001638	discard	mutate [7] skill:FUNC_QUADRATICâ†’FUNC_TRANSFORM; arch:constraint_optimization_chainâ†’spatial_coordinate_bridge; style:applied_real_worldâ†’modelling; mechs:[multi_representation,cross_topic_synthesis,proof_unfamiliar_context]
2026-04-05T11:42:10Z	0.805718	0.802513	-0.003205	discard	mutate [7] skill:FUNC_QUADRATICâ†’FUNC_TRANSFORM; arch:constraint_optimization_chainâ†’spatial_coordinate_bridge; style:applied_real_worldâ†’modelling; mechs:[multi_representation,cross_topic_synthesis,proof_unfamiliar_context,hence_chains]
2026-04-05T12:03:24Z	0.805718	0.803081	-0.002637	discard	mutate [7] skill:FUNC_QUADRATICâ†’FUNC_TRANSFORM; arch:constraint_optimization_chainâ†’representation_bridge; style:applied_real_worldâ†’modelling; mechs:[multi_representation,cross_topic_synthesis,hidden_structure]
2026-04-05T13:20:58Z	0.805718	0.803510	-0.002208	discard	mutate [7] skill:FUNC_QUADRATICâ†’FUNC_TRANSFORM; arch:constraint_optimization_chainâ†’spatial_coordinate_bridge; style:applied_real_worldâ†’modelling; mechs:[multi_representation,cross_topic_synthesis,proof_unfamiliar_context,hence_chains]
2026-04-05T14:03:45Z	0.805718	0.802753	-0.002965	discard	mutate [7] skill:FUNC_QUADRATICâ†’FUNC_TRANSFORM; arch:constraint_optimization_chainâ†’spatial_coordinate_bridge; style:applied_real_worldâ†’modelling; mechs:[multi_representation,cross_topic_synthesis,hidden_structure]
2026-04-05T14:52:19Z	0.805718	0.802251	-0.003467	discard	mutate [7] skill:FUNC_QUADRATICâ†’FUNC_TRANSFORM; arch:constraint_optimization_chainâ†’spatial_coordinate_bridge; style:applied_real_worldâ†’modelling; mechs:[cross_topic_synthesis,hidden_structure,proof_unfamiliar_context]
2026-04-05T15:31:45Z	0.805718	0.802642	-0.003076	discard	mutate [7] skill:FUNC_QUADRATICâ†’FUNC_TRANSFORM; arch:constraint_optimization_chainâ†’spatial_coordinate_bridge; style:applied_real_worldâ†’modelling; mechs:[cross_topic_synthesis,multi_representation,proof_unfamiliar_context]
2026-04-05T16:01:52Z	0.805718	0.802581	-0.003137	discard	mutate [7] skill:FUNC_QUADRATICâ†’FUNC_GRAPH_SKETCH; arch:constraint_optimization_chainâ†’representation_bridge; style:applied_real_worldâ†’modelling; mechs:[multi_representation,hidden_structure,cross_topic_synthesis]
2026-04-05T16:52:42Z	0.805718	0.803283	-0.002435	discard	mutate [7] skill:FUNC_QUADRATICâ†’FUNC_TRANSFORM; arch:constraint_optimization_chainâ†’spatial_coordinate_bridge; style:applied_real_worldâ†’modelling; mechs:[cross_topic_synthesis,hidden_structure,proof_unfamiliar_context]
2026-04-05T17:29:28Z	0.805718	0.802480	-0.003238	discard	mutate [7] skill:FUNC_QUADRATICâ†’FUNC_TRANSFORM; arch:constraint_optimization_chainâ†’representation_bridge; style:applied_real_worldâ†’modelling; mechs:[multi_representation,hidden_structure,proof_unfamiliar_context]
2026-04-05T18:00:48Z	0.805718	0.802853	-0.002865	discard	mutate [7] skill:FUNC_QUADRATICâ†’FUNC_TRANSFORM; arch:constraint_optimization_chainâ†’representation_bridge; style:applied_real_worldâ†’modelling; mechs:[hidden_structure,multi_representation,cross_topic_synthesis]
2026-04-05T18:57:42Z	0.805718	0.802814	-0.002904	discard	mutate [7] skill:FUNC_QUADRATICâ†’FUNC_TRANSFORM; arch:constraint_optimization_chainâ†’spatial_coordinate_bridge; style:applied_real_worldâ†’modelling; mechs:[cross_topic_synthesis,hidden_structure,proof_unfamiliar_context]
2026-04-05T19:35:26Z	0.805718	0.803292	-0.002426	discard	mutate [7] skill:FUNC_QUADRATICâ†’FUNC_SUM_PRODUCT_ROOTS; arch:constraint_optimization_chainâ†’representation_bridge; style:applied_real_worldâ†’modelling; mechs:[cross_topic_synthesis,hidden_structure,hence_chains]
2026-04-05T19:59:25Z	0.805718	0.802059	-0.003659	discard	mutate [7] skill:FUNC_QUADRATICâ†’FUNC_TRANSFORM; arch:constraint_optimization_chainâ†’spatial_coordinate_bridge; style:applied_real_worldâ†’modelling; mechs:[multi_representation,cross_topic_synthesis,hidden_structure]
2026-04-05T20:42:11Z	0.805718	0.803364	-0.002354	discard	mutate [7] skill:FUNC_QUADRATICâ†’FUNC_TRANSFORM; arch:constraint_optimization_chainâ†’spatial_coordinate_bridge; style:applied_real_worldâ†’modelling; mechs:[multi_representation,cross_topic_synthesis,hidden_structure]
2026-04-05T21:17:20Z	0.805718	0.802062	-0.003656	discard	mutate [7] skill:FUNC_QUADRATICâ†’FUNC_TRANSFORM; arch:constraint_optimization_chainâ†’spatial_coordinate_bridge; style:applied_real_worldâ†’modelling; mechs:[multi_representation,cross_topic_synthesis,proof_unfamiliar_context]
2026-04-05T21:49:59Z	0.805718	0.801998	-0.003720	discard	mutate [7] skill:FUNC_QUADRATICâ†’FUNC_TRANSFORM; arch:constraint_optimization_chainâ†’spatial_coordinate_bridge; style:applied_real_worldâ†’modelling; mechs:[cross_topic_synthesis,hidden_structure,proof_unfamiliar_context]
2026-04-05T22:16:47Z	0.805718	0.803139	-0.002579	discard	mutate [7] skill:FUNC_QUADRATICâ†’FUNC_TRANSFORM; arch:constraint_optimization_chainâ†’spatial_coordinate_bridge; style:applied_real_worldâ†’modelling; mechs:[multi_representation,proof_unfamiliar_context,hidden_structure]
2026-04-05T22:54:44Z	0.805718	0.801962	-0.003756	discard	mutate [7] skill:FUNC_QUADRATICâ†’FUNC_TRANSFORM; arch:constraint_optimization_chainâ†’spatial_coordinate_bridge; style:applied_real_worldâ†’modelling; mechs:[hidden_structure,multi_representation,proof_unfamiliar_context]
2026-04-05T23:32:26Z	0.805718	0.803170	-0.002548	discard	mutate [7] skill:FUNC_QUADRATICâ†’FUNC_TRANSFORM; arch:constraint_optimization_chainâ†’spatial_coordinate_bridge; style:applied_real_worldâ†’modelling; mechs:[multi_representation,hidden_structure,cross_topic_synthesis]
2026-04-06T00:02:46Z	0.805718	0.802682	-0.003036	discard	mutate [7] skill:FUNC_QUADRATICâ†’FUNC_GRAPH_SKETCH; arch:constraint_optimization_chainâ†’representation_bridge; style:applied_real_worldâ†’modelling; mechs:[multi_representation,hidden_structure,proof_unfamiliar_context]
2026-04-06T03:38:13Z	0.805718	0.803942	-0.001776	discard	mutate [7] skill:FUNC_QUADRATICâ†’FUNC_TRANSFORM; arch:constraint_optimization_chainâ†’spatial_coordinate_bridge; style:applied_real_worldâ†’modelling; mechs:[cross_topic_synthesis,proof_unfamiliar_context,multi_representation]
2026-04-06T05:51:13Z	0.805718	0.802109	-0.003609	discard	mutate [7] skill:FUNC_QUADRATICâ†’FUNC_TRANSFORM; arch:constraint_optimization_chainâ†’spatial_coordinate_bridge; style:applied_real_worldâ†’modelling; mechs:[cross_topic_synthesis,multi_representation,hidden_structure]
2026-04-06T07:14:42Z	0.805718	0.803267	-0.002451	discard	mutate [7] skill:FUNC_QUADRATICâ†’FUNC_TRANSFORM; arch:constraint_optimization_chainâ†’spatial_coordinate_bridge; style:applied_real_worldâ†’modelling; mechs:[hidden_structure,proof_unfamiliar_context,multi_representation]
2026-04-06T08:49:26Z	0.805718	0.803187	-0.002531	discard	mutate [7] skill:FUNC_QUADRATICâ†’FUNC_TRANSFORM; arch:constraint_optimization_chainâ†’spatial_coordinate_bridge; style:applied_real_worldâ†’modelling; mechs:[proof_unfamiliar_context,cross_topic_synthesis,hidden_structure,multi_representation]
2026-04-06T09:56:59Z	0.805718	0.803311	-0.002407	discard	mutate [7] skill:FUNC_QUADRATICâ†’FUNC_TRANSFORM; arch:constraint_optimization_chainâ†’spatial_coordinate_bridge; style:applied_real_worldâ†’modelling; mechs:[multi_representation,cross_topic_synthesis,proof_unfamiliar_context]
2026-04-06T10:56:03Z	0.805718	0.803404	-0.002314	discard	mutate [7] skill:FUNC_QUADRATICâ†’FUNC_TRANSFORM; arch:constraint_optimization_chainâ†’representation_bridge; style:applied_real_worldâ†’modelling; mechs:[hidden_structure,multi_representation,proof_unfamiliar_context]
2026-04-06T11:47:41Z	0.805718	0.802175	-0.003543	discard	mutate [7] skill:FUNC_QUADRATICâ†’FUNC_TRANSFORM; arch:constraint_optimization_chainâ†’spatial_coordinate_bridge; style:applied_real_worldâ†’modelling; mechs:[multi_representation,cross_topic_synthesis,proof_unfamiliar_context]
2026-04-06T12:39:44Z	0.805718	0.803183	-0.002535	discard	mutate [7] skill:FUNC_QUADRATICâ†’FUNC_TRANSFORM; arch:constraint_optimization_chainâ†’spatial_coordinate_bridge; style:applied_real_worldâ†’modelling; mechs:[hidden_structure,cross_topic_synthesis,multi_representation,proof_unfamiliar_context]
2026-04-06T13:58:28Z	0.805718	0.803095	-0.002623	discard	mutate [7] skill:FUNC_QUADRATICâ†’FUNC_TRANSFORM; arch:constraint_optimization_chainâ†’spatial_coordinate_bridge; style:applied_real_worldâ†’modelling; mechs:[proof_unfamiliar_context,cross_topic_synthesis,hidden_structure]
2026-04-06T14:53:20Z	0.805718	0.803254	-0.002464	discard	mutate [7] skill:FUNC_QUADRATICâ†’FUNC_INVERSE; arch:constraint_optimization_chainâ†’spatial_coordinate_bridge; style:applied_real_worldâ†’modelling; mechs:[multi_representation,hidden_structure,proof_unfamiliar_context]
2026-04-06T15:44:28Z	0.805718	0.803541	-0.002177	discard	mutate [7] skill:FUNC_QUADRATICâ†’FUNC_TRANSFORM; arch:constraint_optimization_chainâ†’spatial_coordinate_bridge; style:applied_real_worldâ†’modelling; mechs:[multi_representation,cross_topic_synthesis,proof_unfamiliar_context,hence_chains]
2026-04-06T16:33:20Z	0.805718	0.802003	-0.003715	discard	mutate [7] skill:FUNC_QUADRATICâ†’FUNC_TRANSFORM; arch:constraint_optimization_chainâ†’spatial_coordinate_bridge; style:applied_real_worldâ†’modelling; mechs:[multi_representation,cross_topic_synthesis,proof_unfamiliar_context]
2026-04-06T17:30:17Z	0.805718	0.802504	-0.003214	discard	mutate [7] skill:FUNC_QUADRATICâ†’FUNC_TRANSFORM; arch:constraint_optimization_chainâ†’spatial_coordinate_bridge; style:applied_real_worldâ†’modelling; mechs:[multi_representation,hidden_structure,cross_topic_synthesis,proof_unfamiliar_context]
2026-04-06T18:32:52Z	0.805718	0.802758	-0.002960	discard	mutate [7] skill:FUNC_QUADRATICâ†’FUNC_TRANSFORM; arch:constraint_optimization_chainâ†’spatial_coordinate_bridge; style:applied_real_worldâ†’modelling; mechs:[multi_representation,cross_topic_synthesis,proof_unfamiliar_context]
2026-04-06T19:40:29Z	0.805718	0.802959	-0.002759	discard	mutate [7] skill:FUNC_QUADRATICâ†’FUNC_TRANSFORM; arch:constraint_optimization_chainâ†’spatial_coordinate_bridge; style:applied_real_worldâ†’modelling; mechs:[multi_representation,cross_topic_synthesis,proof_unfamiliar_context]
2026-04-06T20:24:35Z	0.805718	0.801266	-0.004452	discard	mutate [7] skill:FUNC_QUADRATICâ†’FUNC_TRANSFORM; arch:constraint_optimization_chainâ†’spatial_coordinate_bridge; style:applied_real_worldâ†’modelling; mechs:[cross_topic_synthesis,hidden_structure,proof_unfamiliar_context]
2026-04-06T21:03:24Z	0.805718	0.802826	-0.002892	discard	mutate [7] skill:FUNC_QUADRATICâ†’FUNC_TRANSFORM; arch:constraint_optimization_chainâ†’spatial_coordinate_bridge; style:applied_real_worldâ†’modelling; mechs:[cross_topic_synthesis,multi_representation,hidden_structure,proof_unfamiliar_context]
2026-04-06T21:50:06Z	0.805718	0.802898	-0.002820	discard	mutate [7] skill:FUNC_QUADRATICâ†’FUNC_TRANSFORM; arch:constraint_optimization_chainâ†’spatial_coordinate_bridge; style:applied_real_worldâ†’modelling; mechs:[multi_representation,cross_topic_synthesis,hidden_structure,proof_unfamiliar_context]
2026-04-06T22:22:33Z	0.805718	0.803417	-0.002301	discard	mutate [7] skill:FUNC_QUADRATICâ†’FUNC_TRANSFORM; arch:constraint_optimization_chainâ†’spatial_coordinate_bridge; style:applied_real_worldâ†’modelling; mechs:[cross_topic_synthesis,multi_representation,proof_unfamiliar_context]
2026-04-06T23:03:55Z	0.805718	0.802913	-0.002805	discard	mutate [7] skill:FUNC_QUADRATICâ†’FUNC_TRANSFORM; arch:constraint_optimization_chainâ†’spatial_coordinate_bridge; style:applied_real_worldâ†’modelling; mechs:[cross_topic_synthesis,multi_representation,hence_chains,proof_unfamiliar_context]
2026-04-06T23:50:32Z	0.805718	0.802389	-0.003329	discard	mutate [7] skill:FUNC_QUADRATICâ†’FUNC_TRANSFORM; arch:constraint_optimization_chainâ†’spatial_coordinate_bridge; style:applied_real_worldâ†’modelling; mechs:[cross_topic_synthesis,proof_unfamiliar_context,hidden_structure]
2026-04-07T01:06:17Z	0.805718	0.801549	-0.004169	discard	mutate [7] skill:FUNC_QUADRATICâ†’FUNC_TRANSFORM; arch:constraint_optimization_chainâ†’generalization_from_special_case; style:applied_real_worldâ†’modelling; mechs:[hidden_structure,hence_chains,proof_unfamiliar_context]
2026-04-07T04:05:42Z	0.805718	0.802051	-0.003667	discard	mutate [7] skill:FUNC_QUADRATICâ†’FUNC_TRANSFORM; arch:constraint_optimization_chainâ†’spatial_coordinate_bridge; style:applied_real_worldâ†’modelling; mechs:[multi_representation,hidden_structure,proof_unfamiliar_context]
2026-04-07T05:54:43Z	0.805718	0.803253	-0.002465	discard	mutate [7] skill:FUNC_QUADRATICâ†’FUNC_TRANSFORM; arch:constraint_optimization_chainâ†’spatial_coordinate_bridge; style:applied_real_worldâ†’modelling; mechs:[cross_topic_synthesis,multi_representation,hidden_structure]
2026-04-07T07:13:28Z	0.805718	0.802209	-0.003509	discard	mutate [7] skill:FUNC_QUADRATICâ†’FUNC_TRANSFORM; arch:constraint_optimization_chainâ†’spatial_coordinate_bridge; style:applied_real_worldâ†’modelling; mechs:[cross_topic_synthesis,multi_representation,proof_unfamiliar_context]
2026-04-07T08:41:08Z	0.805718	0.803039	-0.002679	discard	mutate [7] skill:FUNC_QUADRATICâ†’FUNC_TRANSFORM; arch:constraint_optimization_chainâ†’representation_bridge; style:applied_real_worldâ†’modelling; mechs:[multi_representation,hidden_structure,proof_unfamiliar_context]
2026-04-07T09:50:25Z	0.805718	0.803063	-0.002655	discard	mutate [7] skill:FUNC_QUADRATICâ†’FUNC_TRANSFORM; arch:constraint_optimization_chainâ†’spatial_coordinate_bridge; style:applied_real_worldâ†’modelling; mechs:[cross_topic_synthesis,hidden_structure,proof_unfamiliar_context]
2026-04-07T10:44:46Z	0.805718	0.801474	-0.004244	discard	mutate [7] skill:FUNC_QUADRATICâ†’FUNC_TRANSFORM; arch:constraint_optimization_chainâ†’spatial_coordinate_bridge; style:applied_real_worldâ†’modelling; mechs:[proof_unfamiliar_context,hidden_structure,multi_representation,cross_topic_synthesis]
2026-04-07T11:42:09Z	0.805718	0.802797	-0.002921	discard	mutate [7] skill:FUNC_QUADRATICâ†’FUNC_TRANSFORM; arch:constraint_optimization_chainâ†’spatial_coordinate_bridge; style:applied_real_worldâ†’modelling; mechs:[multi_representation,cross_topic_synthesis,proof_unfamiliar_context]
2026-04-07T12:47:55Z	0.805718	0.802624	-0.003094	discard	mutate [7] skill:FUNC_QUADRATICâ†’FUNC_GRAPH_SKETCH; arch:constraint_optimization_chainâ†’representation_bridge; style:applied_real_worldâ†’modelling; mechs:[cross_topic_synthesis,multi_representation,proof_unfamiliar_context]
2026-04-07T14:19:28Z	0.000000	0.000000	+0.000000	crash	error: 503 UNAVAILABLE. {'error': {'code': 503, 'message': 'This model is currently experiencing high deman
2026-04-07T15:50:28Z	0.805718	0.802188	-0.003530	discard	mutate [7] skill:FUNC_QUADRATICâ†’FUNC_TRANSFORM; arch:constraint_optimization_chainâ†’spatial_coordinate_bridge; style:applied_real_worldâ†’modelling; mechs:[multi_representation,hidden_structure,proof_unfamiliar_context]
2026-04-07T16:42:50Z	0.000000	0.000000	+0.000000	crash	error: 503 UNAVAILABLE. {'error': {'code': 503, 'message': 'This model is currently experiencing high deman
2026-04-07T17:45:01Z	0.805718	0.803497	-0.002221	discard	mutate [7] skill:FUNC_QUADRATICâ†’FUNC_TRANSFORM; arch:constraint_optimization_chainâ†’spatial_coordinate_bridge; style:applied_real_worldâ†’modelling; mechs:[multi_representation,cross_topic_synthesis,proof_unfamiliar_context]
2026-04-07T18:41:59Z	0.805718	0.803184	-0.002534	discard	mutate [7] skill:FUNC_QUADRATICâ†’FUNC_TRANSFORM; arch:constraint_optimization_chainâ†’spatial_coordinate_bridge; style:applied_real_worldâ†’modelling; mechs:[multi_representation,cross_topic_synthesis,proof_unfamiliar_context]
2026-04-07T19:46:51Z	0.805718	0.802376	-0.003342	discard	mutate [7] skill:FUNC_QUADRATICâ†’FUNC_TRANSFORM; arch:constraint_optimization_chainâ†’spatial_coordinate_bridge; style:applied_real_worldâ†’modelling; mechs:[cross_topic_synthesis,multi_representation,hence_chains,proof_unfamiliar_context]
